link, desig, details, org, loc, exp, keyskills, descl, salary, date, expLow, expHigh, salLow, salHigh 
https://www.naukri.com/job-listings-Data-Scientist-R-Statistical-Modelling-IIT-NIT-Kafal-Software-Delhi-NCR-4-to-9-years-030418901306?src=jobsearchDesk&sid=15229212699069&xp=1&px=1,Data Scientist - R/ Statistical Modelling - IIT/ NIT,Data Scientist - R/ Statistical Modelling - IIT/ NIT,Kafal Software,Delhi NCR,4-9 yrs,Data Analysis- Data Mining- R- Statistical Modeling- Machine Learning...,Data Scientist - R/Statistical Modelling - IIT/NIT (4-9 yrs)  Job Description  The role ...,Not disclosed,2018-04-05,4,9,0,0
https://www.naukri.com/job-listings-Data-Scientist-R-Python-Yantriks-Bengaluru-2-to-7-years-030418901379?src=jobsearchDesk&sid=15229212699069&xp=2&px=1,Data Scientist - R/ Python,Data Scientist - R/ Python,Yantriks,Bengaluru,2-7 yrs,Machine Learning- Python- R- MATLAB- SQL- Multivariate Analysis...,Data Scientist - R/Python (2-7 yrs)  DESCRIPTION :  - As a Data Scientist at Yantriks- ...,Not disclosed,2018-04-05,2,7,0,0
https://www.naukri.com/job-listings-Junior-Data-Scientists-INNOVIZANT-ANALYTICS-PRIVATE-LIMITED-Noida-0-to-3-years-150318005542?src=jobsearchDesk&sid=15229212699069&xp=3&px=1,Junior Data Scientists,Junior Data Scientists,INNOVIZANT ANALYTICS PRIVATE LIMITED,Noida,0-3 yrs,data science- predictive modeling- machine learning- python...,We are looking for Data Scientists with 0-3 years of experience in Data Science / Machine Learning / ...,Not disclosed,2018-04-05,0,3,0,0
https://www.naukri.com/job-listings-Lead-Data-Scientist-R-python-Predictive-Modelling-TransOrg-Analytics-Mumbai-5-to-8-years-040418900676?src=jobsearchDesk&sid=15229212699069&xp=4&px=1,Lead - Data Scientist - R/python & Predictive Modelling,Lead - Data Scientist - R/python & Predictive Modelling,TransOrg Analytics,Mumbai,5-8 yrs,SAS SQL- R- Predictive Modeling- Logistic Regression- Data Analysis..., Overview    Analyze & interpret data and communicate results to clients- often with ...,Not disclosed,2018-04-05,5,8,0,0
https://www.naukri.com/job-listings-Data-Scientists-Analysts-BSM-Big-Social-Media-Bhopal-4-to-5-years-050418900585?src=jobsearchDesk&sid=15229212699069&xp=5&px=1,Data Scientists / Analysts,Data Scientists / Analysts,BSM Big Social Media,Bhopal,4-5 yrs,data analysis- big data- big data analysis- research analyst- analysts...,1. Should be able to do big data analysis. 2. Should be able to understand numbers- should be able ...,Not disclosed,2018-04-05,4,5,0,0
https://www.naukri.com/job-listings-Data-Scientist-Larsen-Toubro-Infotech-Limited-Ghaziabad-5-to-8-years-040418900809?src=jobsearchDesk&sid=15229212699069&xp=6&px=1,Data Scientist,Data Scientist,Larsen & Toubro Infotech Limited,Ghaziabad,5-8 yrs,r- hadoop- sas- hive- cluster analysis- advanced excel- ms sql- statistical..., ,Not disclosed,2018-04-04,5,8,0,0
https://www.naukri.com/job-listings-Data-Scientist-Data-Analyst-2-5-Years-Experience-Wolters-Kluwer-India-Pvt-Ltd-Pune-Kalyani-Nagar-2-to-6-years-030418006827?src=jobsearchDesk&sid=15229212699069&xp=7&px=1,Data Scientist / Data Analyst 2-5 Years Experience,Data Scientist / Data Analyst 2-5 Years Experience,Wolters Kluwer India Pvt Ltd,Pune(Kalyani Nagar),2-6 yrs,ML- Machine Learning- data science- algorithms- Linear Regression..., Education:   Bachelors/ Master's degree- preferably in Computer Science- Mathematics- ...,Not disclosed,2018-04-05,2,6,0,0
https://www.naukri.com/job-listings-Data-Scientist-Confidential-Bengaluru-2-to-7-years-170717902169?src=jobsearchDesk&sid=15229212699069&xp=8&px=1,Data Scientist,Data Scientist,Confidential,Bengaluru,2-7 yrs,Underwriting- Risk management- SAS- SQL- Business Analyst...,    Responsibility:     Work with Modeling teams and LoB actuary teams to validate and ...,Not disclosed,2018-04-05,2,7,0,0
https://www.naukri.com/job-listings-Data-Scientist-mumbai-Client-Of-Sampoorna-Mumbai-3-to-8-years-050418900146?src=jobsearchDesk&sid=15229212699069&xp=9&px=1,Data Scientist - (mumbai),Data Scientist - (mumbai),Client Of Sampoorna,Mumbai,3-8 yrs,Machine Learning- Artificial Intelligence- Data Science...,Our client is looking for candidates for Data Scientist role .     Desired candidate should have ...,Not disclosed,2018-04-05,3,8,0,0
https://www.naukri.com/job-listings-Data-Scientist-Confidential-Bengaluru-2-to-5-years-120617901827?src=jobsearchDesk&sid=15229212699069&xp=10&px=1,Data Scientist,Data Scientist,Confidential,Bengaluru,2-5 yrs,Underwriting- Risk management- SAS- SQL- Business Analyst...,    Responsibility:    Work with Modeling teams and LoB actuary teams to validate and ...,Not disclosed,2018-04-05,2,5,0,0
https://www.naukri.com/job-listings-Data-Scientist-Performance-Analytics-Machine-Learning-data-Mining-Mumbai-Pune-10-to-20-years-040418901313?src=jobsearchDesk&sid=15229212699069&xp=11&px=1,Data Scientist - Performance Analytics - Machine Learning/data Mining,Data Scientist - Performance Analytics - Machine Learning/data Mining,Premium,Mumbai- Pune,10-20 yrs,Data Mining- Data Scientist- Analytics- Machine Learning...,Performance Analytics (Data Scientist)  - At least 8+ years of work experience. ...,Not disclosed,2018-04-05,10,20,0,0
https://www.naukri.com/job-listings-Data-Scientist-Machine-Learning-Pune-10-to-14-years-030418901039?src=jobsearchDesk&sid=15229212699069&xp=12&px=1,Data Scientist - Machine Learning,Data Scientist - Machine Learning,Premium,Pune,10-14 yrs,Deep Learning- Machine Learning- Neural Networks- Computer Vision...,Data Scientist - Machine Learning (10-14 yrs)  Exp-10-14 Years   Location-Pune ...,Not disclosed,2018-04-05,10,14,0,0
https://www.naukri.com/job-listings-Lead-Data-Scientist-Leading-Company-Ahmedabad-Hector-and-Streak-Consulting-Pvt-Ltd-Ahmedabad-14-to-24-years-030418005696?src=jobsearchDesk&sid=15229212699069&xp=13&px=1,Lead Data Scientist - Leading Company - Ahmedabad,Lead Data Scientist - Leading Company - Ahmedabad,Hector and Streak Consulting Pvt Ltd,Ahmedabad,14-24 yrs,Data Analysis- Data Mining- Big Data- Artificial Intelligence- DATA ANALYST...,Should be working as Data Scientist or Data Analyst 	Strong in AI- Robotic- Machines- Big Data- Data ...,Not disclosed,2018-04-05,14,24,0,0
https://www.naukri.com/job-listings-Urgent-Opening-for-Senior-Data-Scientist-Iris-Corporate-Solutions-Pvt-Ltd-Bengaluru-11-to-15-years-030418007525?src=jobsearchDesk&sid=15229212699069&xp=14&px=1,Urgent Opening for Senior Data Scientist,Urgent Opening for Senior Data Scientist,Iris Corporate Solutions Pvt. Ltd.,Bengaluru,11-15 yrs,Machine Learning- Data Science- Data Mining- Artificial Intelligence...,Required Skills and Experience:      12-15years of experience in the area of data ...,Not disclosed,2018-04-05,11,15,0,0
https://www.naukri.com/job-listings-Data-Scientist-Mumbai-1-to-5-years-050418900354?src=jobsearchDesk&sid=15229212699069&xp=15&px=1,Data Scientist,Data Scientist,Premium,Mumbai,1-5 yrs,Data Scientist- Digital analytics- Financial analytics- Customer analytics-...,Purpose of the job  THE team acts as a central consulting and product development hub for all ...,Not disclosed,2018-04-05,1,5,0,0
https://www.naukri.com/job-listings-Software-Engineering-Data-Scientists-JPMorgan-Chase-Bengaluru-1-to-5-years-040418900548?src=jobsearchDesk&sid=15229212699069&xp=16&px=1,Software Engineering - Data Scientists,Software Engineering - Data Scientists,JPMorgan Chase,Bengaluru,1-5 yrs,SQL- Python- Data structures- Workflow- Algorithms- Machine learning...,EVEREST SOFTWARE ENGINEERING   As a member of our Everest Engineering Group you will be in the ...,Not disclosed,2018-04-04,1,5,0,0
https://www.naukri.com/job-listings-Hiring-Data-Scientist-Bangalore-Ecentric-Solutions-Pvt-Ltd-Bengaluru-8-to-10-years-040418008310?src=jobsearchDesk&sid=15229212699069&xp=17&px=1,Hiring Data Scientist - Bangalore,Hiring Data Scientist - Bangalore,Ecentric Solutions Pvt. Ltd.,Bengaluru,8-10 yrs,Data Scientist- R- Python- R Language, ,Not disclosed,2018-04-04,8,10,0,0
https://www.naukri.com/job-listings-Data-Scientist-AWS-Xtensible-Software-Technologies-Pvt-Ltd-Pune-3-to-8-years-040418900096?src=jobsearchDesk&sid=15229212699069&xp=18&px=1,Data Scientist AWS,Data Scientist AWS,Xtensible Software Technologies Pvt Ltd,Pune,3-8 yrs,Machine Learning- Python- Data Science- Algorithms,Data Science/ Python/ ML (Machine Learning) Algorithms/ Statistics ...,Not disclosed,2018-04-04,3,8,0,0
https://www.naukri.com/job-listings-Urgent-Opening-for-Data-Scientist-at-Bangalore-Stratosphere-IT-Services-Pvt-Ltd-Bengaluru-5-to-7-years-040418006413?src=jobsearchDesk&sid=15229212699069&xp=19&px=1,Urgent Opening for Data Scientist at Bangalore,Urgent Opening for Data Scientist at Bangalore,Stratosphere IT Services Pvt. Ltd.,Bengaluru,5-7 yrs,Data Science- R- Machine Learning- Data Scientist,Urgent Opening for Data scientist at Bangalore-contract to hire  client-MNC work location ...,Not disclosed,2018-04-04,5,7,0,0
https://www.naukri.com/job-listings-Immediate-Openings-on-Data-Scientist-for-an-MNC-Company-Vzen-Technologies-Bengaluru-2-to-4-years-040418000533?src=jobsearchDesk&sid=15229212699069&xp=20&px=1,Immediate Job Openings on Data Scientist for an MNC Company,Immediate Job Openings on Data Scientist for an MNC Company,Vzen Technologies,Bengaluru,2-4 yrs,Data Analysis- Forecasting- Data Scientist- Machine Learning- R- MATLAB...,Hi all-    Greetings for the day-     We have openings on ...,Not disclosed,2018-04-04,2,4,0,0
https://www.naukri.com/job-listings-Senior-Data-Scientist-Machine-Learning-Pune-10-to-17-years-030418900500?src=jobsearchDesk&sid=15229212699069&xp=21&px=1,Senior Data Scientist - Machine Learning,Senior Data Scientist - Machine Learning,Premium,Pune,10-17 yrs,Deep Learning- Hadoop- Hive- Java- Data Science- Spark- Machine Learning...,Senior Data Scientist - Machine Learning (10-17 yrs)  Data Mining- Deep learning and deep ...,Not disclosed,2018-04-04,10,17,0,0
https://www.naukri.com/job-listings-Data-Scientist-PeopleStrong-HR-Services-Pvt-Ltd-Mumbai-3-to-8-years-281217001814?src=jobsearchDesk&sid=15229212699069&xp=22&px=1,Data Scientist,Data Scientist,PeopleStrong HR Services Pvt. Ltd.,Mumbai,3-8 yrs,Hive- Data Science- Machine Learning- R- SQL- Data Mining- Algorithms- Data...,Hiring for the one the Elite company for the Mumbai location  Job Responsibilities: ...,Not disclosed,2018-04-04,3,8,0,0
https://www.naukri.com/job-listings-Urgent-Opening-for-the-Position-of-Data-Scientist-Andheri-Location-iQuest-Management-Consultants-Pvt-Ltd-Mumbai-Mumbai-Suburbs-Navi-Mumbai-2-to-7-years-270318007312?src=jobsearchDesk&sid=15229212699069&xp=23&px=1,Urgent Opening for the Position of Data Scientist - Andheri Location,Urgent Opening for the Position of Data Scientist - Andheri Location,iQuest Management Consultants Pvt. Ltd,Mumbai- Mumbai Suburbs- Navi Mumbai,2-7 yrs,r- machine learning- python- predictive modeling- statistical programming...,Building complex systems using R-language         Must have fundamental knowledge of Inferential ...,500000 - 1500000 P.A.,2018-04-04,2,7,500000,1500000
https://www.naukri.com/job-listings-Senior-Data-Scientist-Noida-Uttar-Pradesh-Optum-a-UnitedHealth-Group-Company-Noida-4-to-9-years-030418900792?src=jobsearchDesk&sid=15229212699069&xp=24&px=1,Senior Data Scientist - Noida Uttar Pradesh,Senior Data Scientist - Noida Uttar Pradesh,Optum a UnitedHealth Group Company,Noida,4-9 yrs,Senior Data Scientist - Noida- Uttar Pradesh,Primary Responsibilities:     Work closely with analysts and senior analysts as lead on one or ...,Not disclosed,2018-04-04,4,9,0,0
https://www.naukri.com/job-listings-Data-Scientist-Myntra-Designs-Pvt-Ltd-Bengaluru-4-to-8-years-030418900682?src=jobsearchDesk&sid=15229212699069&xp=25&px=1,Data Scientist,Data Scientist,Myntra Designs Pvt. Ltd.,Bengaluru,4-8 yrs,Machine Learning- Natural Language Processing- Information Retrieval- NLP...,Roles & Responsibilities:  As a data scientist- you will have the opportunity to leverage ...,Not disclosed,2018-04-04,4,8,0,0
https://www.naukri.com/job-listings-data-Scientist-RANDSTAD-INDIA-PVT-LTD-Chennai-3-to-5-years-140817901151?src=jobsearchDesk&sid=15229212699069&xp=26&px=1,data Scientist,data Scientist,RANDSTAD INDIA PVT LTD,Chennai,3-5 yrs,data analysis- Customer Service- Help Desk- Information- Telephony support-...,This position is within the Finance Operations Data Analytics team. The team is tasked with delivering ...,Not disclosed,2018-04-04,3,5,0,0
https://www.naukri.com/job-listings-Data-Scientist-PeopleStrong-HR-Services-Pvt-Ltd-Bengaluru-6-to-10-years-080716006451?src=jobsearchDesk&sid=15229212699069&xp=27&px=1,Data Scientist,Data Scientist,PeopleStrong HR Services Pvt. Ltd.,Bengaluru,6-10 yrs,Java- HBase- Pig- NoSQL- Ruby- Python- MongoDB- Perl- SCALA...,This is a great opportunity for a Data Engineer to accelerate an already rolling drive to data-enabled ...,Not disclosed,2018-04-04,6,10,0,0
https://www.naukri.com/job-listings-Data-Scientist-Credit-Risk-Assessment-Delhi-NCR-Gurgaon-3-to-8-years-030418900508?src=jobsearchDesk&sid=15229212699069&xp=28&px=1,Data Scientist - Credit Risk Assessment,Data Scientist - Credit Risk Assessment,Premium,Delhi NCR- Gurgaon,3-8 yrs,Information Retrieval- Hadoop- Hive- Spark- Mapreduce- Java...,- Deliver Predictive Analytics- Data Mining and Machine Learning driven solutions for the planning ...,Not disclosed,2018-04-04,3,8,0,0
https://www.naukri.com/job-listings-Data-Scientist-Bengaluru-4-to-9-years-030418900507?src=jobsearchDesk&sid=15229212699069&xp=29&px=1,Data Scientist,Data Scientist,Premium,Bengaluru,4-9 yrs,Information Retrieval- Hadoop- Hive- Spark- Mapreduce- SCALA..., Overview :    - Deliver Predictive Analytics- Data Mining and Machine Learning driven ...,Not disclosed,2018-04-04,4,9,0,0
https://www.naukri.com/job-listings-Data-Scientist-in-Kurla-Mumbai-HR-Nest-Mumbai-3-to-8-years-040418003750?src=jobsearchDesk&sid=15229212699069&xp=30&px=1,Data Scientist in Kurla Mumbai,Data Scientist in Kurla Mumbai,HR Nest,Mumbai,3-8 yrs,machine learning- data science- artificial intelligence- artificial bi..., ,Not disclosed,2018-04-04,3,8,0,0
https://www.naukri.com/job-listings-Data-Scientist-Artificial-Intelligence-HUB4TECH-PORTAL-SERIVCES-PRIVATE-LIMITED-Delhi-NCR-Gurgaon-2-to-5-years-040418008564?src=jobsearchDesk&sid=15229212699069&xp=31&px=1,Data Scientist - Artificial Intelligence,Data Scientist - Artificial Intelligence,HUB4TECH PORTAL SERIVCES PRIVATE LIMITED,Delhi NCR- Gurgaon,2-5 yrs,Artificial Intelligence- machine learning- Data Analytics- data modeling..., ,450000 - 950000 P.A.,2018-04-04,2,5,450000,950000
https://www.naukri.com/job-listings-Software-Engineering-Data-Scientists-JP-Morgan-Chase-Bengaluru-Bangalore-East-0-to-5-years-030418901344?src=jobsearchDesk&sid=15229212699069&xp=32&px=1,Software Engineering - Data Scientists,Software Engineering - Data Scientists,JP Morgan Chase,Bengaluru- Bangalore East,0-5 yrs,technology- finance- operations- human resources,EVEREST SOFTWARE ENGINEERING

 

As a member of our Everest Engineering Group you will be in the center ...,Not disclosed,2018-04-03,0,5,0,0
https://www.naukri.com/job-listings-Research-Data-Scientist-GradValley-Data-Science-Coimbatore-3-to-5-years-030418009146?src=jobsearchDesk&sid=15229212699069&xp=33&px=1,Research Data Scientist,Research Data Scientist,GradValley Data Science,Coimbatore,3-5 yrs,data analysis- data science- predictive modeling- product development..., Job Overview   We are looking for a Research Data Scientist who will support our ...,500000 - 800000 P.A.,2018-04-03,3,5,500000,800000
https://www.naukri.com/job-listings-Senior-Data-Scientist-Silver-People-Bengaluru-8-to-12-years-300318001665?src=jobsearchDesk&sid=15229212699069&xp=34&px=1,Senior Data Scientist,Senior Data Scientist,Silver People,Bengaluru,8-12 yrs,R- Statistical Modeling- Machine Learning- SAS- Python- Data Analytics...,Experience with working in non-tech algorithms ie business problem-solving algorithms  - Will be ...,Not disclosed,2018-04-03,8,12,0,0
https://www.naukri.com/job-listings-Senior-Data-Scientist-Silver-People-Bengaluru-13-to-15-years-300318001659?src=jobsearchDesk&sid=15229212699069&xp=35&px=1,Senior Data Scientist,Senior Data Scientist,Silver People,Bengaluru,13-15 yrs,R- Statistical Modeling- Machine Learning- SAS- Python- Data Analytics...,Experience with working in non-tech algorithms ie business problem-solving algorithms  - Will be ...,Not disclosed,2018-04-03,13,15,0,0
https://www.naukri.com/job-listings-Urgently-Hiring-Data-Scientist-SAN-Data-Systems-Delhi-NCR-Bengaluru-5-to-10-years-220318009031?src=jobsearchDesk&sid=15229212699069&xp=36&px=1,Urgently Hiring Data Scientist,Urgently Hiring Data Scientist,SAN Data Systems,Delhi NCR- Bengaluru,5-10 yrs,Deep Learning- Hive- Spark- Machine Learning- Data Mining- R- Data Analysis...,Position Requirements  DUTIES AND RESPONSIBILITIES  The Data Analyst and Data scientist ...,Not disclosed,2018-04-04,5,10,0,0
https://www.naukri.com/job-listings-Data-Scientist-Telecom-10XDigitalPro-com-Mumbai-8-to-13-years-020418900786?src=jobsearchDesk&sid=15229212699069&xp=37&px=1,Data Scientist - Telecom,Data Scientist - Telecom,10XDigitalPro.com,Mumbai,8-13 yrs,Hadoop- Hive- Spark- HBase- Pig- Natural Language Processing- SCALA- Java...,JOB DESCRIPTION  - Specify- design- and implement new data science applications- methodologies- ...,Not disclosed,2018-04-04,8,13,0,0
https://www.naukri.com/job-listings-Data-Scientist-PrimEra-Medical-Technologies-Private-Limited-Hyderabad-3-to-8-years-020418000656?src=jobsearchDesk&sid=15229212699069&xp=38&px=1,Data Scientist,Data Scientist,PrimEra Medical Technologies Private Limited,Hyderabad,3-8 yrs,Machine Learning- R- Predictive Analytics- Data Analysis- Python- SQL..., Data Scientist  PrimEra is looking for data savvy professionals to join our team of data ...,Not disclosed,2018-04-04,3,8,0,0
https://www.naukri.com/job-listings-Statistician-data-Scientist-Classic-Search-Pvt-Ltd-Bengaluru-5-to-9-years-011216006665?src=jobsearchDesk&sid=15229212699069&xp=39&px=1,Statistician/data Scientist,Statistician/data Scientist,Classic Search Pvt Ltd,Bengaluru,5-9 yrs,Java- Mathematica- Machine Learning- Hadoop- Python- Algorithms- MS Office-...,Technical Skills:  Advanced math skills- with deep knowledge and understanding of numerical and ...,Not disclosed,2018-04-03,5,9,0,0
https://www.naukri.com/job-listings-Data-Scientist-Classic-Search-Pvt-Ltd-Pune-4-to-9-years-121016001018?src=jobsearchDesk&sid=15229212699069&xp=40&px=1,Data Scientist,Data Scientist,Classic Search Pvt Ltd,Pune,4-9 yrs,Data Analytics- Phd- R- Statistics- Statistical Modeling- Analysis- Machine..., R language- data analytics- Machine learning- predictive analysis- statistical modeling- Big data. ...,Not disclosed,2018-04-03,4,9,0,0
https://www.naukri.com/job-listings-Lead-Data-Scientist-IT-Noida-6-to-11-years-020418900910?src=jobsearchDesk&sid=15229212699069&xp=41&px=1,Lead - Data Scientist - IT,Lead - Data Scientist - IT,Premium,Noida,6-11 yrs,Natural Language Processing- R- Data Science- Machine Learning...,Peopzpro supports our client's business across front- middle and back office functions by combining ...,Not disclosed,2018-04-04,6,11,0,0
https://www.naukri.com/job-listings-HCL-Technologies-is-Hiring-Data-Scientist-for-Mumbai-Hcl-Technologies-Limited-Mumbai-5-to-10-years-200318006484?src=jobsearchDesk&sid=15229212699069&xp=42&px=1,HCL Technologies is Hiring Data Scientist for Mumbai,HCL Technologies is Hiring Data Scientist for Mumbai,Hcl Technologies Limited,Mumbai,5-10 yrs,statistical modeling- tableau,Dear-  Greetings from HCL Technologies !!!!!  We are hiring data scientist for Mumbai ...,Not disclosed,2018-04-03,5,10,0,0
https://www.naukri.com/job-listings-Data-Scientist-Machine-Learning-AppMix-Technologies-Pvt-Ltd-Mumbai-Mumbai-Suburbs-3-to-8-years-030418008436?src=jobsearchDesk&sid=15229212699069&xp=43&px=1,Data Scientist - Machine Learning,Data Scientist - Machine Learning,AppMix Technologies Pvt Ltd,Mumbai- Mumbai Suburbs,3-8 yrs,Hadoop- Data Scientist- Python- Deep Learning- R, ,Not disclosed,2018-04-03,3,8,0,0
https://www.naukri.com/job-listings-Data-Scientist-R-Systems-International-Ltd-Noida-10-to-15-years-211217002136?src=jobsearchDesk&sid=15229212699069&xp=44&px=1,Data Scientist,Data Scientist,R Systems International Ltd.,Noida,10-15 yrs,data scientist- machine learning- python- analytics specialist- analytics...,  Establishing and implementing Actionable Business Outcomes (ABOs) for predictive and ...,Not disclosed,2018-04-04,10,15,0,0
https://www.naukri.com/job-listings-Data-Scientist-Role-powai-mumbai-leading-IT-Company-Athena-Consultancy-Services-Mumbai-6-to-11-years-030418005343?src=jobsearchDesk&sid=15229212699069&xp=45&px=1,Data Scientist Role-powai(mumbai)--leading IT Company,Data Scientist Role-powai(mumbai)--leading IT Company,Athena Consultancy Services,Mumbai,6-11 yrs,stattistical modelling- Tableau- PPT- Communication- Programming,We Have a Job Opening for-Data Scientist Role-Powai(Mumbai)--Leading IT Company  Job Description ...,Not disclosed,2018-04-03,6,11,0,0
https://www.naukri.com/job-listings-Principal-Modeler-data-Scientist-BG-Advisors-Noida-9-to-14-years-290318004783?src=jobsearchDesk&sid=15229212699069&xp=46&px=1,Principal Modeler-data Scientist,Principal Modeler-data Scientist,BG Advisors,Noida,9-14 yrs,Arcgis- GIS- MapInfo- Excel- Database Development- Data Analysis,Knowledge of GIS preferred- including experience with ARCGIS & MapInfo software. ...,1800000 - 2750000 P.A.,2018-04-03,9,14,1800000,2750000
https://www.naukri.com/job-listings-Senior-Manager-Data-Scientist-Banking-Domain-Iit-nit-bits-HuQuo-Consulting-Pvt-Ltd-Delhi-NCR-Gurgaon-8-to-12-years-300318005568?src=jobsearchDesk&sid=15229212699069&xp=47&px=1,Senior Manager - Data Scientist - Banking Domain - Iit/nit/bits,Senior Manager - Data Scientist - Banking Domain - Iit/nit/bits,HuQuo Consulting Pvt. Ltd.,Delhi NCR- Gurgaon,8-12 yrs,Hive- Data Science- Machine Learning- Python- R- SQL- Data Mining...,We are looking for a Data Scientist that will help us discover the information hidden in vast amounts of ...,Not disclosed,2018-03-30,8,12,0,0
https://www.naukri.com/job-listings-Data-Scientist-R-python-java-Mumbai-8-to-12-years-020418900866?src=jobsearchDesk&sid=15229212699069&xp=48&px=1,Data Scientist - R/python/java,Data Scientist - R/python/java,Premium,Mumbai,8-12 yrs,Hive- Hadoop- Python- Pig- HBase- Spark- Java- SCALA- SQL- Neural Networks, Job Description  :  - Specify- design- and implement new data science applications- ...,Not disclosed,2018-04-04,8,12,0,0
https://www.naukri.com/job-listings-Data-Scientist-Truebil-com-Mumbai-2-to-5-years-280318901989?src=jobsearchDesk&sid=15229212699069&xp=49&px=1,Data Scientist,Data Scientist,Truebil.com,Mumbai,2-5 yrs,SAS- Excel- R- SQL- Analytics Reporting- Statistical Modeling...,Data Scientist (2-5 yrs)  Roles & Responsibilities:  - You will be working on ...,Not disclosed,2018-03-30,2,5,0,0
https://www.naukri.com/job-listings-Data-Scientist-Ifrs9-Domain-Auronova-Consulting-Solutions-Mumbai-1-to-4-years-300318901974?src=jobsearchDesk&sid=15229212699069&xp=50&px=1,Data Scientist - Ifrs9 Domain,Data Scientist - Ifrs9 Domain,Auronova Consulting Solutions,Mumbai,1-4 yrs,Regulatory Reporting- Business Intelligence- Report Preparation..., Responsibilities :    - Validate input & results of IFRS 9 reports & data for ...,Not disclosed,2018-04-03,1,4,0,0
https://www.naukri.com/job-listings-Data-Scientist-Flipkart-Internet-Private-Limited-Bengaluru-2-to-7-years-300318900168?src=jobsearchDesk&sid=15229212707792&xp=1&px=2,Data Scientist,Data Scientist,Flipkart Internet Private Limited,Bengaluru,2-7 yrs,Deep Learning- Algorithms- Data Science- Image Processing- Data Scientist,Data Scientist  Data Science team at Flipkart is going forward with mission of building systemic ...,Not disclosed,2018-03-30,2,7,0,0
https://www.naukri.com/job-listings-AVP-Data-Scientist-Duff-Phelps-Mumbai-5-to-10-years-290318900918?src=jobsearchDesk&sid=15229212707792&xp=2&px=2,AVP - Data Scientist,AVP - Data Scientist,Duff & Phelps,Mumbai,5-10 yrs,Data Scientist- SQL- SQL queries- Python- SAS- R- relational databases,Responsibilities:  - Develop tools and processes for data reconciliation- warehousing and ...,Not disclosed,2018-04-02,5,10,0,0
https://www.naukri.com/job-listings-Data-Scientist-Python-BFS-Iit-dse-iim-nit-Huquo-Delhi-NCR-Gurgaon-2-to-5-years-300318900109?src=jobsearchDesk&sid=15229212707792&xp=3&px=2,Data Scientist - Python - BFS - Iit/dse/iim/nit,Data Scientist - Python - BFS - Iit/dse/iim/nit,Huquo,Delhi NCR- Gurgaon,2-5 yrs,Python- Text Mining- Data Structures- Data Scientist- Hbase- PySpark,Data Scientist - IIT/DSE/IIMS   Looking for self-driven Python data scientists having 1-4 years ...,Not disclosed,2018-04-02,2,5,0,0
https://www.naukri.com/job-listings-Requirement-for-Data-Scientist-at-Atos-ATOS-INDIA-PRIVATE-LIMITED-Bengaluru-Pune-3-to-7-years-290318002917?src=jobsearchDesk&sid=15229212707792&xp=4&px=2,Requirement for Data Scientist at Atos,Requirement for Data Scientist at Atos,ATOS INDIA PRIVATE LIMITED,Bengaluru- Pune,3-7 yrs,D3.js- GGPlot- Tableau- Qlik- k - NN- Naive Bayes- SVM- Decision Forests...,Role: Data Scientist Exp- 3-7 yrs  Location: Pune & Bangalore ...,600000 - 1600000 P.A.,2018-04-02,3,7,600000,1600000
https://www.naukri.com/job-listings-Senior-Data-Scientist-Global-Staffing-Partner-Delhi-NCR-3-to-6-years-300318002692?src=jobsearchDesk&sid=15229212707792&xp=5&px=2,Senior Data Scientist,Senior Data Scientist,Global Staffing Partner,Delhi NCR,3-6 yrs,Machine Learning- Natural Language Processing- Algorithms- NLP- Python..., Roles & Responsibilities:    - We're looking for a Senior Data Scientist with ...,Not disclosed,2018-04-02,3,6,0,0
