https://www.naukri.com/job-listings-Sales-Marketing-Engineer-medical-Equipment-for-Gurgaon-OM-HR-SOLUTIONS-Gurgaon-1-to-5-years-310318000859?src=jobsearchDesk&sid=15229205311180&xp=30&px=22,Sales & Marketing Engineer (medical Equipment) for Gurgaon,Sales & Marketing Engineer (medical Equipment) for Gurgaon,OM HR SOLUTIONS,Gurgaon,1-5 yrs,sales- Business Development- Marketing- Branding- Corporate Sales..., ,100000 - 400000 P.A.,2018-04-02,1,5,100000,400000
https://www.naukri.com/job-listings-Executive-Senior-Executive-Sales-Marketing-for-Bangalore-Abridge-Consulting-Services-Bengaluru-3-to-8-years-300318007714?src=jobsearchDesk&sid=15229205311180&xp=31&px=22,Executive / Senior Executive - Sales & Marketing for Bangalore,Executive / Senior Executive - Sales & Marketing for Bangalore,Abridge Consulting Services,Bengaluru,3-8 yrs,bill printers- thermal printers- Passbook printer- Sales..., ,300000 - 700000 P.A.,2018-03-30,3,8,300000,700000
https://www.naukri.com/job-listings-Global-Marketing-sales-Manager-mba-bms-mms-Freshers-Apply-Excelsior-Mumbai-Navi-Mumbai-0-to-1-years-300318007713?src=jobsearchDesk&sid=15229205311180&xp=32&px=22,Global Marketing/sales Manager(mba/bms/mms Freshers Apply),Global Marketing/sales Manager(mba/bms/mms Freshers Apply),Excelsior,Mumbai- Navi Mumbai,0-1 yrs,Mba- Sales- Bba- Bbm- Marketing- freshers- management fresher..., ,300000 - 600000 P.A.,2018-03-30,0,1,300000,600000
https://www.naukri.com/job-listings-Asst-Manager-Manager-Sales-Marketing-Freight-Forwarding-Success-HR-Consultancy-Mumbai-Vidya-Vihar-West-8-to-13-years-300318007612?src=jobsearchDesk&sid=15229205311180&xp=33&px=22,Asst Manager / Manager - Sales & Marketing - Freight Forwarding,Asst Manager / Manager - Sales & Marketing - Freight Forwarding,Success HR Consultancy,Mumbai(Vidya Vihar West),8-13 yrs,Freight Forwarding- Ocean Freight- Sales Management- Air Freight..., ,Not disclosed,2018-03-30,8,13,0,0
https://www.naukri.com/job-listings-Marketing-Executive-Eminence-Solutions-Pune-0-to-1-years-300318004669?src=jobsearchDesk&sid=15229205311180&xp=34&px=22,Marketing Executive,Marketing Executive,Eminence Solutions,Pune,0-1 yrs,Cold Calling- Marketing- Work Order- Verbal Communication..., ,Not disclosed,2018-03-30,0,1,0,0
https://www.naukri.com/job-listings-Urgent-Requirement-for-Sr-exe-casa-audit-Office-marketing-Executive-Vrishabh-HR-Services-Indore-Jabalpur-Katni-0-to-5-years-300318004339?src=jobsearchDesk&sid=15229205311180&xp=35&px=22,Urgent Requirement for Sr.exe(casa)/audit Office/marketing Executive,Urgent Requirement for Sr.exe(casa)/audit Office/marketing Executive,Vrishabh HR Services,Indore- Jabalpur- Katni,0-5 yrs,bank audit- auditing- banking- target achievement- saving account- sales..., ,150000 - 350000 P.A. Best According to the Location,2018-03-30,0,5,150000,350000
https://www.naukri.com/job-listings-Marketing-in-Dyeing-or-Yarn-CAREERHUNT-INDIA-PRIVATE-LIMITED-Ambala-5-to-7-years-300318003645?src=jobsearchDesk&sid=15229205311180&xp=36&px=22,Marketing in Dyeing or Yarn,Marketing in Dyeing or Yarn,CAREERHUNT INDIA PRIVATE LIMITED,Ambala,5-7 yrs,Dyeing Marketing Manager- Yarn Marketing..., ,500000 - 600000 P.A.,2018-03-30,5,7,500000,600000
https://www.naukri.com/job-listings-Real-Estate-Sales-Marketing-Sales-Executive-10-Openings-Gurgaon-Property-Bank-Gurgaon-0-to-3-years-300318003032?src=jobsearchDesk&sid=15229205311180&xp=37&px=22,Real Estate Sales / Marketing & Sales Executive( 10 Openings ),Real Estate Sales / Marketing & Sales Executive( 10 Openings ),Gurgaon Property Bank,Gurgaon,0-3 yrs,real estate consultant- sales executive- marketing executive..., ,600000 - 1500000 P.A. Phone bills paid by company.,2018-03-30,0,3,600000,1500000
https://www.naukri.com/job-listings-Campaign-Management-Opportunities-Sales-Marketing-Management-Excelsior-Mumbai-0-to-2-years-300318002958?src=jobsearchDesk&sid=15229205311180&xp=38&px=22,Campaign Management Opportunities ( Sales & Marketing Management),Campaign Management Opportunities ( Sales & Marketing Management),Excelsior,Mumbai,0-2 yrs,Mba- Sales- Bba- Bbm- Marketing- freshers- management fresher..., ,300000 - 500000 P.A.,2018-03-30,0,2,300000,500000
https://www.naukri.com/job-listings-Marketing-Manager-Jaipur-Essvee-Consultants-Jaipur-1-to-4-years-300318000732?src=jobsearchDesk&sid=15229205311180&xp=39&px=22,Marketing Manager Jaipur,Marketing Manager Jaipur,Essvee Consultants,Jaipur,1-4 yrs,Marketing Management- sales management- business development management, ,100000 - 300000 P.A.,2018-03-30,1,4,100000,300000
https://www.naukri.com/job-listings-Marketing-Officer-Castings-Alloys-Steel-Foundry-Sri-Hari-Consultant-Coimbatore-5-to-10-years-300318000501?src=jobsearchDesk&sid=15229205311180&xp=40&px=22,Marketing Officer - Castings & Alloys Steel Foundry,Marketing Officer - Castings & Alloys Steel Foundry,Sri Hari Consultant,Coimbatore,5-10 yrs,marketing officer- marketing executive- sales executive..., ,225000 - 250000 P.A. Other allowancesincentives an...,2018-03-30,5,10,225000,250000
https://www.naukri.com/job-listings-Urgent-Manager-Sr-Manager-Marketing-energy-Solutions-Pune-Seom-International-Pune-Karve-Road-7-to-12-years-290318008258?src=jobsearchDesk&sid=15229205311180&xp=41&px=22,Urgent: Manager/ Sr Manager: Marketing(energy Solutions): Pune,Urgent: Manager/ Sr Manager: Marketing(energy Solutions): Pune,Seom International,Pune(Karve Road),7-12 yrs,Marketing Management- business development management- Energy- Energy Audit..., ,500000 - 1200000 P.A.,2018-03-29,7,12,500000,1200000
https://www.naukri.com/job-listings-Digital-Marketing-Manager-SRI-RAJARAJESHWARI-AND-CO-Bengaluru-3-to-6-years-290318006145?src=jobsearchDesk&sid=15229205311180&xp=42&px=22,Digital Marketing Manager,Digital Marketing Manager,SRI RAJARAJESHWARI AND CO.,Bengaluru,3-6 yrs,SEM- Digital Marketing- SEO- Display Advertising- Social Media- Campaigns..., ,Not disclosed,2018-03-29,3,6,0,0
https://www.naukri.com/job-listings-Management-Trainee-Marketing-Fresher-PIONEER-MANAGEMENT-CONSULTANTS-Delhi-0-to-1-years-290318006130?src=jobsearchDesk&sid=15229205311180&xp=43&px=22,Management Trainee - Marketing ( Fresher),Management Trainee - Marketing ( Fresher),PIONEER MANAGEMENT CONSULTANTS,Delhi,0-1 yrs,fresher- fresh- mktg- marketing- sales- business development- bd- sale, ,200000 - 250000 P.A.,2018-03-29,0,1,200000,250000
https://www.naukri.com/job-listings-Urgent-Opening-for-Front-Desk-with-Digital-Marketing-Residency-road-PAL-TALENT-SERVICES-LLP-Bengaluru-Residency-Road-1-to-2-years-290318005618?src=jobsearchDesk&sid=15229205311180&xp=44&px=22,Urgent Opening for Front Desk with Digital Marketing @ Residency road,Urgent Opening for Front Desk with Digital Marketing @ Residency road,PAL TALENT SERVICES LLP.,Bengaluru(Residency Road),1-2 yrs,digital marketing- social media marketing- communication skills- front desk..., ,175000 - 225000 P.A. With attractive Incentive,2018-03-29,1,2,175000,225000
https://www.naukri.com/job-listings-Executive-Sales-Marketing-Right-Training-and-Placement-Solutions-Ranchi-Jamshedpur-2-to-6-years-290318005560?src=jobsearchDesk&sid=15229205311180&xp=45&px=22,Executive Sales & Marketing,Executive Sales & Marketing,Right Training and Placement Solutions,Ranchi- Jamshedpur,2-6 yrs,Marketing- Sales- business development- bde- client servicing..., ,225000 - 250000 P.A. Ta+da+mobile+huge Incentives,2018-03-29,2,6,225000,250000
https://www.naukri.com/job-listings-Requirement-for-Sales-Marketing-Surat-World-Of-Vacancy-Surat-0-to-5-years-290318005281?src=jobsearchDesk&sid=15229205311180&xp=46&px=22,Requirement for Sales Marketing - Surat,Requirement for Sales Marketing - Surat,World Of Vacancy,Surat,0-5 yrs,sales- marketing- Business Development, ,100000 - 400000 P.A.,2018-03-29,0,5,100000,400000
https://www.naukri.com/job-listings-Marketing-Manager-franchisee-Miracle-HR-Solution-Vadodara-2-to-7-years-290318005264?src=jobsearchDesk&sid=15229205311180&xp=47&px=22,Marketing Manager (franchisee),Marketing Manager (franchisee),Miracle HR Solution,Vadodara,2-7 yrs,Marketing Management- Product Awareness- Franchisee Development- franchisee..., ,200000 - 650000 P.A.,2018-03-29,2,7,200000,650000
https://www.naukri.com/job-listings-Head-VP-Sales-Marketing-in-IT-Services-Morgenall-Bengaluru-10-to-15-years-290318004695?src=jobsearchDesk&sid=15229205311180&xp=48&px=22,Head / VP Sales & Marketing in IT Services,Head / VP Sales & Marketing in IT Services,Morgenall,Bengaluru,10-15 yrs,Business Development- Inside Sales- Marketing- Strategic Planning..., ,1000000 - 2000000 P.A.,2018-03-29,10,15,1000000,2000000
https://www.naukri.com/job-listings-Head-VP-Sales-Marketing-in-IT-Services-Morgenall-Bengaluru-15-to-25-years-290318004647?src=jobsearchDesk&sid=15229205311180&xp=49&px=22,Head / VP Sales & Marketing in IT Services,Head / VP Sales & Marketing in IT Services,Morgenall,Bengaluru,15-25 yrs,Business Development- Inside Sales- Marketing- Strategic Planning..., ,2000000 - 3500000 P.A.,2018-03-29,15,25,2000000,3500000
https://www.naukri.com/job-listings-Sales-and-Marketing-Executive-HIRING-STUDIO-Bengaluru-0-to-2-years-290318900917?src=jobsearchDesk&sid=15229205311180&xp=50&px=22,Sales and Marketing Executive,Sales and Marketing Executive,HIRING STUDIO,Bengaluru,0-2 yrs,online marketing- sales- marketing executive- sales executive..., ,Not disclosed,2018-03-29,0,2,0,0
https://www.naukri.com/job-listings-Marketing-Manager-Amm-jain-and-co-Chennai-7-to-12-years-290318004187?src=jobsearchDesk&sid=15229205337698&xp=1&px=23,Marketing Manager,Marketing Manager,Amm jain and co.,Chennai,7-12 yrs,Marketing Management- marketing- sales- business development..., ,400000 - 600000 P.A.,2018-04-02,7,12,400000,600000
https://www.naukri.com/job-listings-Strategic-Business-Management-Opportunities-marketing-sales-bd-Excelsior-Mumbai-Navi-Mumbai-0-to-2-years-290318003321?src=jobsearchDesk&sid=15229205337698&xp=2&px=23,Strategic Business Management Opportunities (marketing/sales/bd),Strategic Business Management Opportunities (marketing/sales/bd),Excelsior,Mumbai- Navi Mumbai,0-2 yrs,Mba- Sales- Bba- Bbm- Marketing- freshers- management fresher..., ,300000 - 500000 P.A.,2018-03-29,0,2,300000,500000
https://www.naukri.com/job-listings-Aditya-Birla-Life-Insurance-Hiring-For-Direct-Marketing-Profile-Jobs-Cruze-Consultancy-services-Mumbai-Ahmedabad-2-to-5-years-290318001606?src=jobsearchDesk&sid=15229205337698&xp=3&px=23,Aditya Birla Life Insurance Hiring For Direct Marketing Profile,Aditya Birla Life Insurance Hiring For Direct Marketing Profile,Jobs Cruze Consultancy services,Mumbai- Ahmedabad,2-5 yrs,sales- sales manager- sales executive- sales development manager..., ,225000 - 325000 P.A. Incentives+ Bonus+ Allowances+...,2018-03-29,2,5,225000,325000
https://www.naukri.com/job-listings-Hiring-for-Direct-Marketing-with-100-lead-Support-mumbai-Jobs-Cruze-Consultancy-services-Mumbai-1-to-6-years-290318001531?src=jobsearchDesk&sid=15229205337698&xp=4&px=23,Hiring for Direct Marketing with 100% lead Support (mumbai),Hiring for Direct Marketing with 100% lead Support (mumbai),Jobs Cruze Consultancy services,Mumbai,1-6 yrs,insurance- life insurance- general insurance- sales insurance- direct sales..., ,275000 P.A. other incentives + Bonus,2018-03-29,1,6,275000,0
https://www.naukri.com/job-listings-Dgm-marketing-for-a-Reputed-Fertilizers-Company-Bridgecon-Services-Hubli-12-to-20-years-220218000884?src=jobsearchDesk&sid=15229205337698&xp=5&px=23,Dgm-marketing (for a Reputed Fertilizers Company),Dgm-marketing (for a Reputed Fertilizers Company),Bridgecon Services,Hubli,12-20 yrs,market development- Marketing- Branding- Sales- BD- Business development..., ,1800000 - 2500000 P.A.,2018-04-02,12,20,1800000,2500000
https://www.naukri.com/job-listings-Opening-for-Marketing-Executive-Business-Development-Pranav-HR-Consultants-Chennai-2-to-7-years-220218000568?src=jobsearchDesk&sid=15229205337698&xp=6&px=23,Opening for Marketing Executive / Business Development,Opening for Marketing Executive / Business Development,Pranav HR Consultants,Chennai,2-7 yrs,business development- marketing- Corporate Sales- corporate marketing..., ,Not disclosed,2018-03-30,2,7,0,0
https://www.naukri.com/job-listings-Manager-Exports-Yarn-Marketing-M-A-consultants-Delhi-NCR-5-to-10-years-210118000446?src=jobsearchDesk&sid=15229205337698&xp=7&px=23,Manager Exports ( Yarn Marketing ),Manager Exports ( Yarn Marketing ),M & A consultants,Delhi NCR,5-10 yrs,sales- marketing- yarn- textiles- marketing manager yarn- manager marketing..., ,600000 - 1200000 P.A.,2018-03-30,5,10,600000,1200000
https://www.naukri.com/job-listings-Private-bank-Looking-for-Marketing-Executive-auto-Loan-No-Field-work-Smart-Lion-Ahmedabad-0-to-2-years-201217005614?src=jobsearchDesk&sid=15229205337698&xp=8&px=23,Private bank Looking for Marketing Executive (auto Loan) No Field work,Private bank Looking for Marketing Executive (auto Loan) No Field work,Smart Lion,Ahmedabad,0-2 yrs,field work- field executive- sales- business development..., ,100000 - 150000 P.A. + Attractive incentives,2018-03-31,0,2,100000,150000
https://www.naukri.com/job-listings-Business-Development-Officers-and-Marketing-Researchers-and-Consultant-Prime-T-Canada-1-to-5-years-191215001168?src=jobsearchDesk&sid=15229205337698&xp=9&px=23,Business Development Officers and Marketing Researchers and Consultant,Business Development Officers and Marketing Researchers and Consultant,Prime T.,Canada,1-5 yrs,Marketing- Business Development- Industrial Products, ,2250000 - 3250000 P.A.,2018-03-31,1,5,2250000,3250000
https://www.naukri.com/job-listings-Manager-Yarn-Marketing-Domestic-M-A-consultants-Ludhiana-7-to-10-years-190917008576?src=jobsearchDesk&sid=15229205337698&xp=10&px=23,Manager Yarn Marketing ( Domestic ),Manager Yarn Marketing ( Domestic ),M & A consultants,Ludhiana,7-10 yrs,Sales- Marketing- Yarn- Textiles- Domestic- Marketing Manager Yarn- Manager..., ,1000000 - 1400000 P.A.,2018-03-30,7,10,1000000,1400000
https://www.naukri.com/job-listings-Executive-Sales-Marketing-rubber-and-Plastic-Pune-PHI-Consulting-Services-Pune-1-to-6-years-170118006933?src=jobsearchDesk&sid=15229205337698&xp=11&px=23,Executive -  Sales & Marketing (rubber and Plastic) - Pune,Executive -  Sales & Marketing (rubber and Plastic) - Pune,PHI Consulting Services,Pune,1-6 yrs,marketing- business development- sales- selling- bd- plastic- rubber..., ,200000 - 500000 P.A.,2018-03-31,1,6,200000,500000
https://www.naukri.com/job-listings-Dubai-International-Sales-Consultants-Marketing-HNI-Client-Dubai-Global-Quest-Solutions-Dubai-UAE-Qatar-Bahrain-2-to-6-years-161216007286?src=jobsearchDesk&sid=15229205337698&xp=12&px=23,Dubai - International Sales Consultants / Marketing HNI Client-  Dubai,Dubai - International Sales Consultants / Marketing HNI Client-  Dubai,Global Quest Solutions,Dubai/ UAE- Qatar- Bahrain,2-6 yrs,Sales- Marketing- Concept Selling- Selling Skil- Business Development..., ,1000000 - 2000000 P.A. ONLY Dubai Residents --excel...,2018-04-02,2,6,1000000,2000000
https://www.naukri.com/job-listings-Marketing-Executive-marketing-sales-sales-Executive-direct-Sales-Obtenir-Solutions-Private-Limited-Hyderabad-Begumpet-0-to-5-years-160218007520?src=jobsearchDesk&sid=15229205337698&xp=13&px=23,Marketing Executive/marketing/sales/sales Executive/direct Sales,Marketing Executive/marketing/sales/sales Executive/direct Sales,Obtenir Solutions Private Limited,Hyderabad(Begumpet),0-5 yrs,field sales- marketing- direct sales- outbound sales- sales- fresher..., ,Not disclosed,2018-03-29,0,5,0,0
https://www.naukri.com/job-listings-Executive-Sales-Marketing-rubber-and-Plastic-Mumbai-PHI-Consulting-Services-Mumbai-1-to-6-years-150218007855?src=jobsearchDesk&sid=15229205337698&xp=14&px=23,Executive -  Sales & Marketing (rubber and Plastic) - Mumbai,Executive -  Sales & Marketing (rubber and Plastic) - Mumbai,PHI Consulting Services,Mumbai,1-6 yrs,marketing- business development- sales- selling- bd- plastic- rubber..., ,200000 - 500000 P.A.,2018-03-31,1,6,200000,500000
https://www.naukri.com/job-listings-Marketing-Head-T-R-Manpower-Consultants-Pvt-Ltd-Mumbai-10-to-15-years-121017004017?src=jobsearchDesk&sid=15229205337698&xp=15&px=23,Marketing Head,Marketing Head,T.R.Manpower Consultants Pvt Ltd,Mumbai,10-15 yrs,marketing- sales- business development- bd- bdm..., ,Not disclosed,2018-03-30,10,15,0,0
https://www.naukri.com/job-listings-Sales-Marketing-Professionals-Dealer-Network-SRI-RAJARAJESHWARI-AND-CO-Bengaluru-0-to-5-years-080717003299?src=jobsearchDesk&sid=15229205337698&xp=16&px=23,Sales & Marketing Professionals  -  Dealer Network,Sales & Marketing Professionals  -  Dealer Network,SRI RAJARAJESHWARI AND CO.,Bengaluru,0-5 yrs,business development- Dealer Network, ,Not disclosed,2018-03-29,0,5,0,0
https://www.naukri.com/job-listings-GM-VP-Marketing-exports-Made-Ups-Business-Shriram-Management-Consultants-Delhi-NCR-15-to-25-years-061117003831?src=jobsearchDesk&sid=15229205337698&xp=17&px=23,GM/ VP - Marketing (exports Made Ups Business),GM/ VP - Marketing (exports Made Ups Business),Shriram Management Consultants,Delhi NCR,15-25 yrs,GM- VP- Marketing- business development, ,Not disclosed,2018-03-30,15,25,0,0
https://www.naukri.com/job-listings-Marketing-Coordinator-Five-Days-Working-ANGEL-JOBS-Mumbai-3-to-8-years-020418007633?src=jobsearchDesk&sid=15229205337698&xp=18&px=23,Marketing Coordinator- Five Days Working,Marketing Coordinator- Five Days Working,ANGEL JOBS,Mumbai,3-8 yrs,Business Development- Marketing- Strategy- Proposal Preparation..., ,Not disclosed,2018-04-02,3,8,0,0
https://www.naukri.com/job-listings-Female-Marketing-Sales-Coordinator-for-Jhandewalan-Delhi-Location-DEEPA-PLACEMENT-Delhi-Jhandewalan-5-to-7-years-020418005938?src=jobsearchDesk&sid=15229205337698&xp=19&px=23,Female Marketing cum Sales Coordinator for Jhandewalan Delhi Location,Female Marketing cum Sales Coordinator for Jhandewalan Delhi Location,DEEPA PLACEMENT,Delhi(Jhandewalan),5-7 yrs,Sales Coordinator- Senior Sales Coordinator- Marketing Coordinator- Sales &..., ,325000 - 400000 P.A.,2018-04-02,5,7,325000,400000
https://www.naukri.com/job-listings-Manager-Marketing-Based-AT-Churchgate-Mumbai-G-K-Placements-Mumbai-Churchgate-4-to-9-years-020418005069?src=jobsearchDesk&sid=15229205337698&xp=20&px=23,Manager - Marketing - Based AT Churchgate - Mumbai.,Manager - Marketing - Based AT Churchgate - Mumbai.,G K Placements,Mumbai(Churchgate),4-9 yrs,Marketing Management- Technical Support- Raw Materials of Cosmetics..., ,Not disclosed,2018-04-02,4,9,0,0
https://www.naukri.com/job-listings-Sales-Manager-Creative-Agency-or-Digital-Marketing-mirror-consultancy-Gurgaon-2-to-7-years-020418003164?src=jobsearchDesk&sid=15229205337698&xp=21&px=23,Sales Manager ( Creative Agency or Digital Marketing ),Sales Manager ( Creative Agency or Digital Marketing ),Job mirror consultancy,Gurgaon,2-7 yrs,Sales Management- Digital Marketing- Sales Manager..., ,300000 - 500000 P.A.,2018-04-02,2,7,300000,500000
https://www.naukri.com/job-listings-Marketing-and-Sales-Communications-freshers-Apply0-Excelsior-Mumbai-0-to-2-years-010418001170?src=jobsearchDesk&sid=15229205337698&xp=22&px=23,Marketing and Sales Communications(freshers Apply0,Marketing and Sales Communications(freshers Apply0,Excelsior,Mumbai,0-2 yrs,Mba- Sales- Bba- Bbm- Marketing- freshers- management fresher..., ,300000 - 550000 P.A.,2018-04-01,0,2,300000,550000
https://www.naukri.com/job-listings-Manager-Sales-Marketing-Pleco-Migration-Private-Limited-Canada-Hong-Kong-2-to-7-years-010418001079?src=jobsearchDesk&sid=15229205337698&xp=23&px=23,Manager Sales & Marketing,Manager Sales & Marketing,Pleco Migration Private Limited,Canada- Hong Kong,2-7 yrs,marketing- business development- sales- Sales Manager- Retail Sales..., ,4500000 - 7000000 P.A. food and accommodation allow...,2018-04-01,2,7,4500000,7000000
https://www.naukri.com/job-listings-Concept-Branding-Marketing-Mix-Advertisng-sales-Excelsior-Mumbai-0-to-2-years-010418001053?src=jobsearchDesk&sid=15229205337698&xp=24&px=23,Concept Branding & Marketing Mix ( Advertisng/sales),Concept Branding & Marketing Mix ( Advertisng/sales),Excelsior,Mumbai,0-2 yrs,Mba- Sales- Bba- Bbm- Marketing- freshers- management fresher..., ,300000 - 500000 P.A.,2018-04-01,0,2,300000,500000
https://www.naukri.com/job-listings-Urgent-Business-Development-Marketing-Exec-5-Days-Gujrat-Kaamkaajindia-Ahmedabad-Vadodara-1-to-6-years-010418000158?src=jobsearchDesk&sid=15229205337698&xp=25&px=23,Urgent :: Business Development / Marketing Exec (5 Days) Gujrat,Urgent :: Business Development / Marketing Exec (5 Days) Gujrat,Kaamkaajindia,Ahmedabad- Vadodara,1-6 yrs,sales- marketing- bdm- bd- business development- sales & marketing..., ,175000 - 300000 P.A. Upto 24 K CTC ( 21 K - Inhand)...,2018-04-01,1,6,175000,300000
https://www.naukri.com/job-listings-Marketing-Merchandiser-Fairy-Designs-Inc-Bengaluru-3-to-6-years-030418009552?src=jobsearchDesk&sid=15229205337698&xp=26&px=23,Marketing Merchandiser,Marketing Merchandiser,Fairy Designs Inc,Bengaluru,3-6 yrs,Garment Merchandiser- Buying House Merchandiser, ,300000 - 350000 P.A.,2018-04-03,3,6,300000,350000
https://www.naukri.com/job-listings-Marketing-Executive-Zenith-Precision-Private-Limited-Bengaluru-Jalahalli-3-to-5-years-030418006910?src=jobsearchDesk&sid=15229205337698&xp=27&px=23,Marketing Executive,Marketing Executive,Zenith Precision Private Limited,Bengaluru(Jalahalli),3-5 yrs,Customer Handling- Machining Process- Project Planning- Risk Assessment, ,Not disclosed,2018-04-03,3,5,0,0
https://www.naukri.com/job-listings-Marketing-Executives-Manipur-Mahatma-Gandhi-University-Manipur-1-to-1-years-030418901297?src=jobsearchDesk&sid=15229205337698&xp=28&px=23,Marketing Executives (Manipur),Marketing Executives (Manipur),Mahatma Gandhi University,Manipur,,, ,Not disclosed,2018-04-03,,,0,0
https://www.naukri.com/job-listings-Marketing-Executives-Arunachal-Pradesh-Mahatma-Gandhi-University-Arunachalpradesh-1-to-1-years-030418901294?src=jobsearchDesk&sid=15229205337698&xp=29&px=23,Marketing Executives (Arunachal Pradesh),Marketing Executives (Arunachal Pradesh),Mahatma Gandhi University,Arunachalpradesh,,, ,Not disclosed,2018-04-03,,,0,0
https://www.naukri.com/job-listings-Marketing-Executive-Sales-Executive-Rajasthan-Sagarika-House-Jaipur-Jodhpur-Udaipur-0-to-5-years-231117003107?src=jobsearchDesk&sid=15229205337698&xp=30&px=23,Marketing Executive / Sales Executive - Rajasthan,Marketing Executive / Sales Executive - Rajasthan,Sagarika House,Jaipur- Jodhpur- Udaipur,0-5 yrs,Marketing- Sales- Marketing executive- Sales executive- Trainee..., ,125000 - 625000 P.A.,2018-04-04,0,5,125000,625000
https://www.naukri.com/job-listings-Marketing-Executive-For-Education-Sector-Right-Training-and-Placement-Solutions-Kolkata-Lake-Town-3-1-to-6-years-091017000683?src=jobsearchDesk&sid=15229205337698&xp=31&px=23,Marketing Executive For Education Sector,Marketing Executive For Education Sector,Right Training and Placement Solutions,Kolkata(Lake Town+3),1-6 yrs,Marketing- Sales- business development- bde- client servicing..., ,225000 - 275000 P.A. Ta+da+mobile+huge Incentives,2018-04-04,1,6,225000,275000
https://www.naukri.com/job-listings-Marketing-Executive-Krishna-Institute-of-Medical-Sciences-Ltd-Hyderabad-Kondapur-1-to-4-years-310318004415?src=jobsearchDesk&sid=15229205337698&xp=32&px=23,Marketing Executive,Marketing Executive,Krishna Institute of Medical Sciences Ltd.,Hyderabad(Kondapur),1-4 yrs,Marketing Executive- sales executive, ,150000 - 200000 P.A. Coveyance Allowance,2018-03-31,1,4,150000,200000
https://www.naukri.com/job-listings-Manager-Merchandising-operations-marketing-e-commerce-LITTLE-TAGS-E-COMMERCE-Delhi-NCR-Vasant-Kunj-5-to-10-years-310318004315?src=jobsearchDesk&sid=15229205337698&xp=33&px=23,Manager- Merchandising/operations/marketing (e-commerce),Manager- Merchandising/operations/marketing (e-commerce),LITTLE TAGS E-COMMERCE,Delhi NCR(Vasant Kunj),5-10 yrs,Marketing- Merchandising- E - commerce- Product Development, ,500000 - 1000000 P.A. Salary no bar for right candi...,2018-04-01,5,10,500000,1000000
https://www.naukri.com/job-listings-Urgent-Opening-for-Tele-Marketing-Executive-secunderabad-Dealmoney-Securities-Pvt-Ltd-Hyderabad-1-to-6-years-310318004206?src=jobsearchDesk&sid=15229205337698&xp=34&px=23,Urgent Opening for Tele Marketing Executive-secunderabad,Urgent Opening for Tele Marketing Executive-secunderabad,Dealmoney Securities Pvt Ltd,Hyderabad,1-6 yrs,Sales- Telesales- Team Leading- teams leader- lead team, ,Not disclosed,2018-03-31,1,6,0,0
https://www.naukri.com/job-listings-Regional-Marketing-Manager-Mumbai-SRL-Limited-Mumbai-Mumbai-Suburbs-8-to-13-years-310318004128?src=jobsearchDesk&sid=15229205337698&xp=35&px=23,Regional Marketing Manager - Mumbai,Regional Marketing Manager - Mumbai,SRL Limited,Mumbai- Mumbai Suburbs,8-13 yrs,Retail Sales- Marketing Management- Promotions- Btl- Events...,ob Description As RMM- an individual has to take care of BTL activities plan and execution ...,900000 - 1400000 P.A.,2018-03-31,8,13,900000,1400000
https://www.naukri.com/job-listings-Tele-Marketing-Executive-The-Holidays-Club-Unit-of-Club-Holdays-Resorts-OPC-Pvt-Ltd-Bhopal-1-to-3-years-310318004100?src=jobsearchDesk&sid=15229205337698&xp=36&px=23,Tele Marketing Executive,Tele Marketing Executive,The Holidays Club( Unit of Club Holdays & Resorts (OPC) Pvt Ltd.),Bhopal,1-3 yrs,marketing- telemarketing- telecaller- telesales- outbound- bpo..., ,80000 - 125000 P.A. incentives,2018-03-31,1,3,80000,125000
