https://www.naukri.com/job-listings-Manager-Data-Scientist-Corp-Placements-Mumbai-Bengaluru-4-to-9-years-031117002368?src=jobsearchDesk&sid=15229212821302&xp=39&px=9,Manager - Data Scientist,Manager - Data Scientist,Corp Placements,Mumbai- Bengaluru,4-9 yrs,Data Scientist- vpn scientist- data science- Machine Learning models...,Responsible for building Recommendation Engine Model- propensity modelling- product affinity models- ...,Not disclosed,2018-02-10,4,9,0,0
https://www.naukri.com/job-listings-Sr-Data-Scientist-Bengaluru-11-to-16-years-010318900608?src=jobsearchDesk&sid=15229212821302&xp=40&px=9,Sr. Data Scientist,Sr. Data Scientist,Premium,Bengaluru,11-16 yrs,machine learning- data science- data mining- artificial intelligence...,Job Description: ...,Not disclosed,2018-03-05,11,16,0,0
https://www.naukri.com/job-listings-Data-Scientist-R-python-Spark-Delhi-5-to-10-years-270218900308?src=jobsearchDesk&sid=15229212821302&xp=41&px=9,Data Scientist - R/python & Spark,Data Scientist - R/python & Spark,Premium,Delhi,5-10 yrs,Deep Learning- R- Machine Learning- Python- Spark- Advanced Analytics- Data..., Job Description :    - Expert in Advanced Analytics  - Over 3+ years of ...,Not disclosed,2018-02-28,5,10,0,0
https://www.naukri.com/job-listings-Sr-Data-Scientist-analytics-Life-Insurance-Co-Mumbai-Vishwa-Management-Services-Mumbai-1-to-5-years-240118006097?src=jobsearchDesk&sid=15229212821302&xp=42&px=9,Sr. Data Scientist (analytics) - Life Insurance Co. - Mumbai,Sr. Data Scientist (analytics) - Life Insurance Co. - Mumbai,Vishwa Management Services,Mumbai,1-5 yrs,Machine Learning- Tableau- Algorithms- Data Science, ,800000 - 950000 P.A.,2018-02-20,1,5,800000,950000
https://www.naukri.com/job-listings-Data-Scientist-R-python-Spark-Consulting-Firm-Pune-3-to-8-years-230218900277?src=jobsearchDesk&sid=15229212821302&xp=43&px=9,Data Scientist - R/python & Spark - Consulting Firm,Data Scientist - R/python & Spark - Consulting Firm,Premium,Pune,3-8 yrs,deep learning- r- machine learning- python- spark- advanced analytics- data...,- Expert in Advanced Analytics  - Over 3+ years of experience in Consulting and Implementation ...,Not disclosed,2018-02-26,3,8,0,0
https://www.naukri.com/job-listings-Data-Scientist-Bengaluru-3-to-8-years-150717900542?src=jobsearchDesk&sid=15229212821302&xp=44&px=9,Data Scientist,Data Scientist,Premium,Bengaluru,3-8 yrs,AdSense- Google Analytics- Google AdWords- Facebook- Data Structures...,Role and Tasks   Role Duration o The role is a temporary / part-time role o The role is open ...,Not disclosed,2018-02-28,3,8,0,0
https://www.naukri.com/job-listings-Data-Scientist-Python-r-Mumbai-2-to-5-years-050218900041?src=jobsearchDesk&sid=15229212821302&xp=45&px=9,Data Scientist - Python/r,Data Scientist - Python/r,Premium,Mumbai,2-5 yrs,Data Analysis- Data Mining- Data Collection- R- Research...,Duties & Responsibilities:  - Designing and implementing the database architecture for data ...,Not disclosed,2018-02-06,2,5,0,0
https://www.naukri.com/job-listings-Opening-for-Data-Scientist-Position-Careernet-Technologies-Pvt-Ltd-Bengaluru-2-to-7-years-041017006554?src=jobsearchDesk&sid=15229212821302&xp=46&px=9,Opening for Data Scientist Position,Opening for Data Scientist Position,Careernet Technologies Pvt Ltd,Bengaluru,2-7 yrs,data science- big data- machine learning- Hadoop- Hive...,1. Own and execute end to end Data science projects  2. Translate client requirements into ...,Not disclosed,2018-02-11,2,7,0,0
https://www.naukri.com/job-listings-DATA-Scientist-Personnel-Search-Services-Pvt-Ltd-Mumbai-4-to-7-years-030318001579?src=jobsearchDesk&sid=15229212821302&xp=47&px=9,DATA Scientist,DATA Scientist,Personnel Search Services Pvt Ltd,Mumbai,4-7 yrs,quantitative analytics or data modeling- Python- C- C++- Java- SQL, Analyze raw data: assessing quality- cleansing- structuring for downstream processing ...,Not disclosed,2018-03-06,4,7,0,0
https://www.naukri.com/job-listings-Data-Scientist-Arminus-Software-Pvt-Ltd-Mumbai-3-to-7-years-160318900212?src=jobsearchDesk&sid=15229212821302&xp=48&px=9,Data Scientist,Data Scientist,Arminus Software Pvt. Ltd.,Mumbai,3-7 yrs,Machine Learning- Python- R- Spark- Algorithms- Data Scientist,Develop statistical and machine learning algorithms in R/SAS/Python/Spark)
Work ...,Not disclosed,2018-03-16,3,7,0,0
https://www.naukri.com/job-listings-Lead-Data-Scientist-Advanced-Analytics-Jurist-Zone-Pune-7-to-12-years-160318004435?src=jobsearchDesk&sid=15229212821302&xp=49&px=9,Lead Data Scientist / Advanced Analytics,Lead Data Scientist / Advanced Analytics,Jurist Zone,Pune,7-12 yrs,Advanced Analytics- SAS- SQL- R- Python,Lead a team of consultants working on Advance analytical tools like SAS R Python SQL ...,1500000 - 2000000 P.A.,2018-03-19,7,12,1500000,2000000
https://www.naukri.com/job-listings-Data-Scientist-Efftronics-Systems-Private-Limited-Vijayawada-2-to-5-years-230318900027?src=jobsearchDesk&sid=15229212821302&xp=50&px=9,Data Scientist,Data Scientist,Efftronics Systems Private Limited,Vijayawada,2-5 yrs,data collection- integration- BigData framework- Java- C++- Python- R..., ,Not disclosed,2018-03-23,2,5,0,0
https://www.naukri.com/job-listings-Data-Scientist-Prakshep-Bengaluru-2-to-4-years-090318006073?src=jobsearchDesk&sid=15229212831178&xp=1&px=10,Data Scientist,Data Scientist,Prakshep,Bengaluru,2-4 yrs,C++- Image Processing- Opencv- Computer Vision- Pattern Recognition- Python..., Job Description   To be eligible for data scientist role at prakshep you need to have ...,Not disclosed,2018-03-09,2,4,0,0
https://www.naukri.com/job-listings-Data-Scientist-consultant-Allstate-Solutions-Private-Limited-Bengaluru-7-to-10-years-290318900161?src=jobsearchDesk&sid=15229212831178&xp=2&px=10,Data Scientist (consultant),Data Scientist (consultant),Allstate Solutions Private Limited,Bengaluru,7-10 yrs,Hive- NoSQL- HBase- Pig- Java- Cassandra- D3.Js- MongoDB- Python...,We are looking for technically savvy Data Engineers who would be driven by passion to aid building of ...,Not disclosed,2018-03-29,7,10,0,0
https://www.naukri.com/job-listings-Data-Scientist-Deep-Learning-with-Python-Rorodata-Startup-Hyderabad-3-to-8-years-070318900235?src=jobsearchDesk&sid=15229212831178&xp=3&px=10,Data Scientist - Deep Learning with Python,Data Scientist - Deep Learning with Python,Rorodata- Startup,Hyderabad,3-8 yrs,Data Scientist- Python- Keras- CNN- RNN- LSTMs- GANs- machine learning, Responsibilities    	Work with clients to understand and formulate ML/AI solutions ...,Not disclosed,2018-03-08,3,8,0,0
https://www.naukri.com/job-listings-Data-Scientist-Confidential-Bengaluru-5-to-8-years-210817902745?src=jobsearchDesk&sid=15229212831178&xp=4&px=10,Data Scientist,Data Scientist,Confidential,Bengaluru,5-8 yrs,Underwriting- Risk management- SAS- SQL- Business Analyst...,Responsibility:   Work with Modeling teams and LoB actuary teams to validate and document pricing ...,Not disclosed,2018-02-28,5,8,0,0
https://www.naukri.com/job-listings-Data-Scientist-VMock-Gurgaon-0-to-3-years-090318006410?src=jobsearchDesk&sid=15229212831178&xp=5&px=10,Data Scientist,Data Scientist,VMock,Gurgaon,0-3 yrs,C- HTML- Laravel- CSS- C++- PHP- MySQL- Opencv- Python- Computer Vision..., Job description: Responsibilities:    Take ownership for the product and work ...,Not disclosed,2018-03-12,0,3,0,0
https://www.naukri.com/job-listings-Data-Scientist-PricewaterhouseCoopers-Service-Delivery-Center-Kol-Kolkata-2-to-5-years-050218900612?src=jobsearchDesk&sid=15229212831178&xp=6&px=10,Data Scientist,Data Scientist,PricewaterhouseCoopers Service Delivery Center Kol,Kolkata,2-5 yrs,Analytical- Coding- Analytics- Machine learning- Business operations- Tools...,The candidate will be required to apply logical reasoning -  analytical approach and leverage analytics ...,Not disclosed,2018-02-05,2,5,0,0
https://www.naukri.com/job-listings-Senior-Scientist-NLP-Machine-Learning-Data-Mining-Professional-CAREER-MAKERS-Bengaluru-2-to-7-years-210318003856?src=jobsearchDesk&sid=15229212831178&xp=7&px=10,Senior Scientist / NLP/ Machine Learning/ Data Mining Professional,Senior Scientist / NLP/ Machine Learning/ Data Mining Professional,CAREER MAKERS,Bengaluru,2-7 yrs,NLP- Machine Learning- Data Mining- SAS- SQL- Linux- UNIX- Python- Java..., Major responsibilities:    - Use statistics- NLP and machine learning techniques to ...,Not disclosed,2018-03-22,2,7,0,0
https://www.naukri.com/job-listings-Data-Scientist-5-7-Years-Gr-Noida-Techs-to-Suit-Inc-Greater-Noida-5-to-7-years-230218007943?src=jobsearchDesk&sid=15229212831178&xp=8&px=10,Data Scientist// 5-7 Years // Gr. Noida,Data Scientist// 5-7 Years // Gr. Noida,Techs to Suit Inc,Greater Noida,5-7 yrs,datascience- python- R- statistical- predictive- statistical modelling...,Hi-    We have a job opportunity for Data Scientist for Gr.Noida. ...,Not disclosed,2018-03-07,5,7,0,0
https://www.naukri.com/job-listings-Hiring-for-Lead-Data-Scientist-Role-Finder-Trivandrum-6-to-11-years-220218001272?src=jobsearchDesk&sid=15229212831178&xp=9&px=10,Hiring for Lead Data Scientist Role,Hiring for Lead Data Scientist Role,Job Finder,Trivandrum,6-11 yrs,r- data analytics- Predictive Modeling- Data Science- Data Scientist- SAS..., ,Not disclosed,2018-02-22,6,11,0,0
https://www.naukri.com/job-listings-Data-Scientist-Tatvic-Ahmedabad-3-to-8-years-260218901618?src=jobsearchDesk&sid=15229212831178&xp=10&px=10,Data Scientist,Data Scientist,Tatvic,Ahmedabad,3-8 yrs,Data Scientist- Scripting- Python- R- Machine Learning- MySQL- MongoDB..., What youll do: ...,Not disclosed,2018-02-28,3,8,0,0
https://www.naukri.com/job-listings-Data-Scientist-Studio-Bengaluru-8-to-12-years-090218008192?src=jobsearchDesk&sid=15229212831178&xp=11&px=10,Data Scientist,Data Scientist,Job Studio,Bengaluru,8-12 yrs,big data- machine learning- analytics- watson- data analysis- cloud- java...,Overall Responsibility: To support Value Chain's  Chinese Development team to integrate IBM Watson ...,Not disclosed,2018-02-14,8,12,0,0
https://www.naukri.com/job-listings-Data-Scientist-R-SAS-SDM-Role-Finder-Chennai-Hyderabad-6-to-11-years-050218003319?src=jobsearchDesk&sid=15229212831178&xp=12&px=10,Data Scientist- R & SAS  (SDM Role),Data Scientist- R & SAS  (SDM Role),Job Finder,Chennai- Hyderabad,6-11 yrs,SAS- R- Life Cycle- Predictive Modeling- statistical modeling- Python- Data..., ,1000000 - 2000000 P.A. sk,2018-02-05,6,11,1000000,2000000
https://www.naukri.com/job-listings-Python-Data-Scientist-Analyst-Sr-Analyst-OST-Placement-Search-Private-Limited-Delhi-NCR-Bengaluru-Mumbai-2-to-6-years-051217003864?src=jobsearchDesk&sid=15229212831178&xp=13&px=10,Python Data Scientist - Analyst/ Sr Analyst,Python Data Scientist - Analyst/ Sr Analyst,OST Placement Search Private Limited,Delhi NCR- Bengaluru- Mumbai,2-6 yrs,Analytical Techniques,Position is with an Analytics and Consulting MNC. Client is looking for candidates with ...,1000000 - 2000000 P.A.,2018-02-09,2,6,1000000,2000000
https://www.naukri.com/job-listings-Data-Scientist-Bengaluru-4-to-9-years-280318900483?src=jobsearchDesk&sid=15229212831178&xp=14&px=10,Data Scientist,Data Scientist,Premium,Bengaluru,4-9 yrs,Data Scientist- predictive modeling- analytics- machine learning...,- 4+ years of expertise with a Bachelors/Masters degree in statistics- computer science- mathematics ...,Not disclosed,2018-03-29,4,9,0,0
https://www.naukri.com/job-listings-Data-Scientist-Python-Machine-Learning-Bengaluru-7-to-12-years-260318004351?src=jobsearchDesk&sid=15229212831178&xp=15&px=10,Data Scientist - Python / Machine Learning,Data Scientist - Python / Machine Learning,Premium,Bengaluru,7-12 yrs,Data Scientist- Python- Machine Learning- NoSQL databases- MongoDB- SQL...,Any Master's degree in the field of Statistics / Mathematics / Computer Science  Preferred: M.Sc. ...,Not disclosed,2018-03-27,7,12,0,0
https://www.naukri.com/job-listings-Data-Scientist-Machine-Learning-advanced-Analytics-Careernet-Technologies-Pvt-Ltd-Bengaluru-3-to-8-years-171117000343?src=jobsearchDesk&sid=15229212831178&xp=16&px=10,Data Scientist - Machine Learning/advanced Analytics,Data Scientist - Machine Learning/advanced Analytics,Careernet Technologies Pvt Ltd,Bengaluru,3-8 yrs,machine learning- deep learning- natural language processing- python- nlp...,Hiring for Data Scientists - E-Commerce giant in Bangalore. 2-8 yrs of experience in Machine ...,Not disclosed,2018-03-26,3,8,0,0
https://www.naukri.com/job-listings-Data-Scientist-with-Statistical-Modeling-exp-for-BPO-in-Pune-Wize-Careers-Consultants-Pune-7-to-11-years-261017001938?src=jobsearchDesk&sid=15229212831178&xp=17&px=10,Data Scientist with Statistical Modeling exp for BPO in Pune,Data Scientist with Statistical Modeling exp for BPO in Pune,Wize Careers Consultants,Pune,7-11 yrs,statistical modeling- r- sql- regression model- decision tree...,Minimum relevant experience in analytics and data science should be at least 4 years.          R- ...,Not disclosed,2018-03-28,7,11,0,0
https://www.naukri.com/job-listings-Data-Scientist-Deep-Learning-Computer-Vision-Help-Me-Build-Technologies-Pvt-Ltd-Gurgaon-2-to-7-years-260218002524?src=jobsearchDesk&sid=15229212831178&xp=18&px=10,Data Scientist - Deep Learning/ Computer Vision,Data Scientist - Deep Learning/ Computer Vision,Help Me Build Technologies Pvt. Ltd.,Gurgaon,2-7 yrs,Deep Learning- Computer Vision- Algorithms- Research- Machine Learning...,1. Develop and implement algorithms to introduce intelligence in IP cameras for real time analysis as ...,Not disclosed,2018-02-27,2,7,0,0
https://www.naukri.com/job-listings-Data-Scientist-I-Mind-Your-Business-Bengaluru-2-to-5-years-190218000797?src=jobsearchDesk&sid=15229212831178&xp=19&px=10,Data Scientist,Data Scientist,I Mind Your Business,Bengaluru,2-5 yrs,Data Science- NoSQL- Information Retrieval- Machine Learning- Python- SQL..., The ideal candidate will:  - Apply Machine learning techniques on Retail data to come up ...,Not disclosed,2018-02-20,2,5,0,0
https://www.naukri.com/job-listings-Data-Scientist-Global-Mantra-Innovations-Private-Limited-Chennai-2-to-7-years-130218007853?src=jobsearchDesk&sid=15229212831178&xp=20&px=10,Data Scientist,Data Scientist,Global Mantra Innovations Private Limited,Chennai,2-7 yrs,Data Science- Machine Learning- Predictive Modeling, 2+ years of Experience in data science Hands-on experience in projects involving NLP/Image ...,Not disclosed,2018-02-15,2,7,0,0
https://www.naukri.com/job-listings-Data-Scientist-setuserv-Startup-Hyderabad-15-to-20-years-060218901798?src=jobsearchDesk&sid=15229212831178&xp=21&px=10,Data Scientist,Data Scientist,setuserv-Startup-,Hyderabad,15-20 yrs,Deep Learning- NLP- Machine Learning- Artificial Intelligence- Python- Java...,Develop innovative solutions that combine deep learning approaches with human intelligence- Build on ...,Not disclosed,2018-02-07,15,20,0,0
https://www.naukri.com/job-listings-Data-Scientist-Contract-To-HIRE-Position-DVG-Tech-Solutions-Pvt-Ltd-Hyderabad-5-to-9-years-200318007896?src=jobsearchDesk&sid=15229212831178&xp=22&px=10,Data Scientist Contract To HIRE Position,Data Scientist Contract To HIRE Position,DVG Tech Solutions Pvt Ltd,Hyderabad,5-9 yrs,R- NLP- Machine Learning- Python- Predictive Analytics..., ,475000 - 975000 P.A.,2018-03-20,5,9,475000,975000
https://www.naukri.com/job-listings-Hiring-Financials-Data-Scientist-agility-hyderabad-Agility-E-Services-Pvt-Ltd-Hyderabad-10-to-20-years-190617006303?src=jobsearchDesk&sid=15229212831178&xp=23&px=10,Hiring Financials Data Scientist@agility-hyderabad,Hiring Financials Data Scientist@agility-hyderabad,Agility E Services Pvt. Ltd.,Hyderabad,10-20 yrs,R- PYTHON- Financial Analyst- investmnet banking,Hi-  We are looking to hire Data Scientist with Exposure in handling huge amount of Financial ...,Not disclosed,2018-03-30,10,20,0,0
https://www.naukri.com/job-listings-Data-Scientist-SAM-Manpower-Career-Services-LLP-Kolkata-1-to-3-years-100717901718?src=jobsearchDesk&sid=15229212831178&xp=24&px=10,Data Scientist,Data Scientist,SAM Manpower & Career Services LLP,Kolkata,1-3 yrs,Data Science- Machine Learning- Predictive Analytics- Machine- Learning..., ,Not disclosed,2018-03-28,1,3,0,0
https://www.naukri.com/job-listings-Data-Scientist-Required-for-BPO-Wize-Careers-Consultants-Mumbai-Bengaluru-5-to-10-years-251017000915?src=jobsearchDesk&sid=15229212831178&xp=25&px=10,Data Scientist Required for BPO,Data Scientist Required for BPO,Wize Careers Consultants,Mumbai- Bengaluru,5-10 yrs,data mining- Python Developer- machine learning, ,Not disclosed,2018-03-26,5,10,0,0
https://www.naukri.com/job-listings-Data-Scientist-Lead-KRM-Global-Bengaluru-7-to-9-years-170118007137?src=jobsearchDesk&sid=15229212831178&xp=26&px=10,Data Scientist Lead,Data Scientist Lead,KRM Global,Bengaluru,7-9 yrs,Data Scientist Lead, Job Profile:     Candidate would be responsible to handle data analysis / data ...,Not disclosed,2018-03-17,7,9,0,0
https://www.naukri.com/job-listings-Opening-Data-Scientist-AI-Developer-artificial-Intelligence-Red-Blink-Private-Limited-Chandigarh-2-to-4-years-090118004254?src=jobsearchDesk&sid=15229212831178&xp=27&px=10,Opening Data Scientist (AI Developer\artificial Intelligence),Opening Data Scientist (AI Developer\artificial Intelligence),Red Blink Private Limited,Chandigarh,2-4 yrs,Deep Learning- Java- C++- Artificial Intelligence- NLP- Algorithms...,We are looking for Redblink is looking for a Data Scientist to join our growing team. We are trying ...,500000 - 1200000 P.A. Negotiable for deserving cand...,2018-03-13,2,4,500000,1200000
https://www.naukri.com/job-listings-Data-Scientist-Engineer-Bold-Technology-Systems-Private-Limited-Noida-5-to-8-years-060218002803?src=jobsearchDesk&sid=15229212831178&xp=28&px=10,Data Scientist Engineer,Data Scientist Engineer,Bold Technology Systems Private Limited,Noida,5-8 yrs,machine learning- python- hadoop- data scientist- r- predictive modeling..., BOLD Technology Systems Pvt. Ltd is a product company founded by a pair of technology entrepreneurs ...,Not disclosed,2018-02-07,5,8,0,0
https://www.naukri.com/job-listings-Data-Scientist-Lead-Conversant-Software-Development-And-Campaign-Management-Services-LLP-Bengaluru-5-to-7-years-291217900910?src=jobsearchDesk&sid=15229212831178&xp=29&px=10,Data Scientist Lead,Data Scientist Lead,Conversant Software Development And Campaign  Management Services LLP,Bengaluru,5-7 yrs,data scientist- Data Scientist Lead- Python- R- QA / QC- project management...,Summary Epsilon is one of the largest digital marketing agencies in the world- and we are currently ...,Not disclosed,2018-03-05,5,7,0,0
https://www.naukri.com/job-listings-Data-Scientist-Delhi-NCR-8-to-12-years-200318901842?src=jobsearchDesk&sid=15229212831178&xp=30&px=10,Data Scientist,Data Scientist,Premium,Delhi NCR,8-12 yrs,Qualitative Research- Quantitative Research- Infographics- Product Design..., Job description   Our client is looking for a User Experience Researcher with a strong ...,Not disclosed,2018-03-22,8,12,0,0
https://www.naukri.com/job-listings-Senior-Data-Scientist-Arminus-Software-Pvt-Ltd-Navi-Mumbai-10-to-15-years-080218901579?src=jobsearchDesk&sid=15229212831178&xp=31&px=10,Senior Data Scientist,Senior Data Scientist,Arminus Software Pvt. Ltd.,Navi Mumbai,10-15 yrs,Data Analysis- Data Scientist- data research, ,Not disclosed,2018-02-08,10,15,0,0
https://www.naukri.com/job-listings-SR-Data-Scientist-jobs-Product-Development-Company-Value-Vision-Management-Consultant-Bengaluru-11-to-16-years-020318000474?src=jobsearchDesk&sid=15229212831178&xp=32&px=10,SR Data Scientist jobs @ Product Development Company,SR Data Scientist jobs @ Product Development Company,Value Vision Management Consultant,Bengaluru,11-16 yrs,machine learning- data science- artificial intelligence- data mining...,Sr Data Scientist 
11-16 years of experience in the area of data science/machine ...,Not disclosed,2018-03-05,11,16,0,0
https://www.naukri.com/job-listings-Data-Scientist-With-Ecommerce-MNC-Unison-International-Consulting-Pvt-Ltd-Gurgaon-3-to-8-years-200218007989?src=jobsearchDesk&sid=15229212831178&xp=33&px=10,Data Scientist With Ecommerce MNC,Data Scientist With Ecommerce MNC,Unison International Consulting Pvt. Ltd,Gurgaon,3-8 yrs,SQL- R- Machine Learning- Python- Google Analytics- Excel...,Handsome experience in a quantitative analysis role. 	It would be a Technology based role which ...,2000000 - 2500000 P.A.,2018-02-22,3,8,2000000,2500000
https://www.naukri.com/job-listings-Data-Scientist-4-Consulting-firm-at-Chennai-AJAX-Consulting-Chennai-7-to-12-years-230118004036?src=jobsearchDesk&sid=15229212831178&xp=34&px=10,Data Scientist 4 Consulting firm at Chennai.,Data Scientist 4 Consulting firm at Chennai.,AJAX Consulting,Chennai,7-12 yrs,Hdfs- Spark- Hadoop- Mapreduce- SQL- Big Data- Logistic Regression- R- SAS-...,Machine Intelligence & Machine Learning

Hands on End-to-end modelling exp ...,Not disclosed,2018-02-16,7,12,0,0
https://www.naukri.com/job-listings-Machine-Learning-Data-Scientist-Analyst-with-Bigdata-Experience-Freelancer-Sindhu-Bengaluru-10-to-20-years-080218003096?src=jobsearchDesk&sid=15229212831178&xp=35&px=10,Machine Learning Data Scientist / Analyst with Bigdata Experience,Machine Learning Data Scientist / Analyst with Bigdata Experience,Freelancer Sindhu,Bengaluru,10-20 yrs,Predictive Modeling- Analytics- Data Science- Data Analysis- SQL- NoSql..., ,800000 - 1300000 P.A.,2018-02-15,10,20,800000,1300000
https://www.naukri.com/job-listings-Data-Scientist-IT-Bengaluru-7-to-10-years-280318900737?src=jobsearchDesk&sid=15229212831178&xp=36&px=10,Data Scientist - IT,Data Scientist - IT,Premium,Bengaluru,7-10 yrs,data scientist- statistical testing- regression- k - nn- naive bayes- svm...,- Excellent understanding of machine learning techniques and algorithms- such as k-NN- Naive Bayes- SVM- ...,Not disclosed,2018-03-29,7,10,0,0
https://www.naukri.com/job-listings-Data-Scientist-Deep-Content-Indexing-Python-Pune-5-to-10-years-230318900539?src=jobsearchDesk&sid=15229212831178&xp=37&px=10,Data Scientist - Deep Content Indexing - Python,Data Scientist - Deep Content Indexing - Python,Premium,Pune,5-10 yrs,C- Deep Learning- C++- Computer Vision- Machine Learning- Python...,Data Scientist - Deep Content Indexing - Python (5-10 yrs)  Key Responsibility And ...,Not disclosed,2018-03-24,5,10,0,0
https://www.naukri.com/job-listings-Data-Scientist-R-Python-RESOURCE-ACCESS-MANAGEMENT-SOLUTIONS-PVT-LTD-Chennai-9-to-14-years-220318002041?src=jobsearchDesk&sid=15229212831178&xp=38&px=10,Data Scientist - R Python,Data Scientist - R Python,RESOURCE ACCESS MANAGEMENT SOLUTIONS PVT LTD,Chennai,9-14 yrs,machine learning- python- multivariate analysis- tableau..., Role and Responsibilities:   Excellent mix of Statistics- Ops research and computer ...,Not disclosed,2018-03-22,9,14,0,0
https://www.naukri.com/job-listings-Data-Scientist-eNFLUENCE-IT-Services-Pvt-Ltd-Mumbai-3-to-4-years-210318007164?src=jobsearchDesk&sid=15229212831178&xp=39&px=10,Data Scientist,Data Scientist,eNFLUENCE IT Services Pvt. Ltd.,Mumbai,3-4 yrs,Linear Regression- Logistic Regression- R...,First one should be sound with R  ( Hands on with Linear Regression/Logistic Regression and Other Stats ...,Not disclosed,2018-03-21,3,4,0,0
https://www.naukri.com/job-listings-Data-Scientist-Ecommerce-Product-Development-Firm-Iit-nit-iisc-BuzzHire-Gurgaon-3-to-6-years-190218000753?src=jobsearchDesk&sid=15229212831178&xp=40&px=10,Data Scientist - Ecommerce & Product Development Firm - Iit/nit/iisc,Data Scientist - Ecommerce & Product Development Firm - Iit/nit/iisc,BuzzHire,Gurgaon,3-6 yrs,Networking- Supply Planning- Demand Forecasting- Consumer Behavior- Network...,Data Scientist - eCommerce & Product Development Firm - IIT/NIT/ IISc/IIIT/ Thapar/BITS ...,Not disclosed,2018-02-20,3,6,0,0
https://www.naukri.com/job-listings-Data-Scientist-Python-Banking-Domain-HuQuo-Delhi-NCR-1-to-4-years-160218900532?src=jobsearchDesk&sid=15229212831178&xp=41&px=10,Data Scientist - Python - Banking Domain,Data Scientist - Python - Banking Domain,HuQuo,Delhi NCR,1-4 yrs,Data Scientist- Python- PySpark- Hbase- NLTK- SVM- NaiveBayes,Looking for self-driven Python data scientists having 1-4 years of experience of coding in Python. ...,Not disclosed,2018-02-19,1,4,0,0
https://www.naukri.com/job-listings-Data-Scientist-PiSight-Startup-Mumbai-2-to-5-years-050318901828?src=jobsearchDesk&sid=15229212831178&xp=42&px=10,Data Scientist,Data Scientist,PiSight - Startup,Mumbai,2-5 yrs,Hadoop- Hive- NoSQL- HBase- Spark- Pig- Cassandra- SQL- MongoDB- Hibernate-...,-We are looking for a Data Scientist that will help us discover the information hidden in vast amounts ...,Not disclosed,2018-03-07,2,5,0,0
https://www.naukri.com/job-listings-Data-Scientist-Dunzo-Startup-Bengaluru-5-to-10-years-150218900369?src=jobsearchDesk&sid=15229212831178&xp=43&px=10,Data Scientist,Data Scientist,Dunzo - Startup,Bengaluru,5-10 yrs,Data Science- Web Technologies- Machine Learning- Matlab- problem solving, Job description:  Exp: 5-10 years  Lead data science efforts at dunzo and responsible ...,Not disclosed,2018-02-16,5,10,0,0
https://www.naukri.com/job-listings-Data-Scientist-Algo-Leap-Technologies-Hyderabad-Madhapur-8-to-13-years-130318005645?src=jobsearchDesk&sid=15229212831178&xp=44&px=10,Data Scientist,Data Scientist,Algo Leap Technologies,Hyderabad(Madhapur),8-13 yrs,Trend Analysis- machine learning- Neural Networks- tensor flow- python...,The Data Scientist should Lead- mentor- design- code and validate the modules for ...,Not disclosed,2018-03-15,8,13,0,0
