https://www.naukri.com/job-listings-Senior-Manager-Sales-Marketing-Veda-Corporate-Services-Delhi-6-to-10-years-030418005127?src=jobsearchDesk&sid=15229204984982&xp=20&px=10,Senior Manager Sales & Marketing,Senior Manager Sales & Marketing,Veda Corporate Services,Delhi,6-10 yrs,Sales- Marketing- Education,Develop a reliable and accurate marketing information system (statics- target market info- competitor ...,1000000 - 1500000 P.A.,2018-04-03,6,10,1000000,1500000
https://www.naukri.com/job-listings-Digital-Marketing-Internship-7500-Stipend-per-Month-Nest-Global-Consulting-Services-Hyderabad-0-to-4-years-030418004571?src=jobsearchDesk&sid=15229204984982&xp=21&px=10,Digital Marketing Internship @7500 Stipend per Month,Digital Marketing Internship @7500 Stipend per Month,Nest Global Consulting Services,Hyderabad,0-4 yrs,Digital Marketing- SEO- SEO fresher- seo internship...,  hiring digital marketing fresher to work as Interns.   This is a pay and join ...,100000 - 300000 P.A.,2018-04-03,0,4,100000,300000
https://www.naukri.com/job-listings-Hiring-For-Inside-Sales-For-Digital-Marketing-Company-Bhandup-Loc-Excel-HR-Solutions-Private-Limited-Mumbai-Thane-Navi-Mumbai-2-to-6-years-030418003746?src=jobsearchDesk&sid=15229204984982&xp=22&px=10,Hiring For Inside Sales For Digital Marketing Company- Bhandup Loc,Hiring For Inside Sales For Digital Marketing Company- Bhandup Loc,Excel HR Solutions Private Limited,Mumbai- Thane- Navi Mumbai,2-6 yrs,inside sales- digital marketing- online advertising- Inside Sales Executive...,Conduct needs analysis of each prospect to understand the clients advertising needs and develop the ...,200000 - 300000 P.A.,2018-04-03,2,6,200000,300000
https://www.naukri.com/job-listings-Assistant-Manager-Marketing-punjab-Region-Retail-Apparel-Only-BCS-Consulting-Pvt-Ltd-Chandigarh-5-to-7-years-030418003145?src=jobsearchDesk&sid=15229204984982&xp=23&px=10,Assistant Manager - Marketing (punjab Region) - Retail Apparel Only,Assistant Manager - Marketing (punjab Region) - Retail Apparel Only,BCS Consulting Pvt Ltd.,Chandigarh,5-7 yrs,Marketing- Btl- Atl- Branding- Events- Market Intelligence- CRM- Region..., ,600000 - 700000 P.A.,2018-04-03,5,7,600000,700000
https://www.naukri.com/job-listings-Marketing-AJ-470-ASIAPOWER-OVERSEAS-EMPLOYMENT-SERVICES-Qatar-3-to-5-years-030418003081?src=jobsearchDesk&sid=15229204984982&xp=24&px=10,Marketing (AJ - 470),Marketing (AJ - 470),ASIAPOWER OVERSEAS EMPLOYMENT SERVICES.,Qatar,3-5 yrs,Marketing Executive- MBA- Product- Marketing, OFFICE TIMING: 10.00 AM TO 5.00 PM (MON TO SAT)  Urgently required for leading Multi Trade ...,Not disclosed,2018-04-03,3,5,0,0
https://www.naukri.com/job-listings-Branch-Manager-Direct-Marketing-Mumbai-Location-Golden-Opportunities-Pvt-Ltd-Mumbai-6-to-10-years-030418000680?src=jobsearchDesk&sid=15229204984982&xp=25&px=10,Branch Manager- Direct Marketing - Mumbai Location,Branch Manager- Direct Marketing - Mumbai Location,Golden Opportunities Pvt Ltd,Mumbai,6-10 yrs,Sales- Direct Marketing- Team Management- Branch Management...,  JOB DESCRIPTION:    Openings for Life insurance broking firm. ...,800000 - 1300000 P.A.,2018-04-03,6,10,800000,1300000
https://www.naukri.com/job-listings-Marketing-Manager-Luxury-Automobile-Dealership-Delhi-Futurestep-Recruitment-Services-Private-Limited-Delhi-5-to-10-years-030418000543?src=jobsearchDesk&sid=15229204984982&xp=26&px=10,Marketing Manager - Luxury Automobile Dealership - Delhi,Marketing Manager - Luxury Automobile Dealership - Delhi,Futurestep Recruitment Services Private Limited,Delhi,5-10 yrs,Marketing Management- Luxury- ATL- BTL- traditional marketing- marketing...,  Job role:        Entire marketing activities traditional and ...,Not disclosed,2018-04-03,5,10,0,0
https://www.naukri.com/job-listings-Marketing-Executive-Manager-Sales-Manager-call-asap-Creative-Hands-HR-Consultancy-Kochi-Navi-Mumbai-Delhi-NCR-0-to-5-years-030418000302?src=jobsearchDesk&sid=15229204984982&xp=27&px=10,Marketing Executive & Manager / Sales Manager - call asap,Marketing Executive & Manager / Sales Manager - call asap,Creative Hands HR Consultancy,Kochi- Navi Mumbai- Delhi NCR,0-5 yrs,marketing management- btl- sales management- brand awareness..., We have an opportunity for Education Ecommerce company       Work ...,350000 - 550000 P.A.,2018-04-03,0,5,350000,550000
https://www.naukri.com/job-listings-Pre-Sales-Executive-Bid-Fresh-Marketing-Executive-MBA-Marketing-SLA-Consultants-India-Delhi-NCR-Gurgaon-Noida-0-to-5-years-030418000224?src=jobsearchDesk&sid=15229204984982&xp=28&px=10,Pre Sales Executive Bid  Fresh Marketing Executive - MBA Marketing,Pre Sales Executive Bid  Fresh Marketing Executive - MBA Marketing,SLA Consultants India,Delhi NCR- Gurgaon- Noida,0-5 yrs,Presales- rfp- rfq- proposal- tendering- contracts- contracts management..., ,225000 - 425000 P.A.,2018-04-03,0,5,225000,425000
https://www.naukri.com/job-listings-Urgent-Opening-for-Sales-and-Marketing-Engineer-bangalore-Shella-Consultants-Bengaluru-3-to-8-years-301217002792?src=jobsearchDesk&sid=15229204984982&xp=29&px=10,Urgent Opening for Sales and Marketing Engineer (bangalore),Urgent Opening for Sales and Marketing Engineer (bangalore),Shella Consultants,Bengaluru,3-8 yrs,Plumbing- Fire Fighting- HVAC- Sales- Ventilation- Customer Communication...,A company incorporated under the provisions of Indian Companies Act- 1956- through its managing director- ...,Not disclosed,2018-04-03,3,8,0,0
https://www.naukri.com/job-listings-Marketing-Asst-Manager-RANDSTAD-INDIA-PVT-LTD-Chennai-4-to-8-years-190617900672?src=jobsearchDesk&sid=15229204984982&xp=30&px=10,Marketing Asst. Manager,Marketing Asst. Manager,RANDSTAD INDIA PVT LTD,Chennai,4-8 yrs,Customer Service- Help Desk- Information- Telephony support...,- Adding New Customer base  - Supporting Existing Customer Base   - New Business Development ...,Not disclosed,2018-04-04,4,8,0,0
https://www.naukri.com/job-listings-Tele-Marketing-Executive-Ashkom-Media-India-Private-Limited-Mumbai-1-to-3-years-030418002542?src=jobsearchDesk&sid=15229204984982&xp=31&px=10,Tele Marketing Executive,Tele Marketing Executive,Ashkom Media India Private Limited,Mumbai,1-3 yrs,Telemarketing- Telecalling,Required telemarketing executive for mumbai- Thane ( West)location -communication skills is mandatory ...,1200000 - 1600000 P.A.,2018-04-03,1,3,1200000,1600000
https://www.naukri.com/job-listings-Telesales-Marketing-Bpo-Cso-Csr-Tsr-Tsa-Call-Center-voice-Inspiration-Manpower-Consultancy-Pvt-Ltd-Bengaluru-0-to-5-years-030418000832?src=jobsearchDesk&sid=15229204984982&xp=32&px=10,Telesales/ Marketing / Bpo / Cso / Csr / Tsr / Tsa / Call Center/voice,Telesales/ Marketing / Bpo / Cso / Csr / Tsr / Tsa / Call Center/voice,Inspiration Manpower Consultancy Pvt. Ltd.,Bengaluru,0-5 yrs,voice support- bpo- call center- customer support- technical support..., "Greetings from Inspiration Manpower Consultancy"   WE HAVE AN EXCELLENT OPENING FOR YOU ...,200000 - 500000 P.A.,2018-04-03,0,5,200000,500000
https://www.naukri.com/job-listings-Marketing-Executive-Required-fora-Hospitality-Sector-Kolkata-Career-Chronicle-Kolkata-2-to-7-years-170118000204?src=jobsearchDesk&sid=15229204984982&xp=33&px=10,Marketing Executive Required fora Hospitality Sector Kolkata,Marketing Executive Required fora Hospitality Sector Kolkata,Career Chronicle,Kolkata,2-7 yrs,Marketing Executive- business development executive- Hospitality, ,Not disclosed,2018-04-04,2,7,0,0
https://www.naukri.com/job-listings-Marketing-Analyst-Jobjunctioninfo-Pvt-Ltd-Bengaluru-1-to-2-years-080118002200?src=jobsearchDesk&sid=15229204984982&xp=34&px=10,Marketing Analyst,Marketing Analyst,Jobjunctioninfo Pvt. Ltd.,Bengaluru,1-2 yrs,Marketing Analysis- Online Sales- inside sales- tele sales- B2B sales..., ,Not disclosed,2018-04-03,1,2,0,0
https://www.naukri.com/job-listings-Indoor-Marketing-Jobjunctioninfo-Pvt-Ltd-Bengaluru-0-to-0-years-050118006374?src=jobsearchDesk&sid=15229204984982&xp=35&px=10,Indoor Marketing,Indoor Marketing,Jobjunctioninfo Pvt. Ltd.,Bengaluru,0-0 yrs,Sales- Marketing- Indoor sales- indoor marketing..., ,Not disclosed,2018-04-03,0,0,0,0
https://www.naukri.com/job-listings-Looking-for-sales-and-Marketing-Manger-Reliant-HR-Consultancy-Bengaluru-3-to-7-years-030418005462?src=jobsearchDesk&sid=15229204984982&xp=36&px=10,Looking for "sales and Marketing" Manger,Looking for "sales and Marketing" Manger,Reliant HR Consultancy,Bengaluru,3-7 yrs,Marketing Management- Sales- Business Development- BDM- filed sales..., ,Not disclosed,2018-04-03,3,7,0,0
https://www.naukri.com/job-listings-Marketing-Executive-sr-Marketing-in-Education-Industry-for-Shillong-Vishnu-HR-Solution-Shillong-1-to-6-years-030418005271?src=jobsearchDesk&sid=15229204984982&xp=37&px=10,Marketing Executive/sr. Marketing in Education Industry for Shillong,Marketing Executive/sr. Marketing in Education Industry for Shillong,Vishnu HR Solution,Shillong,1-6 yrs,Education Industry- institute industry- college industry..., ,150000 - 225000 P.A. +ta+incentive,2018-04-03,1,6,150000,225000
https://www.naukri.com/job-listings-Marketing-Executive-sr-Marketing-in-Education-Industry-for-Agartala-Vishnu-HR-Solution-Agartala-1-to-6-years-030418005248?src=jobsearchDesk&sid=15229204984982&xp=38&px=10,Marketing Executive/sr. Marketing in Education Industry for Agartala,Marketing Executive/sr. Marketing in Education Industry for Agartala,Vishnu HR Solution,Agartala,1-6 yrs,education industry- institute industry- college industry..., ,150000 - 225000 P.A. +ta+incentive,2018-04-03,1,6,150000,225000
https://www.naukri.com/job-listings-Marketing-Executive-sr-Marketing-in-Education-Industry-for-Kolkata-Vishnu-HR-Solution-Kolkata-1-to-6-years-030418005226?src=jobsearchDesk&sid=15229204984982&xp=39&px=10,Marketing Executive/sr. Marketing in Education Industry for Kolkata,Marketing Executive/sr. Marketing in Education Industry for Kolkata,Vishnu HR Solution,Kolkata,1-6 yrs,education industry- institute industry- college industry..., ,150000 - 225000 P.A. +ta+incentive,2018-04-03,1,6,150000,225000
https://www.naukri.com/job-listings-Sales-Marketing-Excellent-Solutions-Private-Limited-Delhi-NCR-2-to-7-years-030418004890?src=jobsearchDesk&sid=15229204984982&xp=40&px=10,Sales & Marketing,Sales & Marketing,Excellent Job Solutions Private Limited,Delhi NCR,2-7 yrs,marketing- sales- planning- product development- sales & Marketing..., ,250000 - 750000 P.A. Best in Industry,2018-04-03,2,7,250000,750000
https://www.naukri.com/job-listings-Urgent-Hiring-For-Sales-Marketing-MGR-For-Cable-CO-Bangalore-Landmark-ADV-Bengaluru-5-to-10-years-030418003870?src=jobsearchDesk&sid=15229204984982&xp=41&px=10,Urgent Hiring For Sales & Marketing MGR For  Cable CO.- Bangalore,Urgent Hiring For Sales & Marketing MGR For  Cable CO.- Bangalore,Landmark ADV,Bengaluru,5-10 yrs,sales executive- sales business development- sales manager..., ,400000 - 700000 P.A.,2018-04-03,5,10,400000,700000
https://www.naukri.com/job-listings-Urgent-Hiring-For-Sales-Marketing-MGR-For-Reputed-Cable-CO-HYD-Landmark-ADV-Hyderabad-5-to-10-years-030418003842?src=jobsearchDesk&sid=15229204984982&xp=42&px=10,Urgent Hiring For Sales & Marketing MGR For Reputed Cable CO.- HYD,Urgent Hiring For Sales & Marketing MGR For Reputed Cable CO.- HYD,Landmark ADV,Hyderabad,5-10 yrs,sales executive- sales business development- sales manager..., ,400000 - 700000 P.A.,2018-04-03,5,10,400000,700000
https://www.naukri.com/job-listings-Urgent-Hiring-For-Sales-Marketing-MGR-For-Reputed-Cable-CO-Mumbai-Landmark-ADV-Mumbai-5-to-10-years-030418003825?src=jobsearchDesk&sid=15229204984982&xp=43&px=10,Urgent Hiring For Sales & Marketing MGR For Reputed Cable CO.- Mumbai,Urgent Hiring For Sales & Marketing MGR For Reputed Cable CO.- Mumbai,Landmark ADV,Mumbai,5-10 yrs,sales executive- sales business development- sales manager..., ,400000 - 700000 P.A.,2018-04-03,5,10,400000,700000
https://www.naukri.com/job-listings-Hiring-Marketing-Executive-for-Retail-Industry-with-min-1-Yrs-Pune-Inteegrity-Solutions-Pune-1-to-6-years-030418003116?src=jobsearchDesk&sid=15229204984982&xp=44&px=10,Hiring Marketing Executive for Retail Industry with min 1 Yrs - Pune,Hiring Marketing Executive for Retail Industry with min 1 Yrs - Pune,Inteegrity Solutions,Pune,1-6 yrs,Screening- Retail Sales- Retail- channel- B2B- business to business..., ,200000 - 300000 P.A.,2018-04-03,1,6,200000,300000
https://www.naukri.com/job-listings-Analyst-consultant-Ecommerce-Digital-Marketing-Consumer-Goods-Indu-Mumbai-Bengaluru-2-to-7-years-020418901053?src=jobsearchDesk&sid=15229204984982&xp=45&px=10,Analyst/consultant - Ecommerce Digital Marketing - Consumer Goods Indu,Analyst/consultant - Ecommerce Digital Marketing - Consumer Goods Indu,Premium,Mumbai- Bengaluru,2-7 yrs,Field Sales- Digital Marketing- Digital Analytics- Google Analytics...,- Industry Expertise: Experience in Consumer Goods Industry is highly desirable  - Should have ...,Not disclosed,2018-04-04,2,7,0,0
https://www.naukri.com/job-listings-Zonal-Marketing-Manager-FMCG-Kolkata-8-to-13-years-020418900846?src=jobsearchDesk&sid=15229204984982&xp=46&px=10,Zonal Marketing Manager - FMCG,Zonal Marketing Manager - FMCG,Premium,Kolkata,8-13 yrs,Marketing Budget- Promotions- Brand Strategy- Brand Activation...,Brand Leadership and Market Share :  1. Pioneer and implement measurable and innovative ...,Not disclosed,2018-04-04,8,13,0,0
https://www.naukri.com/job-listings-Manager-marketing-Windows-Consultants-Pvt-Ltd-Mumbai-3-to-7-years-020418006590?src=jobsearchDesk&sid=15229204984982&xp=47&px=10,Manager-marketing,Manager-marketing,Windows Consultants Pvt. Ltd.,Mumbai,3-7 yrs,Marketing- Brand Activation- Events- Retail- Luxury- Client Servicing- Mba,Position Overview  Desigination-Marketing Manager    Mandate Skills ...,Not disclosed,2018-04-04,3,7,0,0
https://www.naukri.com/job-listings-Marketing-Head-real-Estate-Hector-and-Streak-Consulting-Pvt-Ltd-Mumbai-12-to-20-years-020418006277?src=jobsearchDesk&sid=15229204984982&xp=48&px=10,Marketing Head -real Estate,Marketing Head -real Estate,Hector and Streak Consulting Pvt Ltd,Mumbai,12-20 yrs,Database Marketing- Sales- Advertising Agency- Product Launch...,Conceptualize the creative campaign- liaise with and brief the advertising agency as well as the ...,5000000 - 7000000 P.A.,2018-04-04,12,20,5000000,7000000
https://www.naukri.com/job-listings-Looking-for-Business-Development-US-Market-For-Lead-Generation-Compunnel-Technology-India-Private-Limited-Noida-1-to-5-years-140318009280?src=jobsearchDesk&sid=15229204984982&xp=49&px=10,Looking for Business Development ( US Market) For Lead Generation,Looking for Business Development ( US Market) For Lead Generation,Compunnel Technology India Private Limited,Noida,1-5 yrs,BDE- Business Development Officer- International Business Development...,  Candidates from International BPO/ KPO/ Call center with good tech sales/ outbound calling/ ...,300000 - 750000 P.A. + Both side Pick/drop + Incent...,2018-04-03,1,5,300000,750000
https://www.naukri.com/job-listings-Marketing-Executive-West-Delhi-Ayaan-HR-Consultancy-Service-Delhi-Peeragarhi-1-to-5-years-010318003703?src=jobsearchDesk&sid=15229204984982&xp=50&px=10,Marketing Executive - West Delhi,Marketing Executive - West Delhi,Ayaan HR Consultancy Service,Delhi(Peeragarhi),1-5 yrs,business development- sales strategy- marketing- sales & marketing..., ,150000 - 275000 P.A.,2018-04-04,1,5,150000,275000
https://www.naukri.com/job-listings-Search-Engine-Marketing-Thane-Labindia-Instruments-Pvt-Ltd-Thane-1-to-3-years-220917001037?src=jobsearchDesk&sid=15229205025317&xp=1&px=11,Search Engine Marketing Thane,Search Engine Marketing Thane,Labindia Instruments Pvt. Ltd,Thane,1-3 yrs,sem- search engine marketing- ppc- marin- kenshoo- netinsight- omniture..., ,Not disclosed,2018-04-03,1,3,0,0
https://www.naukri.com/job-listings-Sales-Lead-Influencer-Marketing-Zefmo-Media-Private-Limited-Delhi-5-to-10-years-300318900207?src=jobsearchDesk&sid=15229205025317&xp=2&px=11,Sales Lead - Influencer Marketing,Sales Lead - Influencer Marketing,Zefmo Media Private Limited,Delhi,5-10 yrs,Digital Marketing- Business Development- Sales Strategy- Online Advertising...,We Are Looking For 3 Talented Sales Leads To Join Our Growing Sales Force At Zefmo. Are You An ...,Not disclosed,2018-03-30,5,10,0,0
https://www.naukri.com/job-listings-Wanted-a-Marketing-Person-at-Thrissur-male-Confidential-Thrissur-1-to-3-years-170817002980?src=jobsearchDesk&sid=15229205025317&xp=3&px=11,Wanted a Marketing Person at Thrissur (male),Wanted a Marketing Person at Thrissur (male),Confidential,Thrissur,1-3 yrs,Communication Skills- marketing, ,Not disclosed,2018-04-03,1,3,0,0
https://www.naukri.com/job-listings-Digital-Sales-Manager-Senior-Manager-Influencer-Marketing-Zefmo-Media-Private-Limited-Delhi-NCR-Delhi-5-to-10-years-300318900206?src=jobsearchDesk&sid=15229205025317&xp=4&px=11,Digital Sales Manager/ Senior Manager - Influencer Marketing,Digital Sales Manager/ Senior Manager - Influencer Marketing,Zefmo Media Private Limited,Delhi NCR- Delhi,5-10 yrs,Digital Sales- Business Development- Marketing- Sales Strategy...,- We Are Growing Exponentially And Are Looking For 3 Talented Sales Leads To Join Our Sales Force. ...,Not disclosed,2018-03-30,5,10,0,0
https://www.naukri.com/job-listings-Market-Place-Executive-Caterpillar-Signs-Pvt-Ltd-Ahmedabad-1-to-5-years-140218000540?src=jobsearchDesk&sid=15229205025317&xp=5&px=11,Market Place Executive,Market Place Executive,Caterpillar Signs Pvt. Ltd.,Ahmedabad,1-5 yrs,market place executive- order processing- order management..., ,Not disclosed,2018-04-03,1,5,0,0
https://www.naukri.com/job-listings-Marketing-Executive-manager-BERCOS-Delhi-NCR-0-to-5-years-130617002570?src=jobsearchDesk&sid=15229205025317&xp=6&px=11,Marketing Executive/manager,Marketing Executive/manager,BERCOS,Delhi NCR,0-5 yrs,marketing executive- Marketing Manager- Marketing, ,Not disclosed,2018-04-03,0,5,0,0
https://www.naukri.com/job-listings-Digital-Marketing-Executive-AdmissionX-Delhi-NCR-Lajpat-Nagar-II-0-to-2-years-060318001517?src=jobsearchDesk&sid=15229205025317&xp=7&px=11,Digital Marketing Executive,Digital Marketing Executive,AdmissionX,Delhi NCR(Lajpat Nagar II),0-2 yrs,Digital Marketing- SEO- Social Media Marketing- PPC- Marketing Campaigns, ,Not disclosed,2018-04-03,0,2,0,0
https://www.naukri.com/job-listings-Senior-Manager-Sales-Marketing-Confidential-Thrissur-5-to-7-years-050617004312?src=jobsearchDesk&sid=15229205025317&xp=8&px=11,Senior Manager Sales & Marketing,Senior Manager Sales & Marketing,Confidential,Thrissur,5-7 yrs,Sales Management- Marketing- branding, ,Not disclosed,2018-04-03,5,7,0,0
https://www.naukri.com/job-listings-Marketing-Executives-Confidential-Coimbatore-Erode-Tirupur-0-to-5-years-050417000819?src=jobsearchDesk&sid=15229205025317&xp=9&px=11,Marketing Executives,Marketing Executives,Confidential,Coimbatore- Erode- Tirupur,0-5 yrs,Marketing-  sales & marketing  -  sales  -  mktg  -  selling, ,150000 - 350000 P.A.,2018-04-03,0,5,150000,350000
https://www.naukri.com/job-listings-Urgent-Hiring-outbound-Sales-international-Market-call-Anjali-ADM-Consulting-Gurgaon-Udyog-Vihar-1-to-6-years-030418009314?src=jobsearchDesk&sid=15229205025317&xp=10&px=11,Urgent Hiring-outbound Sales(international Market) call Anjali,Urgent Hiring-outbound Sales(international Market) call Anjali,ADM Consulting,Gurgaon(Udyog Vihar),1-6 yrs,Outbound Sales- US Shift- international market- Insurance- sales..., ,275000 - 425000 P.A. salary+incentive+meal+cab,2018-04-03,1,6,275000,425000
https://www.naukri.com/job-listings-Opportunity-for-Account-Management-Us-uk-Market-DATA-SOFTWARE-RESEARCH-COMPANY-PRIVATE-LIMITED-Chennai-3-to-5-years-030418008938?src=jobsearchDesk&sid=15229205025317&xp=11&px=11,Opportunity for Account Management - Us/uk Market,Opportunity for Account Management - Us/uk Market,DATA SOFTWARE RESEARCH COMPANY PRIVATE LIMITED,Chennai,3-5 yrs,Solution Sales- Account Management- Marketing- Strategy Implementation...,DSRC provides competitive compensation that is revised purely on performance- Scope for professional ...,Not disclosed,2018-04-03,3,5,0,0
https://www.naukri.com/job-listings-MBA-Fresher-Wordpress-Website-Update-Maintain-Online-Marketing-Wissen-India-Private-Ltd-Gurgaon-Udyog-Vihar-0-to-3-years-030418008867?src=jobsearchDesk&sid=15229205025317&xp=12&px=11,MBA Fresher : Wordpress Website Update & Maintain & Online Marketing,MBA Fresher : Wordpress Website Update & Maintain & Online Marketing,Wissen India Private Ltd,Gurgaon(Udyog Vihar),0-3 yrs,mba fresher- Digital Marketing- Online Marketing- Web Marketing- Marketing-..., ,200000 - 400000 P.A. Basic + Bonus + Yearly Incenti...,2018-04-03,0,3,200000,400000
https://www.naukri.com/job-listings-Manager-Marketing-Operations-Founding-Years-Learning-Solutions-Private-Limited-Mumbai-Bandra-Kurla-Complex-6-to-8-years-030418008630?src=jobsearchDesk&sid=15229205025317&xp=13&px=11,Manager Marketing & Operations,Manager Marketing & Operations,Founding Years Learning Solutions Private Limited,Mumbai(Bandra Kurla Complex),6-8 yrs,Marketing Management- Marketing Operations- Community Relations..., ,Not disclosed,2018-04-03,6,8,0,0
https://www.naukri.com/job-listings-Assistant-Marketing-Communication-Manager-Info-drive-India-Delhi-NCR-Kalkaji-2-to-4-years-030418007904?src=jobsearchDesk&sid=15229205025317&xp=14&px=11,Assistant Marketing Communication Manager,Assistant Marketing Communication Manager,Info drive India,Delhi NCR(Kalkaji),2-4 yrs,marketing communication- promotions- social media- communication management..., ,300000 - 375000 P.A.,2018-04-03,2,4,300000,375000
https://www.naukri.com/job-listings-Marketing-Executive-manager-Itinfo-Technologies-Pvt-Ltd-Delhi-Uttam-Nagar-1-0-to-2-years-030418007599?src=jobsearchDesk&sid=15229205025317&xp=15&px=11,Marketing Executive/manager,Marketing Executive/manager,Itinfo Technologies Pvt Ltd,Delhi(Uttam Nagar+1),0-2 yrs,Marketing- Sales- Events- Branding- Outbound Sales, ,150000 - 250000 P.A. Good Incentives. Best in the I...,2018-04-03,0,2,150000,250000
https://www.naukri.com/job-listings-Sales-Executive-B2B-Marketing-for-Panchkula-Connecting-Footcraft-India-Pvt-Ltd-Panchkula-2-to-5-years-030418007507?src=jobsearchDesk&sid=15229205025317&xp=16&px=11,Sales Executive B2B Marketing for Panchkula,Sales Executive B2B Marketing for Panchkula,Connecting Footcraft India Pvt. Ltd,Panchkula,2-5 yrs,b2b marketing- Tele Caller- Company Representative, ,150000 - 250000 P.A. Incentive on sale,2018-04-03,2,5,150000,250000
https://www.naukri.com/job-listings-Sr-Sales-Marketing-Executive-real-Estate-gr-noida-Location-Amaatra-Group-Greater-Noida-3-to-6-years-030418007378?src=jobsearchDesk&sid=15229205025317&xp=17&px=11,Sr. Sales & Marketing Executive-(real Estate)-gr.noida Location,Sr. Sales & Marketing Executive-(real Estate)-gr.noida Location,Amaatra Group,Greater Noida,3-6 yrs,digital marketing- online marketing- brand promotion- photoshop- seo- corel..., ,250000 - 425000 P.A.,2018-04-03,3,6,250000,425000
https://www.naukri.com/job-listings-Hiring-Young-Dynamic-Fresher-Marketing-sales-EMPORIS-Jaipur-0-to-3-years-030418006547?src=jobsearchDesk&sid=15229205025317&xp=18&px=11,Hiring Young Dynamic Fresher !!!!! ( Marketing /sales),Hiring Young Dynamic Fresher !!!!! ( Marketing /sales),EMPORIS,Jaipur,0-3 yrs,training- performance appraisal- marketing- sales- bbm- b.com- bba- mba..., ,225000 - 550000 P.A.,2018-04-03,0,3,225000,550000
https://www.naukri.com/job-listings-Digital-Marketing-Executive-AdmissionX-Delhi-NCR-Lajpat-Nagar-II-0-to-2-years-030418006050?src=jobsearchDesk&sid=15229205025317&xp=19&px=11,Digital Marketing Executive,Digital Marketing Executive,AdmissionX,Delhi NCR(Lajpat Nagar II),0-2 yrs,Digital Marketing- SEO- Social Media Marketing- PPC- Marketing Campaigns, ,Not disclosed,2018-04-03,0,2,0,0
https://www.naukri.com/job-listings-SEO-Executive-Digital-Marketing-Executive-Internet-sales-Marketing-Sleek-Infosolutions-Private-Limited-Kolkata-Salt-Lake-0-to-3-years-030418005743?src=jobsearchDesk&sid=15229205025317&xp=20&px=11,SEO Executive / Digital Marketing Executive / Internet-sales Marketing,SEO Executive / Digital Marketing Executive / Internet-sales Marketing,Sleek Infosolutions Private Limited,Kolkata(Salt Lake),0-3 yrs,seo- digital marketing- online marketing- smo- seo executive- seo manager..., ,100000 - 250000 P.A.,2018-04-03,0,3,100000,250000
https://www.naukri.com/job-listings-Digital-Marketing-Executive-Indo-American-Studies-Pvt-Ltd-Hyderabad-2-to-5-years-030418004811?src=jobsearchDesk&sid=15229205025317&xp=21&px=11,Digital Marketing Executive,Digital Marketing Executive,Indo American Studies Pvt Ltd,Hyderabad,2-5 yrs,Digital Marketing, ,Not disclosed,2018-04-03,2,5,0,0
https://www.naukri.com/job-listings-Coordinator-Marketing-Aqua-designs-india-ltd-Chennai-Kolathur-0-to-2-years-030418004724?src=jobsearchDesk&sid=15229205025317&xp=22&px=11,Coordinator - Marketing,Coordinator - Marketing,Aqua designs india ltd,Chennai(Kolathur),0-2 yrs,markeitng- Sales Coordination- marketing coordination, ,150000 - 300000 P.A.,2018-04-03,0,2,150000,300000
https://www.naukri.com/job-listings-Sales-Marketing-Executive-Industrial-AP-POLYPLAST-PVT-LTD-Delhi-NCR-Peeragarhi-1-to-6-years-030418004511?src=jobsearchDesk&sid=15229205025317&xp=23&px=11,Sales & Marketing Executive - Industrial,Sales & Marketing Executive - Industrial,AP POLYPLAST PVT. LTD.,Delhi NCR(Peeragarhi),1-6 yrs,marketing- sales- selling- industrial sales- industrial marketing..., ,150000 - 200000 P.A.,2018-04-03,1,6,150000,200000
