https://www.naukri.com/job-listings-Excellent-Opening-for-Lead-Engineer-Big-Data-with-MNC-at-Hyderabad-HR-Axis-India-Pvt-Ltd-Hyderabad-5-to-9-years-291217003033?src=jobsearchDesk&sid=15229213059681&xp=31&px=24,Excellent Opening for Lead Engineer Big Data with MNC at Hyderabad,Excellent Opening for Lead Engineer Big Data with MNC at Hyderabad,HR Axis India Pvt Ltd.,Hyderabad,5-9 yrs,Hadoop- Hive- Flume- Oozie- Hdfs- Mapreduce- Pig- HBase- Spark- YARN...,Min. 5+ years of experience on BIG Data Architecture- BIG Data - Apache Hadoop (HDFS) - Hbase / Hive / ...,Not disclosed,2018-02-21,5,9,0,0
https://www.naukri.com/job-listings-Senior-Business-Analyst-business-Intelligence-Manager-Internet-onlin-Bengaluru-2-to-6-years-280218900926?src=jobsearchDesk&sid=15229213059681&xp=32&px=24,Senior Business Analyst/business Intelligence Manager - Internet/onlin,Senior Business Analyst/business Intelligence Manager - Internet/onlin,Premium,Bengaluru,2-6 yrs,Business Analysis- Competitive Intelligence- Sales- Marketing...,  Sr Business Analyst/ Business Intelligence Manager  Overview of the job : ...,Not disclosed,2018-03-01,2,6,0,0
https://www.naukri.com/job-listings-Business-Analyst-senior-Business-Analyst-Ecommerce-Bengaluru-4-to-8-years-280218900925?src=jobsearchDesk&sid=15229213059681&xp=33&px=24,Business Analyst/senior Business Analyst - Ecommerce,Business Analyst/senior Business Analyst - Ecommerce,Premium,Bengaluru,4-8 yrs,Business Process Analysis- Customer Segmentation- Business Modeling...,The senior business analyst is a trained individual whose role is to over-see the business process ...,Not disclosed,2018-03-01,4,8,0,0
https://www.naukri.com/job-listings-Data-Engineer-Delhi-StriveX-Consulting-Pvt-Ltd-Delhi-NCR-2-to-5-years-270218007668?src=jobsearchDesk&sid=15229213059681&xp=34&px=24,Data Engineer  ( Delhi ),Data Engineer  ( Delhi ),StriveX Consulting Pvt. Ltd,Delhi NCR,2-5 yrs,MySQL- JSON- Data Science- Python- NoSQL- XML- SQL- Machine Learning...,Client  RBI registered NBFC- is a technology enabled on-line lending platform established to provide ...,1000000 - 1200000 P.A.,2018-03-01,2,5,1000000,1200000
https://www.naukri.com/job-listings-Sr-Business-Analyst-banking-Wealth-Management-Exp-TRH-Consultancy-Services-Greater-Noida-10-to-18-years-261116900835?src=jobsearchDesk&sid=15229213059681&xp=35&px=24,Sr Business Analyst (banking & Wealth Management Exp),Sr Business Analyst (banking & Wealth Management Exp),TRH Consultancy Services,Greater Noida,10-18 yrs,Business Analyst- senior Business Analyst- research- data collection..., Responsibility    Support customers and prospects in Investment management industry ...,Not disclosed,2018-02-06,10,18,0,0
https://www.naukri.com/job-listings-Senior-Principal-Engineer-Analytics-Big-Data-Mobile-App-Startup-Delhi-NCR-Mumbai-Bengaluru-5-to-10-years-260218902069?src=jobsearchDesk&sid=15229213059681&xp=36&px=24,Senior/ Principal Engineer - Analytics - Big Data - Mobile App Startup,Senior/ Principal Engineer - Analytics - Big Data - Mobile App Startup,Premium,Delhi NCR- Mumbai- Bengaluru,5-10 yrs,Big Data- NLP- machine leaning- Analytics- algorithms- hadoop- cassandra...,Looking for Senior and Principal Engineers in Analytics team of an exciting Mobile App startup. ...,Not disclosed,2018-02-26,5,10,0,0
https://www.naukri.com/job-listings-Business-Analyst-Data-Analytics-Ecommerce-Bengaluru-2-to-4-years-260218900154?src=jobsearchDesk&sid=15229213059681&xp=37&px=24,Business Analyst - Data Analytics - Ecommerce,Business Analyst - Data Analytics - Ecommerce,Premium,Bengaluru,2-4 yrs,Sales Forecasting- Business Analysis- Data Analytics- Data Analysis...,As a Business Analyst you will work closely with the Functional Heads and will be the expert & go-to ...,Not disclosed,2018-02-27,2,4,0,0
https://www.naukri.com/job-listings-Business-Analyst-enterprise-Dedupe-Mumbai-2-to-6-years-070318901955?src=jobsearchDesk&sid=15229213059681&xp=38&px=24,Business Analyst-enterprise Dedupe,Business Analyst-enterprise Dedupe,Premium,Mumbai,2-6 yrs,UAT- Data Analysis- Business Process- IT Governance- KYC- SQL- Duplication-...,1. The candidate should be able to understand the business process and user requirements- document- and ...,Not disclosed,2018-03-07,2,6,0,0
https://www.naukri.com/job-listings-Business-Analyst-Senior-Business-Analyst-Tableau-Banking-Retail-Delhi-NCR-3-to-6-years-060318901407?src=jobsearchDesk&sid=15229213059681&xp=39&px=24,Business Analyst / Senior Business Analyst - Tableau - Banking/ Retail,Business Analyst / Senior Business Analyst - Tableau - Banking/ Retail,Premium,Delhi NCR,3-6 yrs,Tableau- Data Analytics- Data Insights Generation- SQL- Analytics- SAS,Desired Experience:  - 3-6 years of total experience of Data Analytics / Data Insights ...,Not disclosed,2018-03-08,3,6,0,0
https://www.naukri.com/job-listings-Senior-Business-Analyst-assistant-Manager-Delhi-NCR-Gurgaon-3-to-7-years-060318901212?src=jobsearchDesk&sid=15229213059681&xp=40&px=24,Senior Business Analyst/assistant Manager,Senior Business Analyst/assistant Manager,Premium,Delhi NCR- Gurgaon,3-7 yrs,Base SAS- Business Analysis- Credit Card Analytics- Logistic Regression...,The basic responsibilities of the individuals will be:   1. Daily tasks involve tracking of ...,Not disclosed,2018-03-06,3,7,0,0
https://www.naukri.com/job-listings-Business-Analyst-Lead-SQL-AND-Qliksense-Lyncis-Technologies-India-Pvt-Ltd-Bengaluru-7-to-10-years-060318002161?src=jobsearchDesk&sid=15229213059681&xp=41&px=24,Business Analyst Lead ( SQL AND Qliksense),Business Analyst Lead ( SQL AND Qliksense),Lyncis Technologies India Pvt Ltd,Bengaluru,7-10 yrs,statistical analysis- data analysis- requirement analysis...,Hi-  Greetings from Lyncis Technologies !!!  Job Location:               :Bangalore ...,Not disclosed,2018-03-08,7,10,0,0
https://www.naukri.com/job-listings-Specialist-HCL-Technologies-Limited-Bengaluru-2-to-3-years-150218900143?src=jobsearchDesk&sid=15229213059681&xp=42&px=24,Specialist,Specialist,HCL Technologies Limited,Bengaluru,2-3 yrs,competitor analysis- report preparation- lateral hiring- project design...,Data Scientist: The responsibilities and duties section is the most important part of the job ...,Not disclosed,2018-03-21,2,3,0,0
https://www.naukri.com/job-listings-Lead-Data-Engineer-Gurgaon-6-to-11-years-210218900952?src=jobsearchDesk&sid=15229213059681&xp=43&px=24,Lead - Data Engineer,Lead - Data Engineer,Premium,Gurgaon,6-11 yrs,MS SQL- SCALA- Spark- Data Integration- Java- Postgresql- Hadoop- ETL...,- Leading projects from a data engineering perspective- working with our clients to model their data ...,Not disclosed,2018-02-22,6,11,0,0
https://www.naukri.com/job-listings-Data-Engineer-Big-Data-Hadoop-Bengaluru-6-to-8-years-090218900332?src=jobsearchDesk&sid=15229213059681&xp=44&px=24,Data Engineer - Big Data / Hadoop,Data Engineer - Big Data / Hadoop,Premium,Bengaluru,6-8 yrs,Big Data- Hadoop- Data Engineer- Lambda Architecture- Mahout- SparkML- H2O-...,We are looking for a Big Data Engineer who will work on the collecting- storing- processing- and ...,Not disclosed,2018-02-12,6,8,0,0
https://www.naukri.com/job-listings-SAS-Visual-Analytics-Engineer-Data-Warehousing-Mumbai-3-to-8-years-230218901521?src=jobsearchDesk&sid=15229213059681&xp=45&px=24,SAS Visual Analytics Engineer - Data Warehousing,SAS Visual Analytics Engineer - Data Warehousing,Premium,Mumbai,3-8 yrs,SAS SQL- Base SAS- Excel- Data Analysis- VBA- Analytics- Data Warehousing..., Job Detail  :   1. Overall IT Experience 3-8 years  2. Relevant Reporting ...,Not disclosed,2018-02-23,3,8,0,0
https://www.naukri.com/job-listings-Senior-Specialist-Etl-informatica-big-Data-Gurgaon-8-to-10-years-280218901237?src=jobsearchDesk&sid=15229213059681&xp=46&px=24,Senior Specialist - Etl/informatica/big Data,Senior Specialist - Etl/informatica/big Data,Premium,Gurgaon,8-10 yrs,data integration- etl- data modeling- data warehousing- data quality...,Role Summary :  - The role is for an Informatica ETL Designer with strong knowledge of ...,Not disclosed,2018-03-06,8,10,0,0
https://www.naukri.com/job-listings-Mongo-DBA-Engineer-Big-Data-Nosql-Bengaluru-4-to-7-years-280218900477?src=jobsearchDesk&sid=15229213059681&xp=47&px=24,Mongo DBA Engineer - Big Data/ Nosql,Mongo DBA Engineer - Big Data/ Nosql,Premium,Bengaluru,4-7 yrs,nosql- mongodb- big data- database design- database administration...,Position Mongo DBA  Technical Skills 4 to 7 yrs  NoSQL database design- MongoDB cluster ...,Not disclosed,2018-02-28,4,7,0,0
https://www.naukri.com/job-listings-Sr-Data-Engineer-Hadoop-Hive-Pig-Confidential-Hyderabad-8-to-12-years-261016900298?src=jobsearchDesk&sid=15229213059681&xp=48&px=24,Sr Data Engineer - Hadoop/ Hive/ Pig,Sr Data Engineer - Hadoop/ Hive/ Pig,Confidential,Hyderabad,8-12 yrs,Data Engineer- Hadoop- Hive- Pig- SQL- No SQL- Data modeling...,- We are looking for people who has passion of working with large scale of data in a fast pace growing ...,Not disclosed,2018-02-26,8,12,0,0
https://www.naukri.com/job-listings-Data-Sciences-Engineer-Big-Data-Talpro-Delhi-NCR-Bengaluru-2-to-5-years-241016900706?src=jobsearchDesk&sid=15229213059681&xp=49&px=24,Data Sciences Engineer - Big Data,Data Sciences Engineer - Big Data,Talpro,Delhi NCR- Bengaluru,2-5 yrs,Data Sciences Engineer- Big Data- data technology- Data Management,Your Opportunity  As a part of the teams in India- you will enable an ecosystem of data driven ...,Not disclosed,2018-02-26,2,5,0,0
https://www.naukri.com/job-listings-Data-Sciences-Engineer-Big-Data-Talpro-Delhi-NCR-Bengaluru-2-to-5-years-240816901313?src=jobsearchDesk&sid=15229213059681&xp=50&px=24,Data Sciences Engineer - Big Data,Data Sciences Engineer - Big Data,Talpro,Delhi NCR- Bengaluru,2-5 yrs,Inventory Management- Big Data- Data Sciences Engineer,Your Opportunity  As a part of the teams in India- you will enable an ecosystem of data driven ...,Not disclosed,2018-02-26,2,5,0,0
https://www.naukri.com/job-listings-Big-DATA-Engineer-Mumbai-2-to-7-years-230218900041?src=jobsearchDesk&sid=15229213076173&xp=1&px=25,Big DATA Engineer,Big DATA Engineer,Premium,Mumbai,2-7 yrs,Java- Hadoop- NoSQL- Python- MySQL- MongoDB- Machine Learning- Cloudera...,Responsibility :He/She will be responsible for developing the applications based on the big data ...,Not disclosed,2018-02-26,2,7,0,0
https://www.naukri.com/job-listings-Datacenter-Engineer-for-Bangalore-Location-Techs-to-Suit-Inc-Bengaluru-5-to-10-years-120218005575?src=jobsearchDesk&sid=15229213076173&xp=2&px=25,Datacenter Engineer for Bangalore Location,Datacenter Engineer for Bangalore Location,Techs to Suit Inc,Bengaluru,5-10 yrs,VCenter- VMware Vsphere- Ucs- Hyper - V- Nexus- Switching- LAN- Data Center..., Experience (In Month):  5-10 years  Qualification:  BE  Location: ...,1000000 - 2000000 P.A.,2018-02-12,5,10,1000000,2000000
https://www.naukri.com/job-listings-Research-Scientists-ML-AI-NLP-ONS-Search-Bengaluru-10-to-17-years-220218004524?src=jobsearchDesk&sid=15229213076173&xp=3&px=25,Research Scientists  ML AI NLP,Research Scientists  ML AI NLP,ONS Search,Bengaluru,10-17 yrs,Natural Language Processing- Information Retrieval- Pattern Recognition...,Passionate about research and developing innovative technologies of interest ?  We are ...,Not disclosed,2018-02-22,10,17,0,0
https://www.naukri.com/job-listings-Big-Data-Technologies-senior-Software-Engineer-Mphasis-Limited-Bengaluru-4-to-6-years-061217900106?src=jobsearchDesk&sid=15229213076173&xp=4&px=25,Big Data Technologies -senior Software Engineer,Big Data Technologies -senior Software Engineer,Mphasis Limited,Bengaluru,4-6 yrs,test cases- test data- big data- technical design- knowledge management...,Technical Competencies:  Analysis of requirements and Develop software as per project defined ...,Not disclosed,2018-02-07,4,6,0,0
https://www.naukri.com/job-listings-Senior-Data-Engineer-SQL-Rdbms-Bengaluru-7-to-12-years-210218900017?src=jobsearchDesk&sid=15229213076173&xp=5&px=25,Senior Data Engineer - SQL/ Rdbms,Senior Data Engineer - SQL/ Rdbms,Premium,Bengaluru,7-12 yrs,SQL- Oracle RDBMS- Big Data- Unix Shell Scripting- Hadoop- Vertica- Java...,Senior Data Engineer - SQL/RDBMS (7-12 yrs)   sr. Data Engineer  - Excellent opportunity ...,Not disclosed,2018-02-21,7,12,0,0
https://www.naukri.com/job-listings-Opening-for-advance-Business-Analyst-with-Pharma-co-Pharma-Focus-Bengaluru-4-to-9-years-210218002079?src=jobsearchDesk&sid=15229213076173&xp=6&px=25,Opening for ''advance Business Analyst '' with Pharma co.,Opening for ''advance Business Analyst '' with Pharma co.,Pharma Focus,Bengaluru,4-9 yrs,business analyst- market intelligence- roi- return on investment...,We have an immediate opening for '' Advance Business Analyst '' with MNC pharma company . ...,1200000 - 1300000 P.A.,2018-02-21,4,9,1200000,1300000
https://www.naukri.com/job-listings-Big-Data-Infrastructure-Engineer-Enterprise-Development-Python-Bengaluru-7-to-12-years-200218900891?src=jobsearchDesk&sid=15229213076173&xp=7&px=25,Big Data Infrastructure Engineer - Enterprise Development - Python,Big Data Infrastructure Engineer - Enterprise Development - Python,Premium,Bengaluru,7-12 yrs,Hadoop- Spark- Machine Learning- Python- Big Data Analytics- Cassandra...,The Big Data & Analytics team is responsible for reliably ingesting high-volume streams of data from ...,Not disclosed,2018-02-21,7,12,0,0
https://www.naukri.com/job-listings-Opening-for-Sr-Business-Analyst-8-12yrs-Leading-MNC-HYD-Alp-Consulting-Ltd-Hyderabad-8-to-13-years-191217006546?src=jobsearchDesk&sid=15229213076173&xp=8&px=25,Opening for Sr. Business Analyst (8-12yrs) - Leading MNC HYD,Opening for Sr. Business Analyst (8-12yrs) - Leading MNC HYD,Alp Consulting Ltd,Hyderabad,8-13 yrs,scrum- agile- Business Analyst- data visualization- Plotly- PowerBi..., ,Not disclosed,2018-02-28,8,13,0,0
https://www.naukri.com/job-listings-Wifi-Data-Engineer-Samog-Epdg-PDSN-Mumbai-14-to-23-years-190218903092?src=jobsearchDesk&sid=15229213076173&xp=9&px=25,Wifi Data Engineer - Samog/ Epdg/ PDSN,Wifi Data Engineer - Samog/ Epdg/ PDSN,Premium,Mumbai,14-23 yrs,Networking- Planning Engineering- Service Operations- Network Planning...,Wifi Data Engineer - SaMOG/Epdg/PDSN (14-23 yrs)   We have an urgent opening for Wifi Data ...,Not disclosed,2018-02-19,14,23,0,0
https://www.naukri.com/job-listings-Staff-Engineer-Big-Data-hadoop-Bengaluru-7-to-12-years-190218900463?src=jobsearchDesk&sid=15229213076173&xp=10&px=25,Staff Engineer - Big Data/hadoop,Staff Engineer - Big Data/hadoop,Premium,Bengaluru,7-12 yrs,Big Data- Hadoop- Design Development- HDFS- Pig- Hive- HBase- Scribe...,Key Responsibilities:  - Lead the vision- design- implementation and delivery of Big Data ...,Not disclosed,2018-02-20,7,12,0,0
https://www.naukri.com/job-listings-Research-Scientist-Machine-Learning-Development-Java-C-Perl-Bengaluru-5-to-10-years-161017902416?src=jobsearchDesk&sid=15229213076173&xp=11&px=25,Research Scientist - Machine Learning Development - Java/ C++/ Perl,Research Scientist - Machine Learning Development - Java/ C++/ Perl,Premium,Bengaluru,5-10 yrs,R- Machine Learning- Python- Java- C++- Data Mining- MATLAB...,Research Scientist - Machine Learning Development - Java/ C++/ Perl/ Python/R   - PhD in CS- ...,Not disclosed,2018-02-09,5,10,0,0
https://www.naukri.com/job-listings-Machine-Learning-Scientist-Python-Java-C-Hyderabad-5-to-10-years-161017902414?src=jobsearchDesk&sid=15229213076173&xp=12&px=25,Machine Learning Scientist - Python/ Java/ C++,Machine Learning Scientist - Python/ Java/ C++,Premium,Hyderabad,5-10 yrs,Deep Learning- Java- C++- Python- Machine Learning- SQL...,Machine Learning Scientist - Python/Java/C++ (5-10 yrs)  Major responsibilities  - Use ...,Not disclosed,2018-02-09,5,10,0,0
https://www.naukri.com/job-listings-Big-Data-Engineer-C-c-Chennai-4-to-9-years-160218900266?src=jobsearchDesk&sid=15229213076173&xp=13&px=25,Big Data Engineer - C/c++,Big Data Engineer - C/c++,Premium,Chennai,4-9 yrs,C- Spark- Java- Hadoop- SCALA- Big Data- Algorithms- Elastic Search- C++...,A hardcore developer who has great software design skills and solid coding chops. The ideal candidate ...,Not disclosed,2018-02-19,4,9,0,0
https://www.naukri.com/job-listings-Team-Leader-Business-Analyst-Power-BI-Skan-Consultancy-Pvt-Ltd-Mumbai-3-to-7-years-150218007240?src=jobsearchDesk&sid=15229213076173&xp=14&px=25,Team Leader- Business Analyst- Power BI,Team Leader- Business Analyst- Power BI,Skan Consultancy Pvt. Ltd.,Mumbai,3-7 yrs,data analysis- reporting tools- analysis- data mining- business analytics...,Manage a team of Data Analysts  Develop Data Analysis Generate Business Reports Use ...,Not disclosed,2018-02-15,3,7,0,0
https://www.naukri.com/job-listings-Business-Analyst-Mancer-Consulting-Services-Pvt-Ltd-Bengaluru-1-to-4-years-150218002742?src=jobsearchDesk&sid=15229213076173&xp=15&px=25,Business Analyst,Business Analyst,Mancer Consulting Services Pvt. Ltd.,Bengaluru,1-4 yrs,business analysis- data analysis- financial modelling- business management-...,Urgent Requirement with a leading organisation for the role of Business Manager  ...,900000 - 1200000 P.A.,2018-02-16,1,4,900000,1200000
https://www.naukri.com/job-listings-Senior-Data-Engineer-Etl-sql-Gurgaon-4-to-8-years-140218900589?src=jobsearchDesk&sid=15229213076173&xp=16&px=25,Senior Data Engineer - Etl/sql,Senior Data Engineer - Etl/sql,Premium,Gurgaon,4-8 yrs,SQL- Data Warehousing- ETL Testing- Business Intelligence- Datastage- Bi...,- Minimum experience of 4 years in Business Intelligence  - Should have very good knowledge of ...,Not disclosed,2018-02-15,4,8,0,0
https://www.naukri.com/job-listings-Data-Analytics-Engineer-R-python-Mumbai-1-to-3-years-140218900055?src=jobsearchDesk&sid=15229213076173&xp=17&px=25,Data Analytics Engineer - R/python,Data Analytics Engineer - R/python,Premium,Mumbai,1-3 yrs,data analytics- Reporting- R- Python- SQL- Unit Support,Premium institute candidates are preferred  Job Description :  Job Title : Data ...,Not disclosed,2018-02-15,1,3,0,0
https://www.naukri.com/job-listings-Sr-principal-Engineer-Analytics-Big-Data-Delhi-NCR-Mumbai-Bengaluru-Chennai-5-to-10-years-130218901701?src=jobsearchDesk&sid=15229213076173&xp=18&px=25,Sr/principal Engineer - Analytics - Big Data,Sr/principal Engineer - Analytics - Big Data,Premium,Delhi NCR- Mumbai- Bengaluru- Chennai,5-10 yrs,Hadoop- NoSQL- Cassandra- Big Data- NLP- MongoDB- Machine Learning...,  Looking for Senior and Principal Engineers in Analytics team of an exciting Mobile App startup ...,Not disclosed,2018-02-15,5,10,0,0
https://www.naukri.com/job-listings-SFDC-Business-Analyst-Greater-Noida-5-to-10-years-120218901151?src=jobsearchDesk&sid=15229213076173&xp=19&px=25,SFDC Business Analyst,SFDC Business Analyst,Premium,Greater Noida,5-10 yrs,Salesforce- Life Cycle- Business Analysis- Software Development...,- 5 + years of relevant BA work experience  - Strong understanding of the Software Development ...,Not disclosed,2018-02-12,5,10,0,0
https://www.naukri.com/job-listings-Big-Data-Engineer-who-Join-Within-1-Month-Signature-Staff-Private-Limited-Bengaluru-Mumbai-2-to-5-years-120218007546?src=jobsearchDesk&sid=15229213076173&xp=20&px=25,Big Data Engineer(who Join Within 1 Month),Big Data Engineer(who Join Within 1 Month),Signature Staff Private Limited,Bengaluru- Mumbai,2-5 yrs,big data- hadoop- scala- pig- hive- Sqoop- Flume- Datastage- Spark...,    Greetings!!!  Looking for Big data+ ETL Professionals  Required: ...,800000 - 1200000 P.A.,2018-02-14,2,5,800000,1200000
https://www.naukri.com/job-listings-Data-Engineer-Python-Scala-Bengaluru-Chennai-7-to-12-years-090218901446?src=jobsearchDesk&sid=15229213076173&xp=21&px=25,Data Engineer - Python Scala,Data Engineer - Python Scala,Premium,Bengaluru- Chennai,7-12 yrs,Java- SCALA- Big Data- Hadoop- Python- Data Science- Linux- Unix- RDBMS..., Role : 	    The Data Engineer is primarily responsible for designing- prototyping ...,Not disclosed,2018-02-12,7,12,0,0
https://www.naukri.com/job-listings-Business-Intelligence-Analyst-Jaipur-4-to-8-years-070218901649?src=jobsearchDesk&sid=15229213076173&xp=22&px=25,Business Intelligence Analyst,Business Intelligence Analyst,Premium,Jaipur,4-8 yrs,data analysis- predictive analytics- cluster analysis- r- machine learning-...,Key Responsibilities: Minimum Educational Qualification  Role Summary: The Business ...,Not disclosed,2018-02-09,4,8,0,0
https://www.naukri.com/job-listings-Business-Solutions-Analyst-Textile-Bengaluru-1-to-5-years-070218901578?src=jobsearchDesk&sid=15229213076173&xp=23&px=25,Business Solutions Analyst - Textile,Business Solutions Analyst - Textile,Premium,Bengaluru,1-5 yrs,Business Research Analysis- Business Solutions- Project Execution...,- Work closely with different business partners on the execution of various projects ...,Not disclosed,2018-02-07,1,5,0,0
https://www.naukri.com/job-listings-Hiring-for-Data-Analytics-validation-Specialist-power-Bi-hyderabad-Allegis-Services-India-Pvt-Ltd-Hyderabad-3-to-6-years-060118002300?src=jobsearchDesk&sid=15229213076173&xp=24&px=25,Hiring for Data Analytics/validation Specialist(power Bi)-hyderabad,Hiring for Data Analytics/validation Specialist(power Bi)-hyderabad,Allegis Services India Pvt. Ltd.,Hyderabad,3-6 yrs,Data Analytics- Power BI- Creating dashboards- dashboards- sql, ,Not disclosed,2018-02-09,3,6,0,0
https://www.naukri.com/job-listings-Business-Analyst-Noida-2-to-4-years-050318902044?src=jobsearchDesk&sid=15229213076173&xp=25&px=25,Business Analyst,Business Analyst,Premium,Noida,2-4 yrs,business analysis- statistical analysis- data collection- sas- r..., Accountabilities- responsibilities and main duties:  Roles and Responsibilities: ...,Not disclosed,2018-03-07,2,4,0,0
https://www.naukri.com/job-listings-Test-Engineer-Hadoop-big-Data-Testing-Bengaluru-7-to-12-years-050318902038?src=jobsearchDesk&sid=15229213076173&xp=26&px=25,Test Engineer - Hadoop/big Data Testing,Test Engineer - Hadoop/big Data Testing,Premium,Bengaluru,7-12 yrs,Testng- Selenium Webdriver- Big Data- Hadoop- Test Engineering...,- Strong Hands on Automation experience in Big data eco system/ Hadoop applications/dashboard using ...,Not disclosed,2018-03-07,7,12,0,0
https://www.naukri.com/job-listings-Opportunity-for-Big-Data-Engineer-Position-in-Bangalore-Arnold-Consulting-Private-Limited-Bengaluru-4-to-6-years-050318007703?src=jobsearchDesk&sid=15229213076173&xp=27&px=25,Job Opportunity for Big Data Engineer Position in Bangalore,Job Opportunity for Big Data Engineer Position in Bangalore,Arnold Consulting Private Limited,Bengaluru,4-6 yrs,Hadoop- Spark- Hive- Big Data- NoSQL- SQL- Python- AWS- Real time streaming..., ,Not disclosed,2018-03-05,4,6,0,0
https://www.naukri.com/job-listings-Urgent-Opening-Data-Center-Engineer-Mumbai-Net-Connect-Pvt-Ltd-Mumbai-1-to-5-years-050318005034?src=jobsearchDesk&sid=15229213076173&xp=28&px=25,Urgent Opening :: Data Center Engineer :: Mumbai,Urgent Opening :: Data Center Engineer :: Mumbai,Net Connect Pvt Ltd,Mumbai,1-5 yrs,Data Center- Data Center Operations- Server Monitoring...,Dear Candidate-    We have an Urgent Opening for Data Center Engineer- with one of ...,50000 - 300000 P.A.,2018-03-05,1,5,50000,300000
https://www.naukri.com/job-listings-Data-Warehousing-Engineer-Ecommerce-Domain-Delhi-NCR-3-to-6-years-050318004787?src=jobsearchDesk&sid=15229213076173&xp=29&px=25,Data Warehousing Engineer - Ecommerce Domain,Data Warehousing Engineer - Ecommerce Domain,Premium,Delhi NCR,3-6 yrs,Hadoop- Hive- Impala- SQL Server- YARN- MongoDB- MySQL- Big Data- AWS- Pig,Data Warehousing Engineer - eCommerce Domain (3-6 yrs)  Primary responsibilities : ...,Not disclosed,2018-03-07,3,6,0,0
https://www.naukri.com/job-listings-Data-Engineer-Data-Infrastructure-Chennai-4-to-8-years-050218901087?src=jobsearchDesk&sid=15229213076173&xp=30&px=25,Data Engineer - Data Infrastructure,Data Engineer - Data Infrastructure,Premium,Chennai,4-8 yrs,Data Quality- Airflow- Hive- Spark- Kafka- Storm- Postgres- Redshift...,Job Responsibilities :  - Build- refine- tune- and maintain our real-time and batch data ...,Not disclosed,2018-02-06,4,8,0,0
https://www.naukri.com/job-listings-Data-Engineer-Machine-Learning-Mumbai-2-to-6-years-050218900105?src=jobsearchDesk&sid=15229213076173&xp=31&px=25,Data Engineer - Machine Learning,Data Engineer - Machine Learning,Premium,Mumbai,2-6 yrs,Hive- Oozie- Hdfs- Mapreduce- Spark- NoSQL- Pig- HBase- YARN- Java- Storm...,Your Role :  - As an integral part of the Data Engineering team- be involved in the entire ...,Not disclosed,2018-02-06,2,6,0,0
https://www.naukri.com/job-listings-Data-Scientist-Graph-Aera-Technology-Pune-2-to-5-years-300318500256?src=jobsearchDesk&sid=15229213076173&xp=32&px=25,Data Scientist - Graph,Data Scientist - Graph,Aera Technology,Pune,2-5 yrs,Supply chain- Analytical- Business operations- Data mining..., ,Not disclosed,2018-03-30,2,5,0,0
https://www.naukri.com/job-listings-Data-Engineer-Apple-Pie-Consulting-Hr-Services-Bengaluru-2-to-3-years-220317900900?src=jobsearchDesk&sid=15229213076173&xp=33&px=25,Data Engineer,Data Engineer,Apple Pie Consulting & Hr Services,Bengaluru,2-3 yrs,Data Analysis- Data Mining- Machine Learning- Statistical Analysis,Job Description : We are looking for a data engineer who will help us make sense of the vast amount ...,Not disclosed,2018-02-28,2,3,0,0
https://www.naukri.com/job-listings-Business-Analyst-sales-Operations-Analyst-Mumbai-3-to-6-years-220218901416?src=jobsearchDesk&sid=15229213076173&xp=34&px=25,Business Analyst/sales Operations Analyst,Business Analyst/sales Operations Analyst,Premium,Mumbai,3-6 yrs,Sales Operations- Marketing- Competitive Analysis- Business Analysis...,The Business Analyst will work with the Senior Business team to support business planning & analysis. ...,Not disclosed,2018-02-22,3,6,0,0
