https://www.naukri.com/job-listings-Great-Opportunity-for-Big-Data-Engineers-3-8-Years-chennai-ENQOS-SOFTWARE-TECHNOLOGIES-PRIVATE-LIMITED-Chennai-3-to-8-years-050318004176?src=jobsearchDesk&sid=15229212959613&xp=7&px=17,Great Opportunity for Big Data Engineers-[3-8 Years]-chennai,Great Opportunity for Big Data Engineers-[3-8 Years]-chennai,ENQOS SOFTWARE TECHNOLOGIES PRIVATE LIMITED,Chennai,3-8 yrs,c- hadoop- java- algorithms- elastic search- software design- big data...,Want to work at a company where you could be part of building the next big thing?  If you have ...,1000000 - 2000000 P.A.,2018-03-05,3,8,1000000,2000000
https://www.naukri.com/job-listings-Data-Science-Engineer-Python-Ruby-on-Rails-Axcelovate-Bengaluru-6-to-8-years-010318900751?src=jobsearchDesk&sid=15229212959613&xp=8&px=17,Data Science Engineer - Python/ Ruby on Rails,Data Science Engineer - Python/ Ruby on Rails,Axcelovate,Bengaluru,6-8 yrs,Machine Learning- Pattern Recognition- R- Python- Data Structures...,Role: Data Science Engineer  Location: Bangalore  Experience: 6-8 yrs  One of ...,Not disclosed,2018-03-05,6,8,0,0
https://www.naukri.com/job-listings-Specialist-Data-Analytics-Information-Systems-GAMA-Management-Consultancy-Bengaluru-10-to-14-years-010318901668?src=jobsearchDesk&sid=15229212959613&xp=9&px=17,Specialist - Data Analytics - Information Systems,Specialist - Data Analytics - Information Systems,GAMA Management Consultancy,Bengaluru,10-14 yrs,R- Predictive Analytics- Machine Learning- SAS- Predictive Modeling...,Designation : Data Analytics Specialist  Function/Group : CIS - Information Systems ...,Not disclosed,2018-03-06,10,14,0,0
https://www.naukri.com/job-listings-Senior-Backend-Engineer-Data-Modeling-Fastpad-Bengaluru-2-to-6-years-010218901227?src=jobsearchDesk&sid=15229212959613&xp=10&px=17,Senior Backend Engineer - Data Modeling,Senior Backend Engineer - Data Modeling,Fastpad,Bengaluru,2-6 yrs,Data Modeling- API design- backend- test engineering- API...,The work :  - Oversee a group of top-tier developers creating the backbone infrastructure of our ...,Not disclosed,2018-02-05,2,6,0,0
https://www.naukri.com/job-listings-Software-Engineer-Big-Data-Analytics-Cloud-AI-Rockmetric-Startup-Mumbai-2-to-4-years-010318901180?src=jobsearchDesk&sid=15229212959613&xp=11&px=17,Software Engineer ( Big Data Analytics Cloud AI ),Software Engineer ( Big Data Analytics Cloud AI ),Rockmetric - Startup,Mumbai,2-4 yrs,Javascript- Java- OOP- Ajax- Algorithms- Bootstrap- Html5- PHP- XML...,Job Description:   	Proficiency in design patterns- database design- data structures and ...,Not disclosed,2018-03-06,2,4,0,0
https://www.naukri.com/job-listings-Junior-Product-Engineer-Big-Data-Analytics-Cloud-AI-Startup-Rockmetric-Mumbai-2-to-4-years-010318002940?src=jobsearchDesk&sid=15229212959613&xp=12&px=17,Junior Product Engineer ( Big Data Analytics Cloud AI ),Junior Product Engineer ( Big Data Analytics Cloud AI ),Startup - Rockmetric,Mumbai,2-4 yrs,Javascript- Ajax- MySQL- Java- PHP- React.Js- Html5...,  Job Description:    	Proficiency in design patterns- database design- data ...,Not disclosed,2018-03-06,2,4,0,0
https://www.naukri.com/job-listings-Product-Engineer-Big-Data-Analytics-Cloud-AI-Startup-Rockmetric-Mumbai-4-to-6-years-010318002911?src=jobsearchDesk&sid=15229212959613&xp=13&px=17,Product Engineer ( Big Data Analytics Cloud AI ),Product Engineer ( Big Data Analytics Cloud AI ),Startup - Rockmetric,Mumbai,4-6 yrs,Javascript- Ajax- MySQL- Java- Bootstrap- PHP- React.Js- Html5...,  Job Description:    Possesses deep understanding of web application development ...,Not disclosed,2018-03-06,4,6,0,0
https://www.naukri.com/job-listings-Big-Data-Engineer-HDFC-Standard-Life-Insurance-Company-Ltd-Mumbai-10-to-15-years-010218007125?src=jobsearchDesk&sid=15229212959613&xp=14&px=17,Big Data Engineer,Big Data Engineer,HDFC Standard Life Insurance Company Ltd,Mumbai,10-15 yrs,Hadoop- Hive- Pig- HBase- Mapreduce- Impala- Hdfs- Spark- NoSQL- Big Data, Job description:     Selecting and integrating Big Data tools and frameworks ...,Not disclosed,2018-02-05,10,15,0,0
https://www.naukri.com/job-listings-Individual-Contributor-Big-Data-Engineer-Tier-1-College-Resourceweaver-Bengaluru-8-to-13-years-010218006770?src=jobsearchDesk&sid=15229212959613&xp=15&px=17,Individual Contributor Big Data Engineer - Tier 1 College,Individual Contributor Big Data Engineer - Tier 1 College,Resourceweaver,Bengaluru,8-13 yrs,hive- hadoop- flume- oozie- spark- mapreduce- cloudera- hdfs- nosql- hbase-..., CANDIATE PROFILE  :  Java - Scala- python- bigdata- Hadoop- Scoop- Spark- Kafka- Oozie- zeppelin- ...,Not disclosed,2018-02-05,8,13,0,0
https://www.naukri.com/job-listings-Program-Manager-Reference-Data-Business-Analyst-Capital-Market-Black-Turtle-Mumbai-12-to-17-years-010218005624?src=jobsearchDesk&sid=15229212959613&xp=16&px=17,Program Manager - Reference Data - Business Analyst - Capital Market,Program Manager - Reference Data - Business Analyst - Capital Market,Black Turtle,Mumbai,12-17 yrs,reference data- fixed income- business analysis- futures- equity- options...,Program Manager - Reference Data - Business Analyst - Capital Market Domain  "Skills Required ...,Not disclosed,2018-02-05,12,17,0,0
https://www.naukri.com/job-listings-Data-Engineer-Internal-Audit-UBS-Business-Solutions-India-Pvt-Ltd-Mumbai-3-to-5-years-030418900058?src=jobsearchDesk&sid=15229212959613&xp=17&px=17,Data Engineer - Internal Audit,Data Engineer - Internal Audit,UBS Business Solutions (India) Pvt. Ltd.,Mumbai,3-5 yrs,Business Analysis- Data Analytics- Alteryx- Investment Banking- Auditing..., ,Not disclosed,2018-04-03,3,5,0,0
https://www.naukri.com/job-listings-Business-Intelligent-Analyst-AIG-Analytics-Services-Private-Limited-Bengaluru-4-to-6-years-030418900227?src=jobsearchDesk&sid=15229212959613&xp=18&px=17,Business Intelligent Analyst,Business Intelligent Analyst,AIG Analytics & Services Private Limited,Bengaluru,4-6 yrs,SQL- Statistical Analysis- Clarity- R- Analytics- Data Visualization- Excel..., ,Not disclosed,2018-04-03,4,6,0,0
https://www.naukri.com/job-listings-Business-Analyst-Mountain-Trail-Foods-Pvt-Ltd-CHAI-POINT-Bengaluru-1-to-3-years-030418001860?src=jobsearchDesk&sid=15229212959613&xp=19&px=17,Business Analyst,Business Analyst,Mountain Trail Foods Pvt. Ltd. (CHAI POINT),Bengaluru,1-3 yrs,it- data visualization- technical writing- business analysis...,JOB BRIEF: We are looking for a Business Analyst who will be the vital link between our information ...,200000 - 350000 P.A.,2018-04-03,1,3,200000,350000
https://www.naukri.com/job-listings-Prospecting-Data-Specialist-Gartner-India-Research-Advisory-Services-Pvt-Ltd-Gurgaon-1-to-3-years-030418900633?src=jobsearchDesk&sid=15229212959613&xp=20&px=17,Prospecting Data Specialist,Prospecting Data Specialist,Gartner India Research & Advisory Services Pvt Ltd,Gurgaon,1-3 yrs,MS Office- Prospecting- English- Email- Service level- Support- Writing...,Description    Support requests for company and contact information through completion of individual ...,Not disclosed,2018-04-03,1,3,0,0
https://www.naukri.com/job-listings-Opening-for-Freshers-Business-Analyst-Fly-On-IT-India-Pvt-Ltd-Delhi-0-to-1-years-030418008783?src=jobsearchDesk&sid=15229212959613&xp=21&px=17,Opening for Freshers - Business Analyst,Opening for Freshers - Business Analyst,Fly On IT India Pvt. Ltd,Delhi,0-1 yrs,freshers- Business Analyst- Business Analysis- communication skills..., ,Not disclosed,2018-04-03,0,1,0,0
https://www.naukri.com/job-listings-RPA-Lead-Ericsson-Gurgaon-7-to-10-years-071217900172?src=jobsearchDesk&sid=15229212959613&xp=22&px=17,RPA Lead,RPA Lead,Ericsson,Gurgaon,7-10 yrs,RPA Lead- RPA- VBA- SAP- TSQL- Dot Net- SQL Server- ETL- Data Warehouse,Position Summary We are seeking a strong candidate with experience of advance automation capabilities in ...,Not disclosed,2018-04-03,7,10,0,0
https://www.naukri.com/job-listings-Marketing-Analytics-Lead-Band-D-Allstate-Solutions-Private-Limited-Bengaluru-9-to-10-years-030418901199?src=jobsearchDesk&sid=15229212959613&xp=23&px=17,Marketing Analytics Lead - Band D,Marketing Analytics Lead - Band D,Allstate Solutions Private Limited,Bengaluru,9-10 yrs,Predictive Analytics- Machine Learning- Data Science...,Job Summary: The successful applicant will:      Lead the Data Science charter for the ...,Not disclosed,2018-04-03,9,10,0,0
https://www.naukri.com/job-listings-Cloud-Data-Engineer-Manager-Contract-EYGBS-India-Private-Limited-Bengaluru-10-to-14-years-030418901045?src=jobsearchDesk&sid=15229212959613&xp=24&px=17,Cloud Data Engineer - Manager ( Contract),Cloud Data Engineer - Manager ( Contract),EYGBS (India) Private Limited,Bengaluru,10-14 yrs,Cloud Data Engineer- NoSQL- Data Processing- Java- Scala- Python- Cloudera-...,Manager in the IT Advisory Services team to lead the delivery of projects for our customers across the ...,Not disclosed,2018-04-03,10,14,0,0
https://www.naukri.com/job-listings-AI-Architect-AppMix-Technologies-Pvt-Ltd-Mumbai-Mumbai-Suburbs-3-to-8-years-030418008752?src=jobsearchDesk&sid=15229212959613&xp=25&px=17,AI Architect,AI Architect,AppMix Technologies Pvt Ltd,Mumbai- Mumbai Suburbs,3-8 yrs,Hadoop- Data Scientist- Python- Deep Learning- R,- Develop algorithms for given use cases
- Responsible for architecture and building ...,Not disclosed,2018-04-05,3,8,0,0
https://www.naukri.com/job-listings-Machine-Learning-Engineer-Mindstix-Software-Labs-Pvt-Ltd-Pune-Baner-0-to-2-years-030418005348?src=jobsearchDesk&sid=15229212959613&xp=26&px=17,Machine Learning Engineer,Machine Learning Engineer,Mindstix Software Labs Pvt Ltd,Pune(Baner),0-2 yrs,machine learning- nlp- neural networks- sales forecasting,What you'll get to do:  - Solve challenging real-world problems using bleeding edge technology ...,Not disclosed,2018-04-03,0,2,0,0
https://www.naukri.com/job-listings-Program-Lead-Clinical-Data-Sciences-Pfizer-Chennai-10-to-12-years-020418901422?src=jobsearchDesk&sid=15229212959613&xp=27&px=17,Program Lead- Clinical Data Sciences,Program Lead- Clinical Data Sciences,Pfizer,Chennai,10-12 yrs,due diligence- clinical data- product development- creative solutions- data..., ,Not disclosed,2018-04-03,10,12,0,0
https://www.naukri.com/job-listings-Business-Analyst-RANDSTAD-INDIA-PVT-LTD-Bengaluru-2-to-5-years-100617900237?src=jobsearchDesk&sid=15229212959613&xp=28&px=17,Business Analyst,Business Analyst,RANDSTAD INDIA PVT LTD,Bengaluru,2-5 yrs,MS Office tools- Powerpoint- Business Analyst- Word- Excel- German language...,Please find the skill set needs    Basic Qualification    B Sc /  B Com graduates ...,Not disclosed,2018-04-04,2,5,0,0
https://www.naukri.com/job-listings-Immediate-Opportunity-for-Data-Analyst-business-Analyst-in-Bangalore-CBSI-India-Pvt-Ltd-Bengaluru-4-to-8-years-020418003076?src=jobsearchDesk&sid=15229212959613&xp=29&px=17,Immediate Opportunity for Data Analyst/business Analyst in Bangalore,Immediate Opportunity for Data Analyst/business Analyst in Bangalore,CBSI India Pvt. Ltd.,Bengaluru,4-8 yrs,sql server- data architecture- data modeling- business analysis- lgd..., ,Not disclosed,2018-04-02,4,8,0,0
https://www.naukri.com/job-listings-Dsit-t-s-business-Analyst-endur-Shell-India-Markets-Private-Limited-Bengaluru-5-to-10-years-300318901142?src=jobsearchDesk&sid=15229212959613&xp=30&px=17,Dsit-t&s-business; Analyst-endur,Dsit-t&s-business; Analyst-endur,Shell India Markets Private Limited,Bengaluru,5-10 yrs,Business analysis- Tools- Analytical- Oracle- Data analysis...,Job Purpose:   The primary responsibility of the Business Analyst (BA)  is to serve as the ...,Not disclosed,2018-03-30,5,10,0,0
https://www.naukri.com/job-listings-Business-Intelligence-Analyst-etl-Schneider-Electric-India-Pvt-Ltd-Bengaluru-5-to-7-years-300318901133?src=jobsearchDesk&sid=15229212959613&xp=31&px=17,Business Intelligence Analyst (etl),Business Intelligence Analyst (etl),Schneider Electric India Pvt. Ltd.,Bengaluru,5-7 yrs,Business Intelligence Analyst- SQL- Informatica- MySQL- data visualization-...,* Job Role:  Business Intelligence Analyst (ETL)    Experience & Education:  Around 5- 7 years ...,Not disclosed,2018-03-30,5,7,0,0
https://www.naukri.com/job-listings-Business-Analyst-for-Pharma-Sector-Coimbatore-Location-Acura-solutions-Coimbatore-7-to-12-years-300318001035?src=jobsearchDesk&sid=15229212959613&xp=32&px=17,Business Analyst for Pharma Sector Coimbatore Location,Business Analyst for Pharma Sector Coimbatore Location,Acura solutions,Coimbatore,7-12 yrs,Business Analysis- requirement gathering- data gathering- UAT..., ,Not disclosed,2018-03-30,7,12,0,0
https://www.naukri.com/job-listings-big-data-Engineer-RANDSTAD-INDIA-PVT-LTD-Bengaluru-5-to-7-years-290917900531?src=jobsearchDesk&sid=15229212959613&xp=33&px=17,big data Engineer,big data Engineer,RANDSTAD INDIA PVT LTD,Bengaluru,5-7 yrs,IT Software - DBA- Datawarehousing- Software Developer,The role is to manage hadoop & mongo infrastructure life cycle (designing-  deployment- ...,Not disclosed,2018-04-04,5,7,0,0
https://www.naukri.com/job-listings-Big-Data-Testing-Engineer-Spark-Kafka-Mindtree-Limited-Bengaluru-3-to-8-years-270318902079?src=jobsearchDesk&sid=15229212959613&xp=34&px=17,Big Data Testing Engineer ( Spark / Kafka),Big Data Testing Engineer ( Spark / Kafka),Mindtree Limited,Bengaluru,3-8 yrs,Big Data Testing Engineer- SDLC- STLC- Web Services API testing...,   3+ years of testing experience   1+ years of Data Ware house and Big data ...,Not disclosed,2018-03-30,3,8,0,0
https://www.naukri.com/job-listings-Data-Warehouse-Operations-Engineer-E-I-DuPont-India-Private-Limited-Hyderabad-3-to-6-years-230218900903?src=jobsearchDesk&sid=15229212959613&xp=35&px=17,Data Warehouse Operations Engineer,Data Warehouse Operations Engineer,E I DuPont India Private Limited,Hyderabad,3-6 yrs,Oracle- Informatica- PLSQL- Teradata- Data modeling- Computer science..., ,Not disclosed,2018-03-29,3,6,0,0
https://www.naukri.com/job-listings-Urgent-Opening-for-Big-Data-Engineer-USA-Talentex-Services-Pvt-Ltd-Pune-3-to-8-years-200118003275?src=jobsearchDesk&sid=15229212959613&xp=36&px=17,Urgent Opening for Big Data Engineer- USA,Urgent Opening for Big Data Engineer- USA,Talentex Services Pvt Ltd.,Pune,3-8 yrs,big data- Hadoop- Spark- Scala- Java- Map Reduce- Sqoop,We have urgent opening for Big Data Engineer   in USA.  Candidate should have USA work visa. ...,Not disclosed,2018-04-04,3,8,0,0
https://www.naukri.com/job-listings-Business-Analyst-RANDSTAD-INDIA-PVT-LTD-Mumbai-3-to-6-years-190118900463?src=jobsearchDesk&sid=15229212959613&xp=37&px=17,Business Analyst,Business Analyst,RANDSTAD INDIA PVT LTD,Mumbai,3-6 yrs,Business Analyst- Business Analysis- Test strategy- Service Delivery...,Anyone or more of the following asset types: Equity  Extensive product knowledge in the area of ...,Not disclosed,2018-04-04,3,6,0,0
https://www.naukri.com/job-listings-Business-Analyst-senior-Business-Analyst-Xolo-BP-Enterprises-Pune-Kolkata-Ahmedabad-1-to-4-years-150318005035?src=jobsearchDesk&sid=15229212959613&xp=38&px=17,Business Analyst/senior Business Analyst,Business Analyst/senior Business Analyst,Xolo BP Enterprises,Pune- Kolkata- Ahmedabad,1-4 yrs,Business Analysis- Logistic Regression- SAS- Statistical Modeling..., ,Not disclosed,2018-04-03,1,4,0,0
https://www.naukri.com/job-listings-Data-Science-Artificial-Intelligence-Engineer-Bakkolla-Infozone-Pune-Kolkata-Ahmedabad-2-to-4-years-150318004129?src=jobsearchDesk&sid=15229212959613&xp=39&px=17,Data Science / Artificial Intelligence Engineer,Data Science / Artificial Intelligence Engineer,Bakkolla Infozone,Pune- Kolkata- Ahmedabad,2-4 yrs,Analytics- Data Science- Artificial Intelligence, ,Not disclosed,2018-04-03,2,4,0,0
https://www.naukri.com/job-listings-P-big-data-Engineer-RANDSTAD-INDIA-PVT-LTD-Delhi-4-to-6-years-100717900755?src=jobsearchDesk&sid=15229212959613&xp=40&px=17,P-big data Engineer,P-big data Engineer,RANDSTAD INDIA PVT LTD,Delhi,4-6 yrs,Technical product configuration- design- integration PHP- MySQL- HTML- C...,Development and testing of efficient data processing algorithms in a collaborative team environment ...,Not disclosed,2018-04-04,4,6,0,0
https://www.naukri.com/job-listings-BiG-Data-Engineer-PeopleStrong-HR-Services-Pvt-Ltd-Bengaluru-3-to-6-years-080716006397?src=jobsearchDesk&sid=15229212959613&xp=41&px=17,BiG Data Engineer,BiG Data Engineer,PeopleStrong HR Services Pvt. Ltd.,Bengaluru,3-6 yrs,Java- HBase- Pig- NoSQL- Ruby- Python- MongoDB- Perl- SCALA...,This is a great opportunity for a Data Engineer to accelerate an already rolling drive to data-enabled ...,Not disclosed,2018-04-04,3,6,0,0
https://www.naukri.com/job-listings-Data-Engineer-Data-Ware-House-Delhi-3-to-7-years-040418901240?src=jobsearchDesk&sid=15229212959613&xp=42&px=17,Data Engineer( Data Ware House),Data Engineer( Data Ware House),Premium,Delhi,3-7 yrs,Dat Engineer- Data Ware housing- AWS S3- google cloud storage- Kafka...,Experience : 3- 6 years of Relevant experience in Data warehousing or Data engineer ...,Not disclosed,2018-04-04,3,7,0,0
https://www.naukri.com/job-listings-Data-Engineer-new-York-for-a-Leading-Financial-Firm-only-Fovalid-H1B-Black-Turtle-India-Pvt-Ltd-United-States-U-S-8-to-13-years-040418009043?src=jobsearchDesk&sid=15229212959613&xp=43&px=17,Data Engineer-new York for a Leading Financial Firm-only Fovalid H1B,Data Engineer-new York for a Leading Financial Firm-only Fovalid H1B,Black Turtle India Pvt Ltd,United States (U.S),8-13 yrs,java- python- sql- c++- database architecture- data an- data analytics- big..., ,Not disclosed,2018-04-04,8,13,0,0
https://www.naukri.com/job-listings-Business-Analyst-for-Mumbai-client-Location-Softlogique-IT-Solutions-Pvt-Ltd-Mumbai-Suburbs-1-to-2-years-040118006583?src=jobsearchDesk&sid=15229212959613&xp=44&px=17,Business Analyst for Mumbai (client Location),Business Analyst for Mumbai (client Location),Softlogique IT Solutions Pvt Ltd,Mumbai Suburbs,1-2 yrs,business analysis- banking products- sdlc- data warehousing, ,200000 - 350000 P.A. Best in industry,2018-04-02,1,2,200000,350000
https://www.naukri.com/job-listings-ACN-Digital-Analytics-Customer-Analytics-11-Accenture-Gurgaon-4-to-8-years-300318900530?src=jobsearchDesk&sid=15229212959613&xp=45&px=17,ACN - Digital - Analytics - Customer Analytics - 11,ACN - Digital - Analytics - Customer Analytics - 11,Accenture,Gurgaon,4-8 yrs,PLSQL- Business intelligence- Algorithms- Service- Stored procedures..., ,Not disclosed,2018-03-30,4,8,0,0
https://www.naukri.com/job-listings-ACN-Digital-Analytics-Customer-Analytics-PRD-11-Accenture-Gurgaon-4-to-8-years-300318900520?src=jobsearchDesk&sid=15229212959613&xp=46&px=17,ACN - Digital - Analytics Customer Analytics - PRD- 11,ACN - Digital - Analytics Customer Analytics - PRD- 11,Accenture,Gurgaon,4-8 yrs,PLSQL- SAS- Business intelligence- Algorithms- Service- Stored procedures..., ,Not disclosed,2018-03-30,4,8,0,0
https://www.naukri.com/job-listings-UI-UX-Developer-Javascript-AngularJS-Vartemis-Pune-4-to-9-years-300318006842?src=jobsearchDesk&sid=15229212959613&xp=47&px=17,UI/ UX Developer - Javascript/ AngularJS,UI/ UX Developer - Javascript/ AngularJS,Vartemis,Pune,4-9 yrs,Javascript- HTML- CSS- Angularjs- Django- MVC- Ruby- Front End- UX...,  Responsibilities :    - Collaborate with Experience Designers to iterate on the ...,Not disclosed,2018-04-03,4,9,0,0
https://www.naukri.com/job-listings-Google-Cloud-Platform-Data-Architect-Deloitte-Hyderabad-2-to-7-years-290318900101?src=jobsearchDesk&sid=15229212959613&xp=48&px=17,Google Cloud Platform - Data Architect,Google Cloud Platform - Data Architect,Deloitte,Hyderabad,2-7 yrs,network / system administration- business analysis..., ,Not disclosed,2018-03-29,2,7,0,0
https://www.naukri.com/job-listings-Senior-JavaScript-Developer-and-Data-Visualisation-Engineer-Startup-Pin-Click-Bengaluru-3-to-6-years-050218004408?src=jobsearchDesk&sid=15229212959613&xp=49&px=17,Senior JavaScript Developer and Data Visualisation Engineer,Senior JavaScript Developer and Data Visualisation Engineer,Startup - Pin Click,Bengaluru,3-6 yrs,Javascript- Node.Js- React.Js- Cordova- Bootstrap- MongoDB- Phonegap...,  Exp: 3-6 years;   We are looking to hire a developer engineer to work on our Node.JS ...,Not disclosed,2018-02-07,3,6,0,0
https://www.naukri.com/job-listings-Sr-Solution-Analyst-Ericsson-Gurgaon-6-to-8-years-061217902105?src=jobsearchDesk&sid=15229212959613&xp=50&px=17,Sr. Solution Analyst,Sr. Solution Analyst,Ericsson,Gurgaon,6-8 yrs,sql development- financial accounting- data science- process improvement...,Employee Type      :           Regular  Position Summary We are seeking a strong candidate with ...,Not disclosed,2018-04-03,6,8,0,0
https://www.naukri.com/job-listings-Senior-Data-Manager-Clinical-Data-Sciences-Pfizer-Chennai-3-to-8-years-290318900070?src=jobsearchDesk&sid=15229212962885&xp=1&px=18,Senior Data Manager Clinical Data Sciences,Senior Data Manager Clinical Data Sciences,Pfizer,Chennai,3-8 yrs,Data Manager- Clinical Data Sciences- Data Management- GCP..., ,Not disclosed,2018-03-29,3,8,0,0
https://www.naukri.com/job-listings-Sr-Statistical-Programming-Lead-standards-Pfizer-Chennai-8-to-10-years-290318900068?src=jobsearchDesk&sid=15229212962885&xp=2&px=18,Sr Statistical Programming Lead (standards),Sr Statistical Programming Lead (standards),Pfizer,Chennai,8-10 yrs,statistical programming- software development life cycle- people management..., ROLE SUMMARY        This role will provide oversight and mentoring of hands on ...,Not disclosed,2018-03-29,8,10,0,0
https://www.naukri.com/job-listings-Senior-Front-End-Application-Developer-SAP-India-Pvt-Ltd-Bengaluru-2-to-5-years-280318901853?src=jobsearchDesk&sid=15229212962885&xp=3&px=18,Senior Front End Application Developer Job,Senior Front End Application Developer Job,SAP India Pvt.Ltd,Bengaluru,2-5 yrs,SQL- Oracle- ERP- JDBC- Sybase- Performance testing- Agile- Service...,Requisition ID: 175519  Work Area: Software - Design and Development  Expected Travel: 0  -  10 ...,Not disclosed,2018-04-02,2,5,0,0
https://www.naukri.com/job-listings-Senior-Java-Developer-full-Stack-Preferred-SAP-India-Pvt-Ltd-Bengaluru-2-to-5-years-280318901848?src=jobsearchDesk&sid=15229212962885&xp=4&px=18,Senior Java Developer (full Stack Preferred) Job,Senior Java Developer (full Stack Preferred) Job,SAP India Pvt.Ltd,Bengaluru,2-5 yrs,SQL- JDBC- Sybase- Performance testing- Agile- Service- Software design...,Requisition ID: 175520  Work Area: Software - Design and Development  Expected Travel: 0  -  10 ...,Not disclosed,2018-04-02,2,5,0,0
https://www.naukri.com/job-listings-Java-Developer-full-Stack-Preferred-SAP-India-Pvt-Ltd-Bengaluru-2-to-5-years-280318901841?src=jobsearchDesk&sid=15229212962885&xp=5&px=18,Java Developer (full Stack Preferred) Job,Java Developer (full Stack Preferred) Job,SAP India Pvt.Ltd,Bengaluru,2-5 yrs,SQL- JDBC- Sybase- Agile- Service- Software design- Procurement...,Requisition ID: 175508  Work Area: Software - Design and Development  Expected Travel: 0  -  10 ...,Not disclosed,2018-04-02,2,5,0,0
https://www.naukri.com/job-listings-Technical-Architect-Angular-JS-Gurgaon-HR-Optum-a-UnitedHealth-Group-Company-Gurgaon-8-to-13-years-270318901392?src=jobsearchDesk&sid=15229212962885&xp=6&px=18,Technical Architect - Angular JS - Gurgaon HR,Technical Architect - Angular JS - Gurgaon HR,Optum a UnitedHealth Group Company,Gurgaon,8-13 yrs,j2ee- mysql- developer- java- soa- architecture- rest- soap...,Primary Responsibilities:Be able to create technical solution for a business problem and guide its ...,Not disclosed,2018-03-30,8,13,0,0
https://www.naukri.com/job-listings-Prodapt-Hiring-Chatbot-Developers-Prodapt-Solutions-Private-Limited-Chennai-2-to-5-years-190318002087?src=jobsearchDesk&sid=15229212962885&xp=7&px=18,Prodapt Hiring Chatbot Developers,Prodapt Hiring Chatbot Developers,Prodapt Solutions Private Limited,Chennai,2-5 yrs,NLP- Machine Learning- chatbot- chat bot- Data Scientist, Dear Candidate -     Greetings from Prodapt solutions ...,400000 - 900000 P.A.,2018-04-03,2,5,400000,900000
https://www.naukri.com/job-listings-Program-Lead-Clinical-Database-Management-Pfizer-Chennai-10-to-11-years-020418901112?src=jobsearchDesk&sid=15229212962885&xp=8&px=18,Program Lead- Clinical Database Management,Program Lead- Clinical Database Management,Pfizer,Chennai,10-11 yrs,due diligence- clinical data- product development- creative solutions..., ,Not disclosed,2018-04-02,10,11,0,0
https://www.naukri.com/job-listings-Development-Lead-Scrum-Master-S-P-Capital-IQ-India-Pvt-Ltd-Hyderabad-10-to-12-years-090617900017?src=jobsearchDesk&sid=15229212962885&xp=9&px=18,Development Lead / Scrum Master,Development Lead / Scrum Master,S&P; Capital IQ (India) Pvt. Ltd,Hyderabad,10-12 yrs,Agile- Java- Web Services- Software Development- Web Technologies...,The Role: As a Data & Analytics Framework Scrum Master / Development Lead- you will be ...,Not disclosed,2018-03-29,10,12,0,0
https://www.naukri.com/job-listings-Program-Lead-Database-Management-Pfizer-Inc-Chennai-10-to-12-years-020418900739?src=jobsearchDesk&sid=15229212962885&xp=10&px=18,Program Lead- Database Management,Program Lead- Database Management,Pfizer Inc,Chennai,10-12 yrs,Project Management- SCOPE- Data Analysis- Data Management- Research..., ,Not disclosed,2018-04-02,10,12,0,0
https://www.naukri.com/job-listings-Data-Analyst-ABB-Global-Industries-and-Services-Private-Limited-Bengaluru-3-to-7-years-020418004687?src=jobsearchDesk&sid=15229212962885&xp=11&px=18,Data Analyst,Data Analyst,ABB Global Industries and Services Private Limited,Bengaluru,3-7 yrs,Data Scientist- Machine Learning- R- Python- SAS- Tableau- NLP..., ,Not disclosed,2018-04-02,3,7,0,0
