https://www.naukri.com/job-listings-Sales-and-Marketing-Executive-Skill-Mirror-Gurgaon-0-to-1-years-020418006598?src=jobsearchDesk&sid=15229205176893&xp=23&px=17,Sales and Marketing Executive,Sales and Marketing Executive,Skill Mirror,Gurgaon,0-1 yrs,Marketing- Primary Research- Secondary Research- Sales- Market Analysis...,Job Description : - identifying the market for data collection  - Creating strategies and ...,100000 - 200000 P.A.,2018-04-02,0,1,100000,200000
https://www.naukri.com/job-listings-Excellent-Opportunity-with-Reliance-Ecommerce-for-State-Marketing-Reliance-Industries-Reliance-Ecommerce-Vijayawada-6-to-11-years-020418006375?src=jobsearchDesk&sid=15229205176893&xp=24&px=17,Excellent job Opportunity with Reliance Ecommerce for State Marketing,Excellent job Opportunity with Reliance Ecommerce for State Marketing,Reliance Industries(Reliance Ecommerce),Vijayawada,6-11 yrs,Marketing Management- Sales- Brand Communication- Btl- Brand Building..., ,Not disclosed,2018-04-02,6,11,0,0
https://www.naukri.com/job-listings-Content-Writing-Digital-Marketing-Trigent-Software-Limited-Delhi-NCR-Gurgaon-0-to-2-years-020418006042?src=jobsearchDesk&sid=15229205176893&xp=25&px=17,Content Writing  Digital Marketing,Content Writing  Digital Marketing,Trigent Software Limited,Delhi NCR- Gurgaon,0-2 yrs,Digital Marketing- AdWords- Content Writing- Journalism,English Honors/Journalism/Mass comm Graduates with 0 months to 2 Years of Content Writing Experience in ...,Not disclosed,2018-04-02,0,2,0,0
https://www.naukri.com/job-listings-Campaign-Marketing-Assosiate-Cvent-India-Pvt-Ltd-Delhi-NCR-2-to-3-years-020418005890?src=jobsearchDesk&sid=15229205176893&xp=26&px=17,Campaign Marketing Assosiate,Campaign Marketing Assosiate,Cvent India Pvt. Ltd.,Delhi NCR,2-3 yrs,Marketo- HTML- Javascript- Adobe Creative Suite- Sales Operations- Cvent...,Job Description:  This position will support several sales and marketing operations teams with ...,375000 - 600000 P.A.,2018-04-02,2,3,375000,600000
https://www.naukri.com/job-listings-Sales-Manager-Marketing-Manager-Manager-Sales-Marketing-Sona-Valliappa-Textile-Pvt-Ltd-Salem-5-to-10-years-020418005450?src=jobsearchDesk&sid=15229205176893&xp=27&px=17,Sales Manager Marketing Manager Manager Sales & Marketing,Sales Manager Marketing Manager Manager Sales & Marketing,Sona Valliappa Textile Pvt Ltd,Salem,5-10 yrs,Sales Management- Marketing Management- Home Textiles- Housekeeping,Senior merchandiser who has handled production and customer with a blend of techno commercial ...,Not disclosed,2018-04-02,5,10,0,0
https://www.naukri.com/job-listings-Walk-in-Urgently-Require-Marketing-Executive-in-Kesari-Tours-Pvt-Lt-Kesari-Tours-Pvt-Ltd-Mumbai-0-to-1-years-020418004914?src=jobsearchDesk&sid=15229205176893&xp=28&px=17,Walk-in | Urgently Require Marketing Executive in Kesari Tours Pvt. Lt,Walk-in | Urgently Require Marketing Executive in Kesari Tours Pvt. Lt,Kesari Tours Pvt Ltd,Mumbai,0-1 yrs,Marketing- Media Planning- Social Media- Writing Skills,Greetings from Kesari !!!   Job Description: Must have experience in marketing field to ...,Not disclosed,2018-04-02,0,1,0,0
https://www.naukri.com/job-listings-Digital-Marketing-Manager-Innoraft-Solutions-Pvt-Ltd-Kolkata-1-to-3-years-020418004815?src=jobsearchDesk&sid=15229205176893&xp=29&px=17,Digital Marketing Manager,Digital Marketing Manager,Innoraft Solutions Pvt Ltd,Kolkata,1-3 yrs,Digital Marketing- Search Engine Marketing- Pay Per Click- Google AdWords...,More than 3 yrs in IT Industry with skill sets of Search Engine Optimization (SEO)- Search Engine ...,Not disclosed,2018-04-02,1,3,0,0
https://www.naukri.com/job-listings-Opportunity-for-Export-Marketing-Manager-Denim-Fabrics-Ashima-Limited-Ahmedabad-5-to-10-years-020418004790?src=jobsearchDesk&sid=15229205176893&xp=30&px=17,Job Opportunity for Export Marketing Manager - Denim Fabrics,Job Opportunity for Export Marketing Manager - Denim Fabrics,Ashima Limited,Ahmedabad,5-10 yrs,denim sales- denim marketing- denim fabric export marketing- denim...,Handling Fabric Marketing for denim fabrics. Develop and Implement Marketing strategies. ...,Not disclosed,2018-04-02,5,10,0,0
https://www.naukri.com/job-listings-Marketing-Sales-Director-Mumbai-Leading-Real-Estate-Start-up-Leading-International-MNC-Mumbai-10-to-15-years-020418004701?src=jobsearchDesk&sid=15229205176893&xp=31&px=17,Marketing & Sales Director - Mumbai - Leading Real Estate Start up,Marketing & Sales Director - Mumbai - Leading Real Estate Start up,Leading International MNC,Mumbai,10-15 yrs,Project- marketing- Real Estate Marketing- property marketing,The role will comprise of:     &gt; Achieve targets set by the company in relation to legal ...,Not disclosed,2018-04-02,10,15,0,0
https://www.naukri.com/job-listings-Social-Media-Marketing-Manager-Web-Mavens-Ahmedabad-Prahlad-Nagar-1-to-4-years-020418004653?src=jobsearchDesk&sid=15229205176893&xp=32&px=17,Social Media Marketing Manager,Social Media Marketing Manager,Web Mavens,Ahmedabad(Prahlad Nagar),1-4 yrs,Social Media Marketing- Search Engine Optimization- Marketing Management...,  Minimum 1 year of experience as Social Media Marketing  Should be able to manage the ...,Not disclosed,2018-04-02,1,4,0,0
https://www.naukri.com/job-listings-Head-of-Marketing-Merchandising-in-Footwear-Company-O-Hotel-Bangladesh-10-to-20-years-020418004642?src=jobsearchDesk&sid=15229205176893&xp=33&px=17,Head of Marketing & Merchandising in Footwear Company,Head of Marketing & Merchandising in Footwear Company,O Hotel,Bangladesh,10-20 yrs,Channel Sales- Marketing- Retail Merchandising- Promotions- Advertising...,Job Description / Responsibility: 1.	Direct- coordinate- control and supervise all areas of ...,Not disclosed,2018-04-02,10,20,0,0
https://www.naukri.com/job-listings-Marketing-Coordinator-for-Welding-Electrodes-Industry-Sanweld-Electrode-Delhi-West-Shalimar-Bagh-0-to-2-years-020418004296?src=jobsearchDesk&sid=15229205176893&xp=34&px=17,Marketing Coordinator for Welding Electrodes Industry,Marketing Coordinator for Welding Electrodes Industry,Sanweld Electrode,Delhi(West Shalimar Bagh ),0-2 yrs,coordination- follow ups- Database Marketing,Coordination with Marketing Team. 	Managing Filing System. 	Telephone Call attending 	co ...,Not disclosed,2018-04-02,0,2,0,0
https://www.naukri.com/job-listings-Walk-in-for-Marketing-Executive-with-Leading-Software-Company-male-Spider-Software-Pvt-ltd-Mumbai-0-to-2-years-020418002989?src=jobsearchDesk&sid=15229205176893&xp=35&px=17,Walk-in for Marketing Executive with Leading Software Company (male),Walk-in for Marketing Executive with Leading Software Company (male),Spider Software Pvt ltd,Mumbai,0-2 yrs,sales- marketing- selling- new business- negotiation- client satisfaction...,The Marketing Executive initiates and executes sales transactions of Spider software products to ...,50000 - 300000 P.A. Conveyance Allowance + Communica...,2018-04-02,0,2,50000,300000
https://www.naukri.com/job-listings-Marketing-and-Graphic-Design-Specialist-EFECO-Services-Private-Limited-Bengaluru-Mathikere-Extension-3-to-7-years-020418002960?src=jobsearchDesk&sid=15229205176893&xp=36&px=17,Marketing and Graphic Design Specialist,Marketing and Graphic Design Specialist,EFECO Services Private Limited,Bengaluru(Mathikere Extension),3-7 yrs,Banners- Photoshop- Illustrator- Graphic Designing- Adobe Creative Suite..., You will be a part of the ESCO group's global support team and provide dedicated marketing and ...,Not disclosed,2018-04-02,3,7,0,0
https://www.naukri.com/job-listings-Assistant-Manager-ORM-digital-Marketing-6-Years-Jones-Lang-LaSalle-Property-Consultants-India-Pv-t-Ltd-Gurgaon-4-to-7-years-020418002859?src=jobsearchDesk&sid=15229205176893&xp=37&px=17,Assistant Manager - ORM (digital Marketing) | 6+ Years,Assistant Manager - ORM (digital Marketing) | 6+ Years,Jones Lang LaSalle Property Consultants (India) Pv t. Ltd.,Gurgaon,4-7 yrs,online reputation management- digital marketing- orm- crisis management...,Job description 	Experience: 6+ years;  using key social media tools like Sprinklr- Meltwater- ...,Not disclosed,2018-04-02,4,7,0,0
https://www.naukri.com/job-listings-International-Marketing-Manager-US-Market-API-Hetero-Drugs-Limited-Hyderabad-8-to-13-years-020418002481?src=jobsearchDesk&sid=15229205176893&xp=38&px=17,International Marketing - Manager - US Market - API,International Marketing - Manager - US Market - API,Hetero Drugs Limited,Hyderabad,8-13 yrs,International Marketing- International Business- US Market,1.	Support function to the International Business with understanding of Pharmaceutical API Market-US ...,Not disclosed,2018-04-02,8,13,0,0
https://www.naukri.com/job-listings-Marketing-Executive-education-Industry-Dr-Bhatia-Medical-Coaching-Institute-Pvt-Ltd-Mangalore-Nagpur-3-to-5-years-020418002322?src=jobsearchDesk&sid=15229205176893&xp=39&px=17,Marketing Executive-education Industry,Marketing Executive-education Industry,Dr.Bhatia Medical Coaching Institute Pvt. Ltd.,Mangalore- Nagpur,3-5 yrs,data collection- Marketing- Educational Sales- Educational Marketing...,1)Managing Admissions 2)Achieving admission targets for your branch executing admissions ...,150000 - 300000 P.A.,2018-04-02,3,5,150000,300000
https://www.naukri.com/job-listings-Executive-Sales-Marketing-Veer-0-MetalsPvt-Ltd-Bengaluru-2-to-7-years-020418002255?src=jobsearchDesk&sid=15229205176893&xp=40&px=17,Executive Sales & Marketing,Executive Sales & Marketing,Veer-0-MetalsPvt.Ltd.,Bengaluru,2-7 yrs,Strategic Marketing- Sales Promotion- Branding- Events- Team Management...,1.	Strategic Marketing & Branding through participating in exhibitions / events for our company OEM ...,Not disclosed,2018-04-02,2,7,0,0
https://www.naukri.com/job-listings-Salesforce-Marketing-Cloud-Developer-2-to-9-Years-Bangalore-mumbai-Capgemini-Technology-Services-India-Limited-Mumbai-Bengaluru-3-to-8-years-020418002119?src=jobsearchDesk&sid=15229205176893&xp=41&px=17,Salesforce Marketing Cloud Developer - 2 to 9 Years - Bangalore/mumbai,Salesforce Marketing Cloud Developer - 2 to 9 Years - Bangalore/mumbai,Capgemini Technology Services India Limited,Mumbai- Bengaluru,3-8 yrs,sfmc- salesforce marketing cloud- sfdc marketing cloud,We are looking for Salesforce Marketing Cloud Professionals with 2 to 9 yrs experience in Bangalore/Mumba ...,Not disclosed,2018-04-02,3,8,0,0
https://www.naukri.com/job-listings-SEO-Expert-Digital-Marketing-Manager-Faststream-Technologies-Private-limited-Bengaluru-5-to-10-years-020418001912?src=jobsearchDesk&sid=15229205176893&xp=42&px=17,SEO Expert/ Digital Marketing Manager,SEO Expert/ Digital Marketing Manager,Faststream Technologies Private limited,Bengaluru,5-10 yrs,SEMrush- Moz pro,Expert in SEMrush and Moz pro  Creating Digital Marketing Strategies to optimize online traffic ...,Not disclosed,2018-04-02,5,10,0,0
https://www.naukri.com/job-listings-Digital-Marketing-Executive-VEETEE-FINE-FOODS-LTD-Sonepat-1-to-2-years-020418001379?src=jobsearchDesk&sid=15229205176893&xp=43&px=17,Digital Marketing Executive,Digital Marketing Executive,VEETEE FINE FOODS LTD,Sonepat,1-2 yrs,Digital Marketing- SEO- Google AdWords- Email Marketing- Web Analytics...,For a London based Company having operations in Europe- America and Asia & ME- requires young & ...,Not disclosed,2018-04-02,1,2,0,0
https://www.naukri.com/job-listings-Digital-Marketing-Specialist-Soft-Data-Infotech-Pvt-Ltd-Mohali-8-to-12-years-020418001302?src=jobsearchDesk&sid=15229205176893&xp=44&px=17,Digital Marketing Specialist,Digital Marketing Specialist,Soft Data Infotech Pvt. Ltd,Mohali,8-12 yrs,SEO- Pay Per Click- Digital Marketing- Search Marketing- Google AdWords..., Digital Marketing Specialist  Mohali        Job brief  ...,475000 - 900000 P.A.,2018-04-02,8,12,475000,900000
https://www.naukri.com/job-listings-Engineer-Techno-Marketing-XELENTRA-BUSINESS-SOLUTIONS-Coimbatore-0-to-1-years-020418000089?src=jobsearchDesk&sid=15229205176893&xp=45&px=17,Engineer - Techno Marketing,Engineer - Techno Marketing,XELENTRA-BUSINESS SOLUTIONS,Coimbatore,0-1 yrs,Mechatronics- Robotics- Sales Engineer- marketing engineer- sales executive..., ,125000 - 150000 P.A. + Other Benefits,2018-04-02,0,1,125000,150000
https://www.naukri.com/job-listings-General-Manager-Sales-Marketing-LAL-SWEETS-P-LTD-Bengaluru-8-to-9-years-020118005908?src=jobsearchDesk&sid=15229205176893&xp=46&px=17,General Manager Sales & Marketing,General Manager Sales & Marketing,LAL SWEETS (P) LTD,Bengaluru,8-9 yrs,Sales Management- Marketing- General Management, &gt; Wanted General Manager Sales for FMCG food Products.   &gt; Should have ...,Not disclosed,2018-03-30,8,9,0,0
https://www.naukri.com/job-listings-Tele-Marketing-Executive-TUV-AUSTRIA-INDIA-PVT-LTD-Pune-Sector-No-27A-Pradhikaran-1-to-5-years-010418000381?src=jobsearchDesk&sid=15229205176893&xp=47&px=17,Tele Marketing Executive,Tele Marketing Executive,TUV AUSTRIA ( INDIA ) PVT. LTD.,Pune(Sector No-27A Pradhikaran),1-5 yrs,Telemarketing,Requires Telecalling Executive to market the SASO Certification Services to all Indian Exporters. To ...,Not disclosed,2018-04-01,1,5,0,0
https://www.naukri.com/job-listings-Marketing-Executive-wisdom-housing-properties-pvt-ltd-Chennai-2-to-4-years-010418000233?src=jobsearchDesk&sid=15229205176893&xp=48&px=17,Marketing Executive,Marketing Executive,wisdom housing & properties pvt ltd,Chennai,2-4 yrs,Marketing- Sales- Promotions- Client Meeting- client interaction...,Appointing agents- meeting promoters- out door sales activity- corporate client meeting-digital ...,225000 - 600000 P.A.,2018-04-01,2,4,225000,600000
https://www.naukri.com/job-listings-Tele-Marketing-Executive-Uratech-India-private-limited-Coimbatore-2-to-5-years-010418000092?src=jobsearchDesk&sid=15229205176893&xp=49&px=17,Tele Marketing Executive,Tele Marketing Executive,Uratech India private limited,Coimbatore,2-5 yrs,Telemarketing- telecaller- telecaller female- tele marketing executive...,Uratech India Private limited is looking candidates for the position of Telemarketing Executive for its ...,Not disclosed,2018-04-01,2,5,0,0
https://www.naukri.com/job-listings-Urgently-Require-Marketing-Executive-for-Learning-Academy-Zirakpur-Aptech-Aviation-Hospitality-Academy-Chandigarh-Mohali-1-to-3-years-020418002853?src=jobsearchDesk&sid=15229205176893&xp=50&px=17,Urgently Require Marketing Executive for Learning Academy @ Zirakpur,Urgently Require Marketing Executive for Learning Academy @ Zirakpur,Aptech Aviation Hospitality Academy,Chandigarh- Mohali,1-3 yrs,Marketing Campaigns,Looking for Candidates with minimum of 1 year experience in Marketing.    Attractive ...,Not disclosed,2018-04-02,1,3,0,0
https://www.naukri.com/job-listings-AGM-marketing-Confidential-Delhi-NCR-12-to-15-years-010417004780?src=jobsearchDesk&sid=15229205208669&xp=1&px=18,AGM (marketing) - HO,AGM (marketing) - HO,Confidential,Delhi NCR,12-15 yrs,Gm Marketing- Direct Marketing- marketing strategies, ,Not disclosed,2018-03-30,12,15,0,0
https://www.naukri.com/job-listings-Marketing-Executive-PAN-India-Adhish-Industries-Jaipur-Jodhpur-Udaipur-0-to-5-years-310318002974?src=jobsearchDesk&sid=15229205208669&xp=2&px=18,Marketing Executive (PAN India),Marketing Executive (PAN India),Adhish Industries,Jaipur- Jodhpur- Udaipur,0-5 yrs,Sales- Marketing- sales & marketing- sales & sale..., ,100000 - 400000 P.A. Incentive (salary is Negotiable),2018-03-31,0,5,100000,400000
https://www.naukri.com/job-listings-MBA-Marketing-Fresher-reqd-for-a-Reputed-Software-co-Delhi-ncr-Saraswati-Accountants-Software-Pvt-Ltd-Delhi-NCR-0-to-1-years-310318001573?src=jobsearchDesk&sid=15229205208669&xp=3&px=18,MBA Marketing Fresher reqd for a Reputed Software co.@ Delhi/ncr,MBA Marketing Fresher reqd for a Reputed Software co.@ Delhi/ncr,Saraswati Accountants Software Pvt Ltd,Delhi NCR,0-1 yrs,Marketing- Mba- Bba- Business Generation- Mba Fresher- Bba Fresher..., ,80000 - 125000 P.A. Travelling Allowance plus Offici...,2018-03-31,0,1,80000,125000
https://www.naukri.com/job-listings-Marketing-Executive-Fresher-LinuxBean-Solutions-Pvt-Ltd-Indore-0-to-0-years-301117007806?src=jobsearchDesk&sid=15229205208669&xp=4&px=18,Marketing Executive - Fresher,Marketing Executive - Fresher,LinuxBean Solutions Pvt. Ltd.,Indore,0-0 yrs,marketing executive- sales marketing- corporate sales- software sales..., ,Not disclosed,2018-03-29,0,0,0,0
https://www.naukri.com/job-listings-IT-Market-Research-Analyst-Freshers-Welcome-Groupe-iSOURCe-Noida-NSEZ-1-0-to-2-years-300318006181?src=jobsearchDesk&sid=15229205208669&xp=5&px=18,IT Market Research Analyst - Freshers Welcome,IT Market Research Analyst - Freshers Welcome,Groupe iSOURCe,Noida(NSEZ+1),0-2 yrs,lead generation- calling- sales- tech support- marketing- presales..., ,200000 - 225000 P.A. + Performance incentives,2018-03-30,0,2,200000,225000
https://www.naukri.com/job-listings-Sales-Manager-Marketing-Manager-business-Development-Manager-Diamond-Retail-Mart-Pvt-Ltd-Allahabad-Gorakhpur-Lucknow-Varanasi-Bareilly-Agra-Aligarh-Bahraich-Jhansi-0-to-5-years-300318006101?src=jobsearchDesk&sid=15229205208669&xp=6&px=18,Sales Manager/ Marketing Manager/business Development Manager,Sales Manager/ Marketing Manager/business Development Manager,Diamond Retail Mart Pvt Ltd,Allahabad- Gorakhpur- Lucknow- Varanasi- Bareilly- Agra- Aligarh- Bahraich- Jhansi,0-5 yrs,Sales Management- Marketing Management- Business Development Management..., ,375000 - 600000 P.A.,2018-03-30,0,5,375000,600000
https://www.naukri.com/job-listings-Work-with-MNC-Company-as-Marketing-bde-post-Call-HR-Manager-Freelancer-Shanu-Kumar-Mumbai-Bengaluru-0-to-5-years-300318005543?src=jobsearchDesk&sid=15229205208669&xp=7&px=18,Work with MNC Company as Marketing/bde post . Call HR Manager,Work with MNC Company as Marketing/bde post . Call HR Manager,Freelancer Shanu Kumar,Mumbai- Bengaluru,0-5 yrs,marketing- bde- hr- human resource management- business development..., ,325000 - 825000 P.A. Good Incentives+reimburesment,2018-04-03,0,5,325000,825000
https://www.naukri.com/job-listings-Executive-Sales-Marketing-VERSIONNEXT-Mumbai-Pandurangwadi-14-Mumbai-Suburbs-1-to-2-years-300318005207?src=jobsearchDesk&sid=15229205208669&xp=8&px=18,Executive Sales & Marketing,Executive Sales & Marketing,VERSIONNEXT,Mumbai(Pandurangwadi+14)- Mumbai Suburbs,1-2 yrs,Sales Executive Activities- Marketing- B2C- B2B- Cold Calling..., ,Not disclosed,2018-03-30,1,2,0,0
https://www.naukri.com/job-listings-Begin-your-Career-in-World-Fastest-Growing-Marketing-Company-Triumph-Organisation-Jaipur-0-to-2-years-300318005071?src=jobsearchDesk&sid=15229205208669&xp=9&px=18,Begin your Career in World Fastest Growing Marketing Company ,Begin your Career in World Fastest Growing Marketing Company ,Triumph Organisation,Jaipur,0-2 yrs,Sales- marketing- business development- client servicing- Active Directory-..., ,250000 - 550000 P.A.,2018-03-30,0,2,250000,550000
https://www.naukri.com/job-listings-Marketing-Executive-PRESCRIBE-INDIA-INFO-OPC-PRIVATE-LIMITED-Bhubaneshwar-1-to-2-years-300318003301?src=jobsearchDesk&sid=15229205208669&xp=10&px=18,Marketing Executive,Marketing Executive,PRESCRIBE INDIA INFO (OPC) PRIVATE LIMITED,Bhubaneshwar,1-2 yrs,Business Development- Cold Calling- Marketing- Payment Collection, ,100000 - 200000 P.A.,2018-03-30,1,2,100000,200000
https://www.naukri.com/job-listings-Marketing-Executive-Precision-Management-Pune-0-to-2-years-300318003128?src=jobsearchDesk&sid=15229205208669&xp=11&px=18,Marketing Executive,Marketing Executive,Precision Management,Pune,0-2 yrs,fresher- corporate sales- b2b- mba marketing fresher- business development-..., ,Not disclosed,2018-03-30,0,2,0,0
https://www.naukri.com/job-listings-Management-Associate-mms-mba-or-Bms-bba-bmm-Marketing-Freshers-STELLAR-ORGANISATION-Mumbai-0-to-1-years-300318001361?src=jobsearchDesk&sid=15229205208669&xp=12&px=18,Management Associate (mms/mba or Bms/bba/bmm Marketing Freshers),Management Associate (mms/mba or Bms/bba/bmm Marketing Freshers),STELLAR ORGANISATION,Mumbai,0-1 yrs,sales- marketing- management- advertising- Business Development- branding..., ,250000 - 500000 P.A.,2018-03-30,0,1,250000,500000
https://www.naukri.com/job-listings-Marketing-Management-Freshers-mba-pgdm-mms-bms-bba-bmm-Freshers-STELLAR-ORGANISATION-Mumbai-Navi-Mumbai-0-to-2-years-300318001327?src=jobsearchDesk&sid=15229205208669&xp=13&px=18,Marketing? Management ?? Freshers??(mba/pgdm/mms/bms/bba/bmm Freshers),Marketing? Management ?? Freshers??(mba/pgdm/mms/bms/bba/bmm Freshers),STELLAR ORGANISATION,Mumbai- Navi Mumbai,0-2 yrs,sales- marketing- management- advertising- Business Development- branding..., ,250000 - 500000 P.A.,2018-03-30,0,2,250000,500000
https://www.naukri.com/job-listings-Business-Development-Marketing-Management-Opportunities-For-Freshers-STELLAR-ORGANISATION-Mumbai-0-to-1-years-300318001263?src=jobsearchDesk&sid=15229205208669&xp=14&px=18,Business Development & Marketing Management Opportunities For Freshers,Business Development & Marketing Management Opportunities For Freshers,STELLAR ORGANISATION,Mumbai,0-1 yrs,sales- marketing- management- advertising- Business Development- branding..., ,250000 - 500000 P.A.,2018-03-30,0,1,250000,500000
https://www.naukri.com/job-listings-Marketing-Manager-Kerala-ACME-CONSULTING-Kochi-Trivandrum-Thrissur-Kozhikode-Palakkad-Kottayam-8-to-12-years-300318000837?src=jobsearchDesk&sid=15229205208669&xp=15&px=18,Marketing Manager - Kerala,Marketing Manager - Kerala,ACME CONSULTING,Kochi- Trivandrum- Thrissur- Kozhikode- Palakkad- Kottayam,8-12 yrs,nabh- jci- nabl- Marketing- business development- sales..., ,400000 - 600000 P.A.,2018-03-30,8,12,400000,600000
https://www.naukri.com/job-listings-Marketing-Manager-AP-Telangana-ACME-CONSULTING-Hyderabad-Vijayawada-Visakhapatnam-8-to-12-years-300318000745?src=jobsearchDesk&sid=15229205208669&xp=16&px=18,Marketing Manager - AP & Telangana,Marketing Manager - AP & Telangana,ACME CONSULTING,Hyderabad- Vijayawada- Visakhapatnam,8-12 yrs,nabh- jci- nabl- Marketing- business development- sales..., ,400000 - 600000 P.A.,2018-03-30,8,12,400000,600000
https://www.naukri.com/job-listings-Sales-Marketing-Manager-Hatyai-Thailand-Innovative-Gloves-Co-Ltd-Thailand-5-to-10-years-300318000256?src=jobsearchDesk&sid=15229205208669&xp=17&px=18,Sales & Marketing Manager - Hatyai Thailand,Sales & Marketing Manager - Hatyai Thailand,Innovative Gloves Co:Ltd,Thailand,5-10 yrs,business development- sales- upselling- cross selling- client servicing...,  Job Role:     Approach MNC for third party sales  Stay current ...,Not disclosed,2018-03-30,5,10,0,0
https://www.naukri.com/job-listings-Marketing-sales-business-Development-Executive-WISHTO-Mumbai-0-to-2-years-290417002496?src=jobsearchDesk&sid=15229205208669&xp=18&px=18,Marketing/sales/business Development Executive,Marketing/sales/business Development Executive,WISHTO,Mumbai,0-2 yrs,Business Development- B2B Sales- Retail Sales- Direct Marketing..., ,100000 - 250000 P.A.,2018-04-02,0,2,100000,250000
https://www.naukri.com/job-listings-Manager-Sales-Marketing-FMCG-Manager-Germany-Location-Land-Abroad-Immigration-Consultancy-Services-Germany-1-to-5-years-290318008203?src=jobsearchDesk&sid=15229205208669&xp=19&px=18,Manager Sales & Marketing FMCG Manager - Germany Location,Manager Sales & Marketing FMCG Manager - Germany Location,Land Abroad Immigration Consultancy Services,Germany,1-5 yrs,Sales Management- FMCG Marketing- Selling- sale- marketing..., ,1500000 - 3000000 P.A.,2018-03-29,1,5,1500000,3000000
https://www.naukri.com/job-listings-E-Commerce-Manager-Online-Marketing-Manager-Business-Development-Mgr-UE-Autotech-I-Private-Limited-Delhi-NCR-New-Moti-Nagar-1-2-to-7-years-290318007817?src=jobsearchDesk&sid=15229205208669&xp=20&px=18,E Commerce Manager Online Marketing Manager Business Development Mgr,E Commerce Manager Online Marketing Manager Business Development Mgr,UE Autotech (I) Private Limited,Delhi NCR(New Moti Nagar+1),2-7 yrs,Sales- Business Development Management- Marketing Management..., ,225000 - 450000 P.A. Salary + Incentive + Phone All...,2018-03-29,2,7,225000,450000
https://www.naukri.com/job-listings-Sales-Advertising-Marketing-The-Millennium-Organization-Mumbai-0-to-2-years-290318007405?src=jobsearchDesk&sid=15229205208669&xp=21&px=18,Sales / Advertising/ Marketing,Sales / Advertising/ Marketing,The Millennium Organization,Mumbai,0-2 yrs,marketing strategy- brand promotion- advertising- pr- marketing management-..., ,275000 - 450000 P.A.,2018-03-29,0,2,275000,450000
https://www.naukri.com/job-listings-Corporate-Communications-Manager-marketing-Sales-Vantage-Organisation-Chennai-0-to-2-years-290318005846?src=jobsearchDesk&sid=15229205208669&xp=22&px=18,Corporate Communications Manager (marketing & Sales),Corporate Communications Manager (marketing & Sales),Vantage Organisation,Chennai,0-2 yrs,sales- marketing- management- business developement- branding- promotion..., ,250000 - 500000 P.A.,2018-03-29,0,2,250000,500000
https://www.naukri.com/job-listings-Marketing-Executive-it-Marketing-Executive-male-Himalai-IAS-Bengaluru-Kalyan-nagar-0-to-5-years-290318005385?src=jobsearchDesk&sid=15229205208669&xp=23&px=18,Marketing Executive/it Marketing Executive (male),Marketing Executive/it Marketing Executive (male),Himalai IAS,Bengaluru(Kalyan nagar),0-5 yrs,marketing- field marketing- marketing executive..., ,175000 - 300000 P.A.,2018-03-29,0,5,175000,300000
https://www.naukri.com/job-listings-Hiring-for-Marketing-Executive-ITM-Edutech-India-Limited-s-ITM-Skills-Academy-Vadodara-0-to-5-years-290318004847?src=jobsearchDesk&sid=15229205208669&xp=24&px=18,Hiring for Marketing Executive,Hiring for Marketing Executive,ITM Edutech (India) Limited's - ITM Skills Academy,Vadodara,0-5 yrs,marketing- btl- sales- business development- fresher- Mba Fresher- graduate...,We have urgent opening for Marketing Executive.  Location: Vadodara Experience: 0-5 Yrs ...,Not disclosed,2018-03-29,0,5,0,0
